English,Manx,Notes
"The year 2020 saw two milestones in what has been a lifelong passion for Peter: 60 years since an exhibition of Edwardian postcards at the Manx Museum coaxed him into the library where he has researched Manx buildings ever since, and 40 years since he penned the first newsletter for the Isle of Man Victorian Society, which he continues to this day.","Ayns 2020 va daa haghyrt mooar ayns bea Peter er nyn dayrn gys cooinaghtyn: Va 60 blein neayr’s v’eh cleaynit stiagh ayns Thie-Tashtee Vannin liorish taishbynnys jeh caartyn-post Edwardian, as 40 blein neayr’s screeu eh e chied screeuyn-naight son Sheshaght Victorian Vannin, red t’eh foast jannoo.",
"It was in 1975 that Peter was contacted by The Victorian Society of London, who asked him to assist them with a visit to the Isle of Man – he agreed, launching into what were then pioneering guided tours which inspired him to become Founding Chairman of the Isle of Man Victorian Society a year later.","Ayns 1975 ren Sheshaght Victorian Lunnin shirrey y cooney echey dy chur shilley er Ellan Vannin. Choard eh dy yannoo myr shen, as ren ny turryssyn speeideilagh ren eh leeideil daue greinnagh eh dy chur er undin Sheshaght Victorian Vannin un vlein ny sanmey.",
"Always conscious of reaching new audiences, Peter has authored booklets on Old Kirk Braddan, St Mary of the Isle, St Thomas’ Murals and two on Onchan.","Va Peter rieau aggindagh dy roshtyn magh dys feallagh noa, as t’eh er screeu lioaryn beggey mychione Shenn Cheeill Vraddan, Keeill Voirrey yn Ellan, Muralyn Keeill Homaase, as daa lioar mychione Skylley Connaghan.",
"He has written various articles and series for newspapers and journals over the years, including the weekly ‘Victorian Where is It?’ column in the Manx Star, ‘The Streets, Roads and Squares of Douglas’ in the Isle of Man Examiner (1999), articles on architectural subjects in Manx Life, The Manxman, The Manx Church Leader and Context, the journal of the Institute of Historic Building Conservation.","T’eh er screeu caghlaaghyn article son pabyryn naightyn as earish-lioaryn, goaill stiagh yn article shiaghtinoil ‘Victorian Where is It?’ ayns y Manx Star, ‘The Streets, Roads and Squares of Douglas’ ayns Isle of Man Examiner (1999), articleyn mychione cooishyn ard-obbrinagh ayns Manx Life, The Manxman, The Manx Church Leader as Context, earish-lioar yn Institute of Historic Building Conservation.",
"More recently, through his work for the Alliance of Building Conservation, he has contributed to the popular ‘Buildings at Risk’ series, launched in 2016.","T’eh er screeu son y strane dy articleyn ‘Buildings at Risk’, va lhunnit ayns 2016.",
"Peter’s voice is well-known not only on Manx Radio, where he has been a contributor for many decades – most notably as presenter of the long-running ‘Kelly’s Eye’ alongside the late David Callister – but also on BBC television and radio (World Service, BBC Radio Scotland, etc), Border Television and Channel 4.","Ta coraa Peter er ve cluinit er Radio Vannin son ymmodee bleeantyn – ren eh leeideil ‘Kelly’s Eye’ marish David Callister son ymmodee bleeantyn – as er television as radio BBC (World Service, BBC Radio Scotland, etc), Border Television as Channel 4.",
The list of societies that Peter has been involved with is also long and varied.,Ta Peter er ghobbragh marish ymmodee sheshaghtyn.,
"As a young man, he joined the Isle of Man Natural History and Antiquarian Society, the Manx Conservation Council, and the Friends of Manx Museum.","Tra v’eh aeg, ren eh joinal yn Isle of Man Natural History and Antiquarian Society, yn Manx Conservation Council, as Friends of Manx Museum.",
"He is a past Chairman and President of the Society for the Preservation of the Manx Countryside, and currently acts as their adviser.","T’eh er ve Caarliagh as Eaghtyrane yn Society for the Preservation of the Manx Countryside, as t’eh ec y traa t’ayn myr fer-coyrlee daue.",
He was a founder member of the Friends of Onchan’s Heritage and has been its Conservation Officer for 30 years.,"V’eh fer jeh ny chied olteynyn jeh Friends of Onchan’s Heritage, as t’eh er ve yn Conservation Officer son 30 bleeaney.",
"Between 1987 and 2002, he was a Tynwald-appointed member of The Advisory Council on Planning and the Environment, which involved writing up to one thousand letters per year on planning applications, as well as attending Reviews and Appeals.","Eddyr 1987 as 2002 v’eh pointit ny oltey jeh yn Advisory Council on Planning and the Environment, er-e-hon ren eh screeu ny smoo na thousane screeuyn dagh blein mychione yeearreeyn plannal, as goaill ayrn ayns chaglymyn aa-chlashtyn as peal.",
He is also a former President of the World Manx Association.,V’eh keayrt Eaghtyrane Sheshaght Vanninagh y Theihll.,
"In 1985, Peter was appointed Secretary of the Manx Heritage Foundation (now trading as Culture Vannin), and Co-ordinator for the Manx Heritage Year which took place in 1986.","Ayns 1985 va Peter pointit Screeudeyr Undinys Eiraght Vannin (ta nish goll fo Culture Vannin), as Co-oardagh Blein yn Eiraght ayns 1986.",
His inspirational work that year resulted in the formation of many of today’s heritage trusts.,Va kuse jeh ny treishtyn eiraght t’ayn nish currit er undin kyndagh rish yn obbyr yindyssagh echey y vlein shen.,
"When he retired as Secretary, he was appointed Honorary Heritage Consultant until his final retirement from the Foundation after 20 years of continuous service.","Tra hug eh seose oik y Screeudeyr, v’eh pointit Fer-Coyrlee Onnoroil son Eiraght derrey daag eh yn Undinys lurg 20 blein dy hirveish.",
In 1998 Peter was awarded the MBE for his services to conservation and the community.,Ayns 1998 hooar Peter MBE son yn obbyr echey cour freiltys as y co-phobble.,
He was appointed Captain of the Parish of Onchan in 2011 and plays an important role in keeping their website current.,"V’eh pointit Captan y Skeerey jeh Connaghan ayns 2011, as t’eh cooney dy reayll seose yn ynnyd-eggey oc.",
"Of all his achievements, it is his work on the built heritage of the Island that Peter is best known for.",She son yn obbyr echey er eiraght troggit yn Ellan smoo t’eh er enn da’n theay.,
"He is known internationally as an expert on Baillie Scott’s work in the Isle of Man, and has lectured both here and in the UK on his designs.","Ta ard-ghoo echey myr oaylagh er obbyr Baillee Scott ayns Mannin, as t’eh er loayrt my-e-kione ayns shoh as ayns y Reeriaght Unnaneyssit.",
"It is fitting that Peter has selected the Baillie Scott Village Hall in Onchan, also known as Onchan Parish Hall, as the recipient of the cheque for £500 that accompanies the award.",T’eh feer chooie dy reih Peter Halley-Balley Chione-Droghad dy gheddyn y £500 ta cheet marish yn aundyr shoh.,
"The selection panel, comprising representatives from Yn Cheshaght Ghailckagh, Yn Chruinnaght, Manx National Heritage, IOM Arts Council and Culture Vannin, was delighted to name Peter Kelly ‘Manannan’s Choice of the Year’ in recognition of his lifelong dedication to the Island’s cultural heritage, in particular the built heritage, noting that much would have been lost – both in terms of knowledge and buildings – without his remarkable contribution.","Va’n bing-teiy, goaill stiagh persoonyn shassoo ass lieh Yn Cheshaght Ghailckagh, Yn Chruinnaght, Eiraght Ashoonagh Vannin, Cooinceil ny Hellynyn Vannin, as Culture Vannin, feer vooiagh dy enmys Peter Kelly ‘Reih Bleeaney Vanannan’ son yn obbyr yeidjagh echey son eiraght cultooroil yn Ellan, er-lheh yn eiraght troggit t’ayn. Dooyrt y bing dy beagh lane er ve caillt – chammah tushtey as troggalyn – fegooish y chooney echey.",
HOW TO CONNECT WITH US,KYS DY LOAYRT ROOIN,Back cover
"ADDRESS: Fairfield House, Main Road, St John’s, Isle of Man IM4 3NA","ENMYS: Fairfield House, Main Road, St John’s, Isle of Man IM4 3NA",
Website: www.culturevannin.im,Ynnyd-eggey: www.culturevannin.im,
Email: enquiries@culturevannin.im,Email: enquiries@culturevannin.im,
"Culture Vannin is the trading name for the Manx Heritage Foundation, registered charity 333 in the Isle of Man","Ta Culture Vannin ennyn dellal Undinys Eiraght Vannin, sheshaght-yiastyllagh recortyssit 333 ayns Ellan Vannin.",
