English,Manx,Notes
Some words from our Chair,Goan y Chaairliagh,
I think the greatest strength we have shown as a charity and cultural organisation over the past year is the ability to adapt our ideas and approach to the benefit of our cultural community and the Isle of Man more widely.,Ta shin er hoilshaghey y vlein shoh kys oddys y cheshaght yiastyllagh cultooroil ain caghlaa ny saaseyn as smooinaghtyn ain dy yannoo vondeish da’n cho-phobble cultooroil as yn Ellan hene.,
"The past year has proved complicated but productive, as we have had to reassess our priorities and embrace new ways of working in light of the continuing global pandemic.","Ta’n vlein shoh er ve doillee agh speeideilagh, as ta shin er ve eginit dy ghoaill aa-smooinaghtyn er cre ta scanshoil dooin, as goaill orrin dy obbragh ayns aghtyn noa kyndagh rish y pandemic ta foast goaill niart sy theihll.",
Our #treisht2020 scheme demonstrates this ability to pivot.,Ta’n scheme #treisht2020 ain soilshaghey kys ta shin dy fondagh er n’yannoo shoh.,
"We reported on these innovative small projects initially last year, but all are now complete and online as resources and tutorials for current and future generations to enjoy: www.culturevannin.im/resources/treisht-2020-projects-647532/.","Dimraa shin ny shalleeyn beggey croodagh shoh nurree, as nish t’ad ooilley cooilleenit as ry-gheddyn er-linney dy vod ny sheelogheyn ta ry-heet goaill taitnyss ayndoo: www.culturevannin.im/resources/treisht-2020-projects-647532/.",
"The projects showed most clearly the importance of culture, heritage and the arts to people’s sense of wellbeing and identity, to a sense of future hope, and they supported the Island’s creative community and industries at a time when they needed to pull together.","Ren ny shalleeyn shoh soilshaghey dy baghtal cre cha scanshoil as ta cultoor, eiraght, as ny hellynyn da maynrys as enneeaght sleih, as da’n treishteil oc sy traa ry-heet. Ren ad cummal seose y co-phobble croodagh tra smoo va feme oc er.",
"A highlight within the year was the work of our graduate intern, Sarah Mercer, who brought climate change, Biosphere and Manx culture into dialogue with her family-friendly web-based app, Manannan’s Charms.","Va shallee feer chronnal y vlein shoh jeant liorish y graduate intern ain, Sarah Mercer, ren sniemmey cooidjagh caghlaa-emshyraght, Biosphere, as cultoor Manninagh ayns app er-linney ta cooie da’n slane lught-thie, Manannan’s Charms.",
"She also created ‘Island Utopias’, a film where words from interviews about climate change and the reaction to Covid-19 were combined with time-lapse video of artwork and a new musical score which itself drew inspiration from Manx tunes.","Chroo ee ‘Island Utopias’ neesht, film ayn ta focklyn veih quaaltyssyn mychione caghlaa-emshyraght as Covid-19 currit marish time-lapse video jeh caslyssyn ellynagh, lesh kiaull noa ta soit er carryn Manninagh.",
The result was a beautiful and thoughtful film which premiered in September: https://vimeo.com/465838450.,"She film aalin as smooinaghtagh t’ayn, haink magh ayns Mee Veanagh yn Ouyr: https://vimeo.com/465838450.",
It was also nominated for a Torc Award in the Arts category at the 2021 Celtic Media Awards.,V’eh er ny voylley son Torc Award ayns rheynn Ellynagh yn Feailley Media Celtiagh ayns 2021.,
Members of the Board always welcome the chance to support Manx culture and cultural heritage through the award of grants and underwriting.,Ta olteynyn y ving dy kinjagh booiagh son caa dy chummal seose cultoor Manninagh as eiraght cultooroil liorish cur magh toyrtyssyn as raanteenyssyn.,
"The range of applications always astonishes us, and we are happy to support festivals and events, book and research projects, the Manx language community, online engagement, and so much more.","Ta shin dy mennick goaill yindys ec yn chaghlaa dy hirraghyn ta shin geddyn, ta goaill stiagh feaillaghyn as taghyrtyssyn, lioaryn as aa-ronsaghey, y co-phobble Gaelgagh, cooishyn er-linney, as reddyn elley.",
"We were particularly impressed by the ability of some of the festivals and events to adopt a blended approach, online and physical.",Va yindys orrin dy akin yn aght schleioil ren paart jeh ny feaillaghyn as taghyrtyssyn shoh mestey cooishyn er-linney as ayns-persoon.,
"Worthy of particular mention are the volunteer committee of Yn Chruinnaght Celtic Gathering, who were able to bring the community together in much-needed live events during the break between lockdowns, whilst delivering a demanding online programme featuring all of the Celtic nations.","Sheeu imraa er-lheh y yannoo jeh bing arryltagh y Chruinnaght Celtic Gathering, ren lhiggey da’n cho-phobble cheet cooidjagh lesh taghyrtyssyn bio eddyr traaghyn fo-ghlass, choud’s livrey claare dy haghyrtyssyn er-linney ren goaill stiagh ny hashoonyn Celtiagh ooilley.",
"We supported important publications such as Narrow Road to the Deep South, which uses poetry to reflect on the historical landscape, and Manx folklore comics featuring the stories of Manannan took the Manx message to new audiences.","Ren shin cummal seose cloughyn scanshoil lhied as Narrow Road to the Deep South, ta goaill smooinaghtyn er y thalloo sy traa t’er n’gholl shaghey trooid bardaght, as comicyn mychione far-skeealyn Manninagh ren cur lhieu ny skeealyn shoh dys sleih noa.",
"Community events such as Hop tu Naa at Jurby were popular and accessible, and online engagement such as the Manx Mondays videos by a talented fiddler and Manx speaker, had an international reach.","Va taghyrtyssyn sy cho-phobble lhied as Hop tu Naa ayns Jurby feer roshtynagh as dy mooar soit jeu, as ren ny videoyn Manx Mondays liorish fiddleyr as loayreyder Gaelgagh feer schleioil roshtyn sleih ayns ymmodee cheeraghyn elley.",
"We were also delighted to be able to support the Manx language community in a wide range of projects from academic research into Manx sermons from the archives to support for Mooinjer Veggey pre-schools, Pobble’s adult immersion weekend, and a Manx pronunciation guide which will make academic research accessible to adult learners and secondary students.","Va shin booiagh dy chummal seose y co-phobble Gaelgagh lesh caghlaa dy halleeyn, goaill stiagh aa-ronsaghey academagh mychione sharmaneyn ayns Gaelg, ro-schoillyn Vooinjer Veggey, jerrey-shiaghtin thummeydagh v’er ny chummal liorish Pobble, as lioar-oayl fockley-magh ta kiarit son ynseyderyn aasit as studeyryn ard-schoill.",
"We made extra efforts to support our cultural community through the disappointment of cancelled and postponed events and projects, and hope to see them return in future, stronger than ever.","Va shin er-lheh aggindagh dy chur chooney da’n cho-phobble cultooroil lurg da taghyrtyssyn as shalleeyn ve scryssit ny currit shaghey, as ta shin treishteil dy jig ad er-ash ny stroshey na v’ad roïe.",
It is because our development officers work in partnership with our cultural community that our work has such a powerful impact.,Ta’n obbyr ain cha breeoil son ta nyn offishearyn gobbragh ayns parteeys marish y cho-phobble cultooroil.,
"We aim to focus on facilitation, encouragement and support rather than trying to deliver everything ourselves.","She dy chummal seose as dy ghreinnaghey, as cha nee dy yannoo dy-chooilley red shin hene ta’n ny ard-oyryn ain.",
The Cooish Manx language festival was a great example of this.,Va’n Chooish sampleyr mie jeh shoh.,
"In a world where we talk about the need for a genuine sense of community and connection, the Kiaull Manninagh Jiu Manx music and dance e-newsletter does the remarkable job of creating just that, not only for the Island’s musicians and dancers, but also internationally, sharing events, information, resources, and research.","Ny laghyn shoh ta shin loayrt mychione y feme rish ennaghtyn co-phobble fondagh, as ta screeuyn-naight er-linney Kiaull Manninagh Jiu cooney lesh croo eh, cha nee ynrican son kiaulleyderyn as daunseyryn ayns Mannin, agh ayns cheeraghyn elley neesht. T’eh cur fys mychione taghyrtyssyn, fysseree, as aa-ronsaghey.",
"Our online engagement as Culture Vannin is exceptional for such a small organisation, with huge reach, and so much of this is down to the passion and drive of our Online and Educational Resources Officer.","Ga dy vel Culture Vannin ny sheshaght-yiastyllagh feer veg, ta’n roshtyn ain er-linney mooar, as ta shoh ayns ayrn mooar kyndagh rish jeeanid as jeidjys yn Fer-oik son Cooid Er-Linney as Ynsaghey ain.",
"As the financial year drew to a close, officers began work on the mid-points of two strategies: the National Development Strategy for Culture and the Arts and the Manx Language Strategy, both of which require updates to their action plans in consultation with the community, as well as working partnerships with other Government funded bodies and Departments.","Myr va’n vlein argidoil tayrn gys jerrey, ghow ny fir-oik ain toshiaght dy obbraghey er ayrnyn meanagh daa Strateysh: Strateysh Bishaghey Ashoonagh son Cultoor as ny Hellynyn, as yn Strateysh son y Ghaelg. Ta claareeyn ta soieaghey magh cre shegin ve jeant cour y daa strateysh shoh feme ve caghlaait dy ghoaill stiagh yn fysserree s’noa lurg da coyrle v’er ny hirrey veih’n cho-phobble as parteeasyn-obbree eddyr rheynyn y Reiltys as co-heshaghtyn ta geddyn argid veih’n Reiltys.",
"In summary, the importance of culture, creativity and community has been amplified by the effects of the global pandemic.","Ayns focklyn giarrey, ta’n pandemic er n’yannoo cultoor, croodaght, as co-phobble eer ny scanshoil ny v’ad roïe.",
"Ensuring accessibility online and in real life, and representing the diversity of views within Manx culture and cultural heritage, will be key to our work more than ever.","Sy traa ry-heet, shegin dooin jannoo shickyr dy vel y caghlaays jeh cultoor as eiraght Manninagh er ny hoilshaghey magh dy fondagh, as dy vel eh jeant roshtynagh er-linney as ayns persoon.",
It has been my privilege and pleasure to serve as chair and I have learned so much from the people in and around this wonderful organisation.,"T’eh er ve taitnys mooar dou shirveish myr caairliagh, as ta mee er n’ynsagh lane veih sleih er cheu-sthie as cheu-mooie jeh’n cheshaght yindyssagh shoh.",
"Culture Vannin is thriving and again achievement is what shines out from the annual report’s outline of the development work, projects, grants and other activity.","Ta Culture Vannin goll veih niart gys niart, as reesht, she cooilleeney y red s’cronnal sy choontey bleinoil shoh jeh obbyr-vishee, shalleeyn, toyrtyssyn, as jannooyn elley y cheshaght.",
"Mannin aboo! Manx culture for everyone who chooses to live and work in our special island, and for those who appreciate and practise it around the world! Gura mie eu!","Mannin aboo! Cultoor Manninagh son dy-chooilley pheiagh t’er reih dy chummal er yn ellan yindyssagh ain, as son oc ooilley ta cliaghtey eh er fei-ny-cruinney! Gura mie eu!",
Christopher Thomas MHK,Christopher Thomas MHK,
"Caairliagh, Culture Vannin","Caairliagh, Culture Vannin",
The Chair’s Statement can be read in full within the Annual Accounts and Financial Statements.,Foddee Goan y Chaarliagh v’er nyn lhaih ayns y clane ayns Coontaghyn as Fockley-magh Argidoil Bleinoil.,
Development work highlights,Cooishyn Cronnal syn Obbyr-Vishee ain,
More Manx culture online means it is easy to enjoy no matter where you are in the world!,"Myr smoo dy chultoor Manninagh ta ry-gheddyn er-linney, sassey t’eh dy ghoaill greim er, cre erbee y raad t’ou sy theihll.",
Our development work aims to support and inspire not only the cultural community but everyone in the Isle of Man and beyond.,"Ta’n obbyr-vishee ain kiarit dy chummal seose as bioghey cha nee ynrican y co-phobble cultooroil, agh dy-chooilley pheiagh ayns Mannin as eer ny sodjey veih.",
"We know that people connect with Manx culture in different ways at different times, and we work to make that connection easier to fit into increasingly busy lives.","Ta fys ain dy vel sleih goaill ayrn ayns cultoor Manninagh er aghtyn elley as ec traaghyn elley, as ta shin aggindagh dy yannoo eh ny sassey daue jannoo shen lesh y vea harroogh t’ain y laa t’ayn jiu.",
Taking Manx culture online to create a sense of connection during lockdown:,Cur lesh cultoor Manninagh er-linney dy chroo ennaghtyn dy chooidjaghys ec traa yn fo-ghlass.,
"‘Capturing the absences’: we were delighted to collaborate with renowned Manx photographer, Phil Kneen, to release a series of 164 photographs which offered a unique and important record of lockdown in the Isle of Man.",‘Capturing the absences’: v’eh taitnyss dooin dy obbragh marish yn photographer ennoil Phil Kneen dy chur magh 164 dy cho-chaslyssyn ta son recortys scanshoil jeh’n fo-ghlass ayns Mannin.,
"We continued to release content from our #treisht2020 projects, including 32 music lesson and performance films, 74 audio music files, images and films, making Manx culture accessible to a wide range of learners, of all ages, abilities and learning styles.","Hannee shin dy chur magh cooid jeh ny shalleeyn #treisht2020 ain, goaill stiagh 32 lessoonyn as recortyssyn kiaullee filmit, as 74 recortyssyn sheean, caslyssyn, as filmyn, ta jannoo cultoor Manninagh roshtynagh da ynseydee cre erbee yn eash as schlei oc, ny kys share lhieu gynsaghey.",
"We made a complete recording of the national poet, T E Brown’s ‘The Doctor’.",Ren shin recortys slane jeh ‘The Doctor’ liorish y bardagh ashoonagh T. E. Brown.,
We released Manx dance tuition films online to make it easier for schools and dance groups around the world to learn steps and dances.,Hug shin filmyn cour gynsaghey daunseeyn Manninagh er-linney dy vod schoillyn as possanyn daunsey er fei-ny-cruinney gynsagh ad ny s’fondagh.,
"‘Whispering in the Trees’ was a year-long collaborative project with photographer Mark Kinrade, with 40 haunting new images visualising traditional Manx folklore.","Va ‘Whispering in the Trees’ ny shallee co-obbragh marish yn photographer Mark Kinrade, lesh 40 co-chaslys noa ta ginsh far-skeealyn Manninagh.",
"We created a lockdown collaborative video of the National Anthem in Manx, featuring singers of all ages based on and off the Isle of Man.","Chroo shin video co-obbragh jeh’n Arrane Ashoonagh ayns Gaelg marish arranee jeh caghlaaghyn eash, veih Mannin as buill elley.",
Nurturing creativity,Cummal seose croodaght,
Our young harp students performed as part of Edinburgh International Harp Festival’s virtual concerts.,Ren ny studeyrtyn aegey claasagh ain cloie ayns cuirraghyn-kiaullee er-linney jeh Feailley Eddyr-Ashoonagh Claasagh Doon-Eadjyn.,
"Our #treisht2020 projects helped develop innovate ‘Kiaull Cooyl’ backing tracks suitable for composition or improvisation, which have been used all around the world.",Va peeshyn dy chiaull cooyl jeant son #treisht2020 ta cooie son screeu kiaull ny cloie gyn-aarlaghey. Ta ymmyd er ve jeant jeu er fei-ny-cruinney.,
"We commissioned the creation of a new choral work in Manx Gaelic to celebrate the birth of St Columba for the inter-Gaelic year-long project, Colmcille1500.","Doardee shin peesh dy chiaull noa son coraaghyn ayns Gaelg ayns cooinaghtyn jeh çheet er y theihll Noo Collym son Colmcille1500, shallee un vlein.",
Marking special occasions:,Cowraghey laghyn er-lheh:,
"Our collaborative project with DESC, MNH and others marked the 75th anniversary of VE Day in the Isle of Man.","Ren shin jannoo shallee marish y DESC, MNH, as cooid elley ayns cooinaghtyn jeh’n wheiggoo vlein jeig as tree-feed neayr’s Laa VE.",
"We launched a Boaldyn competition to inspire new dances, songs and tunes themed around the May traditions in the Isle of Man.","Ren shin lhunney co-hirrey ‘Boaldyn’ dy ghreinnaghey sleih dy chroo daunseeyn, arraneyn, as carryn noa mychione tradishoonyn Mee ny Boaldyn ayns Mannin.",
"The bi-centenary of the first Manx music publication, The Mona Melodies, was celebrated by a special concert filmed in front of a live audience at Government House.","Ayns cooinaghtyn jeh’n chied lioar dy chiaull Manninagh, The Mona Melodies, va cuirrey-kiaullee er-lheh er ny chummal as filmit ayns persoon kione-fenish fakinee ec Government House.",
Listening to all our Island’s voices,Geaishtagh rish ooilley coraaaghyn yn Ellan ain,
We worked with People of Colour to record oral history conversations with young Manx people of colour reflecting on their experiences of growing up in the Isle of Man.,Dobbree shin marish People of Colour dy recortys shennaghys loayrit marish Manninee aegey nagh vel crackan bane oc as ad loayrt mychione ny cooinaghtyn oc er gaase seose ayns Mannin.,
We shared oral history interviews from a wide range of voices.,Rheynn shin recortyssyn shennaghys loayrit veih caghlaa dy choraaghyn.,
"Sharing the story of Manx culture with everyone, everywhere","Rheynn skeeal eiraght Manninagh marish dy-chooilley pheiagh, dy-chooilley voayl",
"Lockdown meant that there was a surge of international interest in Manx music, with performers and students all wanting to know more, and enjoying adding Manx music to their repertoire.","Kyndagh rish yn fo-ghlass, va mooadaghey syn earroo dy leih ayns cheeraghyn elley va geearree goaill greim er kiaull Manninagh. Va chammah cloiederyn as studeyryn booiagh dy gynsagh ny smoo dy chiaull.",
"Our Manx language lessons moved online and reached people all around the world, encouraging us to maintain a hybrid approach to our teaching.","Ren ny brastyllyn Gaelgagh ain goll er-linney as roshtyn sleih er fei-ny-cruinney. Ren shoh greinnaghey shin dy chummal rish gynsagh er yn aght shoh sy traa ry-heet, chammah’s ayns persoon.",
"Our innovative Bree weekend was able to meet in person and was a huge success, introducing school-aged children to Manx culture in a fun and engaging way.","Va shin abyl dy chummal yn jerrey shiaghtin Bree ain ayns persoon, as v’eh speeideilagh ass-towse. V’eh caa da cloan schoill cheet quail cultoor Manninagh er aght bioyr as taitnyssagh.",
We took time to develop a four-part adult language course to make it easier for people to learn in a structured and supportive way.,"Hug shin coorse noa Gaelgagh ayns kiare ayrnyn cour sleih aasit er y hoshiaght, nee jannoo eh ny sassey da sleih dy ynsagh er aght structuroil as fondagh.",
The Cooish Manx language festival offered a range of family-friendly events and activities which showed how accessible Manx is.,"Va caghlaa dy haghyrtyssyn as reddyn dy yannoo ec yn Chooish y vlein shoh va cooie da lughtyn-thie, soilshaghey cre cha roshtynagh as oddys y Ghaelg ve.",
We held Manx language Christmas song workshops to give people an accessible and fun way to access the language.,Chum shin lessoonyn er arranenyn Nollick Gaelgagh myr aght aashagh as taitnyssagh dy ghoaill toshiaght er gynsagh Gaelg.,
Helping others to learn about Manx culture,Cooney lesh sleih elley dy ynsagh mychione cultoor Manninagh,
We updated resources about folklore traditions and made them available online for free in order to support home-learning during lockdown and beyond.,"Ren shin noaghey ny couryn ain mychione cliaghtaghyn as far-skeealyn Manninagh as cur ad er-linney nastee cour sleih ta gynsagh voish yn thie choud’s va shin fo-ghlass, as son ymmyd sy traa ry-heet.",
"We gave translation support to Anne Cakebread’s Teach Your Cat Manx, which takes the Manx language to new audiences.",,Not translated in the original
Our monthly column in the Manx Independent told the stories of Manx music and associated traditions.,,Not translated in the original
"Regular newsletters for Manx music and dance and for the Manx language shared news, happenings, resources, and new research, to keep people up-to-date and to share a sense of community.","Hug shin magh screeunyn-naight mychione kiaull as daunsey Manninagh dy chur fys da sleih mychione naightyn, taghyrtyssyn, cooid-ynsee, as aa-ronsaghey noa, as dy chummal seose ennaghtyn dy cho-phobble.",
We published books such as:,Hug shin magh lioaryn lhied as:,
Paul Lebiedzinski’s selected poems: Until the Manxmen are driven away,Reih bardaght liorish Paul Lebiedzinski: Until the Manxmen are driven away,
Jeelane Tootagh – Diary of a Wimpy Kid by Jeff Kinney – translated into Manx,Jeelane Tootagh – Diary of a Wimpy Kid liorish Jeff Kinney er ny hyndaa dys Gaelg,
A success story for the Manx language,Skeeal dy speeideilys son y Ghlare Vanninagh,
"The language community has worked together for over 120 years to support, promote and celebrate Manx for everyone, everywhere.","Ta’n cho-phobble er n’obbragh cooidjagh rish ny smoo na shey feed blein dy chummal seose, cur er y hoshiaght, as feaillaghey y Ghaelg son dy-chooilley phieagh, dy-chooilley voayl.",
Highlights from grants awarded,Paart jeh ny toyrtyssyn s’cronnal jeh’n vlein argidoil shoh,
"29 grants totalling over £40,000 were awarded during the financial year","nuy toyrtyssyn as feed ta feeu ny smoo na £40,000 ooilley cooidjagh",
"Grants and underwriting provide financial assistance to individuals and groups who support, promote and develop aspects of Manx culture and cultural heritage.",Ta toyrtyssyn as raanteenyssyn currit magh dy chur cooney argidoil da persoonyn as sheshaghtyn ta cummal seose as cur er y hoshiaght cultoor as eiraght Manninagh.,
"Even a small grant award can have a huge effect when the knowledge, skills, and volunteer hours of community projects are factored in.","Foddee bree vooar ve ec ny toyrtyssyn sloo tra t’ad er nyn mooadaghey liorish schleiyn, traa, as tushtey y cho-phobble.",
"Grants are for projects that must be completed within two years, so some projects listed will have already been completed, and others will be started in coming months.","Shegin da shalleeyn ta toyrtyssyn currit daue ve cooilleenit cheu-sthie jeh daa vlein, myr shen, ta paart jeh ny shaleeyn ta imraait ayns shoh jeant hannah, as nee paart elley goaill toshiaght ayns ny meeghyn ry-heet.",
Developing skills and community outreach,"Cooney dy ynsagh schleiyn, as roshtyn magh gys y cho-phobble",
It is important that we support the development of skills as well as new ways to reach new audiences.,"T’eh scanshoil dy vel shin jannoo aghtyn noa dy roshtyn magh gys y cho-phobble, as cooney lesh sleih dy ynsagh schleiyn noa.",
Festivals and Events,Feaillaghyn as Taghyrtyssyn,
Festivals and events make for a rich and varied cultural life on our island – and so many are organised and delivered by volunteers.,"Ta feaillaghyn as taghyrtyssyn jannoo bea chultooroil yn ellan ain ny s’berchee, as ta ymmodee jeu er nyn livrey liorish arryltee.",
"The second wave of Covid in Spring 2021 had a knock-on effect again as many festivals and events were cancelled, postponed or had to move online.","Kyndagh rish y nah honn dy Chovid sy Niarragh jeh 2021, begin da ymmodee jeu ve scryssit, currit shaghey, ny goll er-linney.",
Those that did go ahead faced challenges in terms of logistics and unpredictable attendance numbers.,Begin dauesyn va cummit ayns persoon cur eddin da boiraghyn logisticagh as neu-hickyrys mychione yn earroo dy leih veagh ayn.,
"During this financial year Culture Vannin provided support for the following events, most of which were able to go ahead in some form:","Y vlein argidoil shoh ren Culture Vannin cummal seose ny taghyrtyssyn shoh heese, va’n chooid smoo jeu er nyn gummal ayns cummey ennagh:",
"Film, book and CD projects","Shalleeyn film, lioar, as CD",
"Our amazing cultural community creates new projects each and every year, and includes the work of researchers, writers and creatives at all levels:","Ta’n co-phobble cultooroil yindyssagh ain cur magh shalleeyn noa dy-chooilley vlein, as t’ad shoh goaill stiagh obbyr aa-ronseyderyn, screeudeyryn, as croodaghyn jeh dy-chooilley horch:",
RBV awarded to Peter Kelly,RBV er ny chur da Peter Kelly,
"The Manx New Year Honour of the RBV – or Reih Bleeaney Vanannan to give it its full title – has been awarded to architectural historian, Peter Kelly, for his lifelong contribution to Manx cultural heritage.",Va Reih Bleeaney Vanannan er ny chur mleeaney da’n shennaghyseyr ard-obbrinagh Peter Kelly son yn obbyr t’eh er n’yannoo son eiraght cultooroil Manninagh ayns earish e vea.,
"Peter is a well-known figure not only within Manx antiquarian and heritage circles, but also within the wider community.","Ta Peter ayns ard-ghoo cha nee ynrican da sleih ta graihagh er shennaghys as eiraght Manninagh, agh da’n slane cho-phobble.",
"He is recognised far and wide for his research, writing and case-work for the Isle of Man Victorian Society, for his tireless support for the protection and preservation of the architectural heritage of the Island, and he is in great demand for his entertaining and knowledgeable talks.","T’eh er ny voylley son yn obbyr echey er aa-ronsaghey as screeu son Sheshaght Victorian Vannin, as son yn obbyr yeidjagh echey cour coadey as freayl troggalyn shennaghyssagh yn Ellan; ta ny loayrtyssyn taitnyssagh as tushtagh dy mooar soit jeu neesht.",
"Spreading the word, no matter who the audience, has always been central to his work.",Ta skeaylley tushtey er ve ard-oyr yn obbyr echey.,
"Peter has taught formal classes, given countless lectures and guided tours, written booklets and newspaper articles, produced broadcasts for radio, and has been invited to appear on radio and television programmes that promote the Isle of Man and our cultural heritage, predominantly on a voluntary basis.","Ta Peter er n’ynsagh brastyllyn formoil, er n’yannoo lhaihaghyn as turryssyn erskyn-earroo, er screeu lioaryn giarey as articleyn pabyr-naightyn, er n’yannoo claareeyn radio, as er ghoaill ayrn ayns claareeyn radio as television ta moylley Ellan Vannin as yn eiraght cultooroil ain. T’eh er n’yannoo y chooid smoo jeh shoh myr arryltagh.",
