English,Manx,Manx Orginal,Page,EnglishPage,Notes
"This I take to be the very Essence of Religion, and it is that without which our Saviour tells us we cannot be his Disciples, Matt. x. 37, 38.","Shoh ta mish goaill dy ve Bree firrinagh Credjue, as she’n red shen eh, n’egooish ta nyn Saualtagh ginsh dooin, nagh vod mad ’ve son Schoyllaryn dasyn, Mian x. 37, 38.",,45,33,
"But when once we are got to this blessed Temper, we shall find it no very hard Matter to deny ourselves, and to take up our Cross, and follow our Lord and Master, both in well doing and in patient suffering.","Agh tra ta shin un cheayrt er n’gheddyn gys yn Aigney bannit shoh, cha nennee mad eh cooish ghoccaragh erbee dy obbal shin hene, as dy ghoaill seose nyn grosh, as goll geiyrt er nyn Jiarn as nyn Mainshtyr, chammah ayns jannoo dy mie, as ayns surranse dy feagh.",,45,33,
"Wherefore, let us earnestly beg of God by his holy spirit to work this Love in our Hearts.",Shen-y-fa lig dooin dy creeoil guee er Jee liorish e Spyrryd Casherick dy obbraghey’n graih shoh ayns nyn greeaghyn.,,45,33,
"And to our Prayers let us add our own diligent Endeavours ; and especially let as seriously meditate upon the Goodness and Loving-kindness of God, manifested to us and to all the World.","As marish nyn Badjeryn lig dooin dy imneagh jannoo ooilley ny t’ayns nyn booar hene ; as er-skyn ooilley, lig dooin dy creeoil smooinaghtyn er Mieys as Kenjallys ghraihagh Yee, er ny hoilshaghey dooinyn, as da ooilley’n seihll.",,45,33,
"Let us consider what he hath done for us already, both for Soul and Body, and what he has promised to do in the Life to come.","Lig dooin dy dowin smooinaghtyn er ny te hannah er n’yannoo er nyn son, chammah son corp as annym, as cre te er n’ghialdyn y yannoo ayns y vea ta ry heet.",,45,33,
"And never let our Hearts be at rest, till they are intirely fixed upon the ever-blessed God as our chiefest Good, and only satisfying Portion.","As dy bragh ny lig da ny creeaghyn ain ve ec aash, derrey t’ad dy slane soit er y Jee dy bragh bannit myr yn ard Vie ain, as yn ynrycan cronney oddys shin y yannoo booiagh.",,45,33,
"And let us earnestly seek his Favour, through our Lord Jesus the Mediator, who came into the World on purpose to bring us into a State of Friendship with God, that we might love him, and be loved by him, and live with him for ever in Love and Joy.","As lig dooin dy creeoil yn Foayr echey y hirrey, trooid nyn Jiarn Yeesey ta loart er nyn son, Eh haink stiagh ayns y theihll ooilley cooidjagh dy chur lesh shin gys stayd dy chaarjys rish Jee, dy voddagh shin graih chur da, as graih ve echey orrin, as beaghey marish son dy bragh ayns graih as gerjagh.",,45,33,
"But always remember that Obedience to God, is the only sure Evidence of true saving Love.",Agh kinjagh cooinee-jee dy nee Biallys gys Jee yn ynrycan prowal shickyr jeh graih firrinagh gys Saualtys.,,45,33,
"He that loves God, will hate and abhor Sin and Wickedness.","Eshyn shinney lesh Jee, ver Eh dwoaie as feoh da peccah as mee-chraueeaght.",,46,33,
"Let the Son pretend what Love and Honour he will to his Father, he does not truly love him, except he uses all due Care to please him.","Lig da’n Mac gra whooish as sallish dy vel Eh cur graih as ooashley da e Ayr, ny-yeih cha vel graih firrinagh echey er, mannagh vel Eh goaill dy chooilley chiarrail cooie dy wooiys Eh.",,46,33,
"And if you do thus sincerely love God as your Father, then you may always comfortably trust in him, and depend upon him ; which is another great Duty, and brings great Peace and Quiet to our Minds, Isa. xxvi. 3, 4.","As my ta shiuish myr shoh dy firrinagh graihagh er Jee myr nyn Ayr, eisht foddee shiu dy kinjagh lesh gerjagh treishteil ayn, as nyn marrant y chur er ; shoh ta ny churrym mooar elley, as ta cur lesh lane shee as fea gys ny haignaghyn ain, Isa. xxvi. 3, 4.",,46,33,
"— Whilst you live in Obedience to God’s Command, you have a sure Interest in his Promises, and may safely rely upon his good Providence for the Performance of them.","Choud as ta shiu beaghey ayns Biallys da Sarey Yee, ta cairys feer shickyr eu ayns e Yialdynyn, as foddee shiu dy sauchey treishteil gys e Ard-chiarrail vie, dy jean Eh y chooilleeney ad.",,46,33,
"Wherefore, whatever your wants, your Dangers, or Sufferings are, do not distrust the Providence of God, but wait patiently, and do your own Duty, and be assured, God in his good Time, will succour and relieve you ; He will direct, comfort and strengthen you.","Shen-y-fa, cre-erbee ta nyn ymmyrch, nyn nangere, ny nyn surranse, ny jean-jee Mee-hreishteil y yannoo er Ard-chiarrail Yee, agh fairk-jee dy feagh, as jean-jee nyn gurrym hene, as bee-jee shickyr jeh, dy jean Jee ayns e Hra mie hene kemmyrk as feaysley ’chur diu : Nee Eh y leeideil, y gherjaghey as y niartaghey shiu.",,46,33,
"Let all the Experience you have hitherto had of his Loving kindness, engage you to trust in him as long as you live.","Lig da ooilley’n ennaghtyn t’er ve eu gys nish jeh e chenjallys ghraihagh, shiu y chiangley dy hreishteil ayn choud as vees shiu bio.",,46,33,
And take great Care that you never murmur nor repine against God under any Affliction whatever.,As gow-jee lane kiarrail nagh jean shiu dy bragh playnt ny corree ’ghoaill rish Jee fo seaghyn erbee dy vel shiu ayn.,,46,34,
"When you meet with the heaviest Crosses and Disappointments, or lose your dearest Relations and Friends, say with holy Job, The Lord gives, and the Lord takes away ; blessed be the Name of the Lord.","Tra ta shiu meeteil rish ny crosshyn s’trimmey as giarit jeh nyn dreishteil, ny coal nyn leih-mooinjerey as nyn gaarjin s’deyrey, abbyr-jee marish Job crauee, Yn Chiarn ta coyrt, as y Chiarn ta goaill ersooyl, bannit dy row ennym y Chiarn.",,46,34,
"Beseech God to teach you that excellent Lesson of Contentment in all Estates, Phil. iv. 11, 12, 13.","Guee-jee er Jee dy ynsaghey diu yn lessoon mie shen dy ve booiagh ayns dy chooilley stayd bea, Phil. iv. 11, 12, 13.",,46,34,
"Though you may be low and poor in this World, yet consider, you have always Cause to be thankful, but never any Reason to complain.","Ga dy vod shiu ’ve injil as boght ’sy theihll shoh, ny-yeih smooinee-jee, dy vel kinjagh oyr eu dy ve booisal, agh gyn dy bragh  resoon dy phlaynt.",,46,34,
"God knows what Condition is best for us, and let us leave it to him to choose what we shall have.","Ta fyss ec Jee cre’n stayd bea share er nyn son, as lig dooin y agail eh dasyn dy reih cre vees ain.","Ta fyss ec Jee cre’n stayd bea share er nyn son, as lig dooin y agail eh dasyn dy reih cree vees ain.",47,34,
"We that deserve nothing but Wrath and Misery, ought to acknowledge the great Goodness of God, that we are on this side Hell.","Lhisagh shinyn nagh vel toilchin nhee agh jymmoose as treihys, goaill-rish Mieys vooar Yee, dy vel shin er cheu shoh jeh niurin.",,47,34,
"It is of the Lord’s Mercies that we are not utterly consumed, and that we do enjoy any Measure of Comfort.","Te lhiastyn da Myghinyn y Chiarn nagh vel shin dy bollagh er nyn goyrt mow, as dy vel shin goaill soylley jeh ayrn erbee dy gherjagh.",,47,34,
"Think how poor the Lord Jesus was for our sakes, who had not where to lay his Head, and whose Wants were supplied by the Substance of others ; and in the same mean Condition did the holy Apostles live.","Smooinee-jee cre cha boght as va’n Chiarn Yeesey er y ghraih ainyn, echey nagh row boall dy chur e chione ny lhie ayn, as yn ymmyrch echey va er ny yannoo magh lesh cooid sleih elley ; as ayns y stayd voght cheddyn ren ny Ostyllyn crauee beaghey.",,47,34,
"Your low Circumstances free you from a great many Snares and Temptations, and from a great many Cares and Sorrows that rich People meet with.","Ta’n stayd-beaghee injil eu freayll shiu ass raad ymmodee dy ribbaghyn as dy violaghyn, as veih ymmodee dy chiarrail as dy hrimshey, ta sleih berchagh meeteil rish.",,47,34,
"If you but truly love God, and have a Treasure in Heaven, you are very rich, though you have neither Gold nor Silver.","My ta shiu agh cur graih firrinagh da Jee, as stoyr eu ayns niau, ta shiu feer verchagh, ga nagh vel aer ny argid eu.",,47,34,
"Fear not, but God will give you and yours Food and Raiment ; and having that, let us be content and thankful.","Ny gow-jee aggle, agh dy der Jee beaghey as coamrey diuish as dauesyn ta bentyn diu ; as shen ve eu, bee-jee booiagh as booisal.",,47,34,
"Yea, let us suppose the very worst, that you should starve to Death for want of Bread, (which not one of a Thousand does in Times of Peace and Plenty) yet if your Souls be fit for Heaven, and carried thither, ye shall have no Cause to complain of the Manner of your Death.","Dy jarroo, lig dooin smooinaghtyn er y chooid smessey oddys y ve, dy vogh shiu baase d’yn ghortey son laccal arran (red nagh vel fer ayns thousane dy gheddyn ayns traghyn dy hee as dy palchey) ny-yeih my ta ny hanmeenyn eu feeu dy gholl gys niau, as er nyn goyrt lhieu ayns shen, cha bee oyr erbee eu dy phlaynt er yn aght hooar shiu baase.",,47,34,
"I have been a little the larger upon this for the sake of poor People, who are apt to be discontented, and to murmur at their Condition ; tho’ alas, they commonly bring themselves into it, or make it much worse, by their own careless and loose Lives, as was before mentioned.","Ta mee er loart red beg smoo mychione shoh er coontey sleih boghtey, ta aarloo dy ve neu-wooiagh, as dy phlaynt er nyn stayd-beaghee ; ga, alas, t’ad dy menniek cur lhieu ad hene ayns y stayd shen, er nonney jannoo eh foddey smessey, liorish nyn ymmyrkey-bea neu-chiarralagh as neu-heelt hene, myr va roie enmyssit.",,47,34,
"And yet before I proceed to the Duty you owe to your Neighbour, let me in a few Words direct you, as to the Worship of God in Prayers and Praises.","As ny-yeih roish my jem er my hoshiaght gys y churrym ta shiu lhiastyn da nyn Naboo, lig dou ayns  focklyn giarrey shiu y ynsaghey, mychione ooashley y chur da Jee ayns Padjeryn as Moylley.",,48,34,
"This is a Duty most frequently enjoined in Scripture, and practised by all good Men, and the very Light of Nature may direct us to it.","Ta shoh currym ta dy mennick er ny harey ayns Goo Yee, as er ny chliaghtey liorish dy chooilley ghooinney mie, as foddee eer soilshey dooghys shin y leeideil huggey.",,48,34,
"We have daily need of God’s Mercy, and do daily taste of it, and therefore we are taught to pray continually, and in every Thing to give Thanks.","Ta feme ain gagh laa er Myghin Yee, as ta shin gagh laa blashtyn jeh, as shen-y-fa ta shin er nyn ynsaghey kinjagh dy ghoaill Pedjer, as ayns dy chooilley nhee dy chur booise.",,48,35,
"To God alone must we offer up our Prayers and Praises in the Name of Jesus Christ, as he himself teaches us, Matt. iv. 10. John xvi. 23.","Gys Jee ny lomarcan shegin dooin chebbal seose nyn Badjeryn as nyn Moylley ayns Ennym Yeesey Creest, myr te hene gynsaghey dooin, Mian iv. 10. Ean xvi. 23.",,48,35,
"We must not pray to Angels, or Saints, nor make use of them as our Mediators, for this is the peculiar Office of Christ, who died for us, and is now interceding at the Right Hand of God, 1 Tim. ii. 5. Heb. vii. 25.","Cha jean eh mie dooin Padjer y ghoaill gys Ainlyn, ny gys Nooghyn, ny ymmyd y yannoo jeu dy loart eddyr shin as Jee, son she shen ard Oik Chreest, hooar baase er nyn son, as ta nish jannoo shee er nyn son ec laue yesh Yee, 1 Tim. ii. 5. Heb. vii. 25.",,48,35,
"Wherefore we, mean sinful Creatures, must always come to God in the Name of Christ, and for his Sake alone hope for the Favour of God, the Pardon of our Sins, the Acceptance of our Persons and Services, and the Salvation of our Souls.","Shen-y-fa, shegin dooinyn, cretooryn boght peccoil, kinjagh cheet gys Jee ayns Ennym Chreest, as son y ghraih echey ny lomarcan treishteil son Foayr Yee, son Pardoon son nyn Beccaghyn, son Soiagh ’ve jeant jin hene as nyn Shirveish, as son Saualtys nyn Anmeenyn.",,48,35,
"And our Saviour teaches us to Worship God in a pure and spiritual Manner, with our Hearts and Souls ; because He is a Spirit, and searches the Hearts of Men, John iv. 24.","As ta nyn Saualtagh gynsaghey dooin dy chur ooashley da Jee ayns aght glen as spyrrydoil, lesh nyn greeaghyn as nyn anmeenyn ; er-yn-oyr dy nee Spyrryd Eh, as dy vel Eh ronsaghey creeaghyn deiney, Ean iv. 24.",,48,35,
"Wherefore, by no means may we make any Image or Picture of God, nor may we give religious Worship to an Image, which is directly contrary to the Second Commandment.","Shen-y-fa cha jean eh mie dooin er aght erbee Jalloo ny Co-chaslys y yannoo jeh Jee, ny cha-moo shegin dooin ooashley credjuagh y choyrt da Jalloo, ta dy foshlit noi’n nah Anney.",,48,35,
"Neither may we frame in our Minds any Bodily Shape or Likeness of God, when we pray to Him.","Cha-moo te lowit dooin ayns nyn smooinaghtyn dy yannoo Cummey ny Co-chaslys erbee callinagh jeh Jee, tra ta shin goaill Padjer huggey.",,48,35,
"But must conceive of Him as a most pure and glorious Spirit, most powerful, and wise, and good ; who fills the whole World with his Presence, and is always near to us, though not to be seen with bodily Eyes ; and hears our Prayers, and knows our Wants, and is both able and willing to help us.","Agh shegin dooin smooinaghtyn jeh myr Spyrryd feer ghlen as gloyroil, feer phooaral, as creeney, as mie ; Eh ta lhieeney’n slane seihll lesh e Enish,  as ta kinjagh er-gerrey dooin, ga nagh vel Eh dy ve er ny akin lesh sooill dooinney ; as te clashtyn nyn Badjeryn, as fyss echey er nyn ymmyrch, as te chammah fondagh as booiagh dy chooney lhien.",,48,35,
"Our Saviour hath commanded us to pray to God in private, Matt. vi. 6.","Ta nyn Saualtagh er harey shin dy ghoaill Padjer gys Jee er lheh, Mian vi. 6.",,49,35,
"And has taught his Disciples how to pray, giving them that most excellent Form which we call the Lord’s Prayer, Our Father which art in Heaven, &c. which by the Way may assure us, that Forms of Prayer are very lawful, and the Lord’s Prayer may both serve for a Pattern to direct us in all our Prayers, and also is itself most fit to be used, and joined to our other Prayers.","As te er nynsaghey da ny Schoyllaryn echey kys dy ghoaill Padjer, liorish coyrt daue yn Phadjer feer vie shen, ta shin genmys Padjer y Chiarn, Ayr ain, t’ayns niau, &c. liorish shoh ta shickyrys ain, dy vel Padjeryn scruit ro-laue red feer lowal, as foddee Padjer y Chiarn shirveish chammah son sambyl dooin dy ve er nyn leeideil liorish ayns ooilley nyn Badjeryn, as myrgeddyn ee hene feer chooie dy ve er ny usal as er ny ghra marish ny Padjeryn elley ain.",,49,35,
"But it is not proper to use the Belief and the Ten Commandments for Prayers, as the manner is of poor ignorant People ; though we ought often to think of them, and rehearse them, for the quickning of our Faith, and the guiding of our Lives.","Agh cha vel eh jesh dy yannoo ymmyd jeh’n Chrea as ny Jeih Annaghyn son Padjeryn, myr ta aght sleih boghtey mee-hushtagh ; ga dy lhisagh shin dy mennick smooinaghtyn orroo, as ad y ghra, dy vioghey nyn Gredjue, as dy leeideil nyn mea lioroo.",,49,35,
"Upon all Occasions, in all our Troubles and Distresses, let us be much in Prayer to God, and still seek to him for Mercy and Comfort, who is always nigh to them that call upon him in Truth and Sincerity.","Er dy chooilley oyr, ayns ooilley nyn drouble as nyn seaghyn, lig dooin dy mennick goaill Padjer gys Jee, as kinjagh aghin y yannoo son myghin as gerjagh huggeysyn, ta dy bragh er-gerrey dauesyn ta geamagh er ayns firrinys as ynrickys.",,49,36,
"Would the poor Man seek as earnestly to God for Relief, as he does to his rich Neighbour, he would find it the surest Course to have his Wants supplied.","Dy jinnagh y dooinney boght suall gys Jee son cooney cha jeean, as te dy yannoo gys e naboo berchagh, yough Eh eh dy ve’n aght shickyree dy gheddyn e ymmyrch jeant magh.","Dy jinnagh y dooinney boght sual gys Jee son cooney cha jeean, as te dy yannoo gys e naboo berchagh, yough Eh eh dy ve’n aght shickyree dy gheddyn e ymmyrch jeant magh.",49,36,
"And let us also frequently be lifting up our Hearts to God in Thanksgiving and Praise, for all his Mercies and Favours which he bestows upon us.","Agh lig dooin ooilley ve dy mennick troggal seose nyn greeaghyn gys Jee ayns Toyrt-booise as Moylley, son ooilley e Vyghinyn, as e Vannaghtyn te dy ghiootal orrin.",,49,36,
"Thus may even the poorest Man have his Mind often employed when he is at work in the Shop, or in the Field, or when he is walking in the Way, or sailing on the Sea, which would not hinder, but further his Labours, and make them more easy and pleasant.","Myr shoh dy jarroo foddee’n dooinney s’boghtey e aigney y reayll dy mennick ayns smooinaghtyn tra te ec obbyr ayns y thie, ny ayns y vaghyr, tra te shooyl er y raad, ny shoaylley er y cheayn, red nagh jinnagh lhiettal, agh thoshiaght y chur er y laboraght, as y yannoo  eh ny s’aashee as ny s’eunyssee da.",,49,36,
But be sure to set some Time apart every day for solemn Prayer.,Agh bee-jee shickyr dy chur dy lhiattee ayrn ennagh dy hra dy chooilley laa son Padjer crauee.,Agh bee-jee shickyr dy chur dy lhiatte ayrn ennagh dy hra dy chooilley laa son Padjer crauee.,50,36,
"Very fit it is to begin the Day with Prayer to God, as soon as we rise out of Bed ; blessing his Name for our Preservation and quiet Rest, begging his gracious Presence with us all the Day, that we may be kept from all Evil, especially from Sin, the worst of all.","Feer chooie te dy yannoo thoshiaght er y laa lesh Padjer gys Jee, cha lea as ta shin girree ass y lhiabbee ; bannaghey e ennym son nyn goadey as nyn gadley feagh, guee son e enish ghraysoil dy ve marin fey laa, dy vod mad v’er nyn vrealley veih dy chooilley olk, er-skyn ooilley veih peccah, yn olk smessey ooilley.","Feer chooie te dy yannoo thoshiaght er y laa lesh Padjer gys Jee, cha lea as ta shin girree as y lhiabbee ; bannaghey e ennym son nyn goadey as nyn gadley feagh, guee son e enish ghraysoil dy ve marin fey laa, dy vod mad v’er nyn vrealley veih dy chooilley olk, er-skyn ooilley veih peccah, yn olk smessey ooilley.",50,36,
"And at the Evening let this be our last Work, before we lie down to sleep, humbly to commit ourselves to God by Prayer, Psal. xcii. 1, 2.","As ec yn astyr lig da shoh ve nyn obbyr s’jerree, roish my jed mad dy lhie shees dy chadley, dy imlee shin hene y hymney gys Jee ayns Padjer, Psalm xcii. 1, 2.",,50,36,
"Exceeding useful is it for those who have Families, to join together Morning and Evening in Prayer to God, and in reading some Part of his holy Word, for which Purpose there are many good Books of Devotion ; and though they have none of them, they may use such of the Prayers of the Church as are proper for their Purpose, which are to be found in the Morning and Evening Service, and in other Places.","Er-skyn towse mie veagh eh dauesyn ta Lughtyn-thie oc, dy ghoaill Padjer cooidjagh Moghrey as Fastyr gys Jee, as dy lhaih ayrn ennagh jeh e Ghoo casherick, son yn ymmyd cheddyn ta ymmodee dy lhioaryn mie ta Padjeryn scruit ayndoo ; as ga nagh vel veg jeh ny lhioaryn shoh oc, foddee ad usal leid ny ayrnyn shen jeh Padjeryn ny Killagh as ta cooie son yn ymmyd oc, ta dy ve er nyn veddyn ayns y Chirveish Moghree as Fastyr ; as ayns boallyn elley.",,50,36,
"Before you sit down to Meat, beg God’s Blessing upon it, and afterwards return Thanks for it.","Roish my soie shiu shees gys Bee, guee-jee son Bannaght Yee er, as ny lurg shen chyndaa-jee Booise er y hon.",,50,36,
"But besides our Devotion in the Family or Closet, our great Duty is to worship God in the public Assemblies of his People, which by no Means we ought to forsake, Hebrews x. 25.","Agh marish nyn Badjeryn ayns y Lught-thie, ny nyn Shiamyr, nyn Gurrym mooar eh dy chur ooashley da Jee ayns Chaglymyn foshlit e phobble, shen nagh lhisagh shin er aght erbee y hreigeil, Heb. x. 25.","Agh marish nyn Badjeryn ayns y Lught-thie, ny nyn Shiamyr, nyn Gurrym mooar eh dy chur ooashley da Jee ayns ny Chaglymyn foshlit e phobble, shen nagh lhisagh shin er aght erbee y hreigeil, Heb. x. 25.",50,36,
"Suffer not yourselves, therefore, by any Pretence whatever, to be drawn away, either by Papists or Sectaries from the public Worship of God, as it is now by Law established in the Church of England.","Ny lig-jee diu hene, er-y-fa shen, liorish leshtal erbee eddyr, dy ve er nyn dayrn er-sooyl liorish Papishyn ny feallagh jeh Credjue erbee elley, veih ooashley chur dy foshlit da Jee, myr te nish liorish y leih soit seose ayns Keell Hocsyn.","N lig-jee diu hene, er-y-fa shen, liorish leshtal erbee eddyr, dy ve er nyn dayrn er-sooyl liorish Papishyn ny feallagh jeh Credjue erbee elley, veih ooashley chur dy foshlit da Jee, myr te nish liorish y leih soit seose ayns Keell Hocsyn.",50,36,
"But see that you duly resort to your Parish Churches, and that not only on Holidays, but on the Week Days, when you have Opportunity and Leisure.","Agh jeagh dy vel shiu kinjagh goll gys ny Kiallteenyn skeerey eu hene, as cha nee shen er laghyn fealley ny lomarcan agh er laghyn y chiaghtyn, tra ta caa  as tra eu.",,51,37,
"More especially see that you constantly frequent the Church on the Lord’s Day, if not hindered by Sickness, or some other very great and urgent Cause.","Er-skyn ooilley gow-jee kiarrail dy vel shiu kinjagh goll gys y Cheell er Laa’n Chiarn, mannagh bee shiu er nyn lhiettal liorish chingys, ny liorish oyr ennagh elley feer vooar as chion.",,51,37,
"Let not that Excuse keep you from Church, which would not keep you from the Market.",Ny lig da’n leshtal shen shiu y reayll veih’n Cheell nagh vreaillagh shiu veih’n Vargey.,,51,37,
Bring as many of your Family along with you as can possibly be spared.,Cur-jee lhieu whilleen jeh’n Lught-thie eu meriu as oddys er aght erbee ve shaghnit.,,51,37,
"Come at the very beginning of the Service, and stay quietly to the End of it, not running away before the Blessing, as many careless People rudely do, as if they were glad to get away as from a Prison.","Tar-jee ec eer thoshiaght y Chirveish, as furree-jee dy feagh gys y jerrey echey, cha nee roih er-sooyl roish Bannaght ny Killagh, myr ta lane sleih mee-hastagh dy neu-chooie jannoo, myr dy beagh ad booiagh dy gheddyn roue myr veagh eh ass Pryssoon.",,51,37,
"Behave yourselves with all due Reverence, both of Body and Mind, considering the Majesty of that God in whose Presence you stand, before whom the very Angels veil their Faces.","Ymmyrk-jee shiu hene lesh dy chooilley arrym cooie, chammah jeh corp as aigney, goaill hiu hene Ard-ooashley’n Jee shen ayns e enish ta shiu shassoo, roish ta ny Ainlyn hene coodaghey nyn eddinyn.",,51,37,
"Always kneel at your Prayers, if there be Convenience, or stand at least, Ps. xcv. 6.","Gow-jee kinjagh er nyn ghlioonyn tra ta shiu ec Padjer, my ta room jesh er y hon, er nonney ec y chooid sloo cum-jee nyn shassoo, Psalm xcv. 6.",,51,37,
"Above all, look well to the Temper of your Soul, and keep up an awful Sense of the great God to whom you are praying, and mind well what is said, as you go along with the Prayers, and offer up your Desires to God : Otherwise, though you may speak much, you do not pray at all.","Harrish ooilley, jeagh-jee dy mie da’n shooyl ta’n annym eu ayn, as freaill-jee seose ennaghtyn arrymagh jeh’n Jee mooar huggey ta shiu goaill Padjer, as gow-jee tastey vie jeh ny t’er ny ghra, myr ta shiu goll er nyn doshiaght lesh ny Padjeryn, as cheb-jee seose nyn yeearreeyn gys Jee : Er-aght-elley, ga dy vel shiu loart lane, cha vel shiu goaill Padjer eddyr.",,51,37,
"Avoid all vain and wandering Thoughts, as much as possible.",Chea-jee veih dy chooilley smooinaght fardalagh as shagh’rynagh whooish as oddys y ve.,,51,37,
"When you join in the Confession of Sins, think of your own particular Faults, and be deeply humbled for them : And be unfeignedly thankful for all God’s Mercies, whilst you are praising his Name ; and earnestly long after that Grace you pray for.","Tra ta shiu (marish y Chirveishagh) gra harrish y Goaill-rish peccaghyn, smooinee-jee er nyn voiljyn hene er lheh, as bee-jee dy dowin trimshagh er nyn son : As bee-jee dy firrinagh booisal son ooilley Myghinyn Yee, choud as ta shiu moylley e Ennym ; as gow-jee foddeeaght vooar son y Ghrayse shen ta shiu guee er y hon.",,51,37,
"Attend with Care and Reverence to God’s Word, when it is read from the Desk, and also to the Preaching and Explaining it from the Pulpit, that you may be both diligent Hearers, and faithful Doers of the Word.","Eaisht-jee lesh kiarrail as arrym rish Goo Yee, tra te er ny lhaih veih’n Desk, as  myrgeddyn rish yn ynsagh as y bun t’er ny choyrt jeh veih’n Phulpit, dy vod shiu ’ve feallagh ta chammah kiarralagh dy eaishtagh rish, as firrinagh dy chooilleeney’n Goo.",,52,37,
"Neglect not the Church in the Afternoon, though you should live where there is no Sermon.","Ny lig-jee shaghey dy gholl gys y Cheell Fastyr, ga dy vel shiu cummall raad nagh vel Sharmane eddyr.",,52,37,
"Catechising may be as useful to you, and this ought to be in all Places.","Foddee geaishtagh rish sleih aegey ta gynsaghey nyn Gredjue jannoo chiart whooish dy vie diu, as shoh lhisagh y ve ayns dy chooilley voal.","Fodde geaishtagh rish sleih aegey ta gynsaghey nyn Gredjue jannoo chiart whooish dy vie diu, as shoh lhisagh y ve ayns dy chooilley voal.",52,37,
"And besides that, you will hear the holy Scriptures read, and have the Benefit of the Public Prayers.","As marish shen, clynnee shiu Goo casherick Yee er ny lhaih, as bee vondeish Shirveish ny Killagh eu.",,52,37,
