English,Manx,Manx Orginal,Page,EnglishPage,Notes
"If ever we hope to find Mercy with God, and have our Trespasses forgiven, we must forgive those that offend us, as we learn from the Lord’s Prayer, and many most plain Places of Scripture. See Matt. v. 44, &c. Matt. xviii. 21, to the End. Rom. xii. 14, to the End.","My ta shin dy bragh treishteil dy gheddyn myghin veih Jee, as nyn loghtyn er nyn leih dooin, shegin dooin leih dauesyn ta jannoo aggair dooin, myr ta shin gynsaghey veih Padjer y Chiarn, as veih ymmodee dy voallyn feer phlain ’sy Scriptyr. Jeagh-jee Mian v. 44 &c. Mian xviii. 21. gys y jerrey. Rom. xii. 14. gys y jerrey.",,59,42,
"We must shew Meekness and Gentleness to all Men, and never willingly say or do any Thing to provoke another to Anger ; nor should we be easily provoked, but very easily appeased and reconciled.","Shegin dooin shin hene y yeaghyn imlee as meen da dy chooilley ghooinney, as gyn dy bragh ve booiagh dy ghra ny dy yannoo nhee erbee dy vrasnaghey fer elley gys corree ; cha-moo lhisagh shin hene ve dy aashagh brasnit, agh dy feer aashagh meenit as tayrnit gys shee.",,59,42,
"It is very sad to consider, what wretched and miserable Lives many of the poorer Sort lead, by their continual Brawling and Scolding, Quarrelling and Contending with one another ; and sometimes when they have scarce Money to buy Bread, they will throw it away in vexatious Law-suits, merely out of Spite and Revenge.","Te feer trimshagh dy smooinaghtyn, cre cha donney as cha treih ta ymmodee jeh’n sorch s’boghtey dy leih leeideil nyn mea, liorish ny boiraghyn as troidjey mennick oc, tuittym-magh as streeu ry chielley ; as ny cheayrtyn tra slioar daue argid ve oc dy chionnaghey arran, tilgee ad eh ersooyl geiyrt er suityn boiragh y leih, ooilley cooidjagh ayns goanlys as shirrey cooilleen-aigney.","Te feer trimshagh dy smooinaghtyn, cre cha donney as cha treih ta ymmodee jeh’n sorch s’bogtey dy leih leeideil nyn mea, liorish ny boiraghyn as troidjey mennick oc, tuittym-magh as streeu ry chielley ; as ny cheayrtyn tra slioar daue argid ve oc dy chionnaghey arran, tilgee ad eh ersooyl geiyrt er suityn boiragh y leih, ooilley cooidjagh ayns goanlys as shirrey cooilleen-aigney.",59,43,
And the People of this Rank ought especially to beware of envying those that are in better Condition than themselves.,As lhisagh yn sorch shoh dy leih er-skyn ooilley ve kiarralagh nagh jean ad troo moosyn t’ayns stayd share n’ad hene.,,60,43,
"We ought to have that true Kindness and good Will for all Men, that we should be glad of their Prosperity, though we ourselves be in Affliction : As on the other Hand, we ought to have great Compassion for those in Misery, though we be in Prosperity.","Lhisagh y chenjallys firrinagh as yn aigney-mie shen y ve ain da dy chooilley ghooinney, dy lhisagh shin ’ve booiagh jeh’n vaynrys oc, ga dy beagh shin hene ayns seaghyn : Myr er y laue elley, lhisagh lane chymmey ve ain jeusyn t’ayns treihys, tra ta shin hene ayns maynrys.",,60,43,
"And let such that are in want, take heed that their Necessities put them upon no unlawful Course for their Relief.","As lig dauesyn t’ayns ymmyrch, tastey ghoaill nagh der nyn moghtynid ad gys shiootyn erbee neu-lowal dy yannoo feaysley orroo.",,60,43,
"Particularly beware of Stealing any thing, though of a small Value.","Er-skyn ooilley gow-jee kiarrail nagh jean shiu nhee erbee y gheid, ga nagh vooar sheeagh eh.",,60,43,
"By degrees it is to be feared, you will go on to greater Matters, and so may bring yourselves to Shame and Punishment in this World as well as that to come.","Ny veggan as ny veggan, ta aggle dy ve goit, hed shiu er nyn doshiaght dy gheid reddyn smoo, as myr shen foddee shiu cur lhieu shiu hene gys nearey as kerraghey ’sy theihll shoh chammah as ’sy theihll ta ry heet.","Ny veggan as ny veggan, ta aggle dy ve goit, hed shiu er nyn doshiaght dy gheid reddyn smoo, as myr shen foddee shiu cur cur lhieu shiu hene gys nearey as kerraghey ’sy theihll shoh chammah as ’sy theihll ta ry heet.",60,43,
"The best Way to avoid this, is to be very diligent in your lawful Calling, as the Apostle directs in that Place before named, Eph. iv. 28.","Yn aght share dy haghney shoh, ta dy ve feer tharroogh ayns nyn aght-beaghee lowal, myr ta’n Ostyl coyrlaghey ayns yn ynnyd shen roie enmyssit, Ephes. iv. 28.",,60,43,
"If you are not able to work, it is lawful to beg.",Mannagh vod shiu gobbraghey te lowit diu dy hooyl er ny Creesteenyn.,,60,43,
"But by no means betake yourselves to this lazy unprofitable Life of begging, if you are able to subsist by any other lawful Course.","Agh er aght erbee ny gow-jee ayns laue dy chaeu nyn seihll ayns yn aght-beaghee litcheragh neu-vondeishagh shoh, dy hooyl ny dhiyn, my oddys shiu beaghey er saase erbee elley onneragh.",,60,43,
"He that will not work when he can, deserves not to eat.","Eshyn nagh jean gobbraghey tra oddys Eh, cha vel Eh toilchin gee.",,60,43,
"But rather than either steal or starve, you may seek for Relief from your Neighbour’s Charity.","Agh ny sleaih na nee shiu edyr geid ny goll-mow son laccal beaghey, foddee shiu shirrey son cooney veih Giastylys nyn Naboo.",,60,43,
"But do not go about to deceive him, by borrowing what you know you are never like to pay ; for this is downright cheating.","Agh ny gow-jee erriu dy volley  Eh, liorish geeasaght shen ta fyss eu nagh vel shiu dy bragh laik dy eeck ; son she eer volteraght shoh.",,60,43,
"Rather deal plainly, and make known your Necessities.","Ny sleaih dell-jee dy foshlit, as inshjee magh nyn veme.",,61,43,
"If you trust in God, and do your Duty, He will take Care of you : And though you may be in Straits sometimes, yet still you will find a Supply.","My ta shiu cur nyn dreishteil ayns Jee, as jannoo nyn gurrym, gow-ee Eshyn kiarrail jeu : As ga dy vod shiu ny cheayrtyn ve ayns chennid, ny-yeih yiow shiu kinjagh nyn ymmyrch jeant magh.","My ta shiu cur nyn dreishteil ayns Jee, as jannoo nyn gurrym, gow-ee Eshyn kiarrail j'eu : As ga dy vod shiu ny cheayrtyn ve ayns chennid, ny-yeih yiow shiu kinjagh nyn ymmyrch jeant magh.",61,43,
"And to prevent your Poverty, let me especially warn you against that common brutish Sin of Drunkenness, which brings both this and many other Mischiefs along with it, as I have before told you.","As dy reayll shiu ass boghtynid, lig dou harrish ooilley raaue ’chur diu noi’n peccah cadjin beaishtagh shen dy veshtyrys, ta coyrt lesh chammah shoh as ymmodee dy oilk elley myr eiyrtyssyn er, ’naght myr dinsh mee diu roie.",,61,43,
"Indeed it hinders every Thing that is good, and leads Men into all manner of Sin and Misery.","Dy jarroo te lhiettal dy chooilley nhee ta mie, as leeideil deiney gys dy chooilley vonney dy pheccah as dy hreihys.",,61,44,
This Vice makes more Beggars than any other Cause.,Ta’n peccah shoh cur ny slhee dy hooyl ny dhiyn na ta oyr erbee elley.,,61,44,
"Wherefore, if you have any Regard to your Families, and Love to Soul or Body, avoid all Riot and Excess.","Shen-y-fa my ta veg y gheill eu da nyn Lught-thie, as graih da nyn annym as callin, chea-jee veih dy chooilley vee-reilltys as dy chooilley yollyss.","Shen-y-fa my ta veg y gheill eu da nyn Lught-thie, as graih da nyn annym as callin, chea-jee veih dy chooilley vee-reilltys as dy yollyss.",61,44,
"Eat and drink so moderately, as may tend to keep you best in Health, and make you most fit for the Service of God, and your own Calling.","Ee-jee as iu-jee ayns leid y towse shen, as share vees son nyn slaynt, as s’jeshey nee shiu y yannoo son Shirveish Yee as nyn aght-beaghee hene.","Eee-jee as iu-jee ayns leid y towse shen, as share vees son nyn slaynt, as s’jeshey nee shiu y yannoo son Shirveish Yee as nyn aght-beaghee hene.",61,44,
"And lastly, beware of that filthy sin of Whoredom, which very often goes along with Drunkenness, and as often bring the Curse of God, both upon Men’s Bodies and Estates.","As er jerrey, bee-jee twoaiagh jeh’n peccah neu-ghlen shen dy vaardyrys ta feer vennick ny eiyrtys er meshtyrys, as cha mennick cheddyn cur lesh Mollaght Yee, chammah er kirp as cooid sleih.",,61,44,
"And to keep you innocent, avoid Idleness as well as Intemperance.","As dy reayll shiu ayns neu-loghtynys, chea-jee veih litcheraght chammah as veih neu-heeltys.",,61,44,
"And fly from all lewd and wicked Company, where you are in Danger of being enticed and ensnared ; and do not so much as allow yourselves in any unclean Thoughts or Desires, nor in filthy Discourses, or in any wanton Carriage and Behaviour.","As roih-jee ersooyl veih dy chooilley heshaght neu-ghlen as mee-chrauee, raad ta shiu ayns dangere dy ve miolit as goit ayns ribbeh ; as ny jean-jee whooish as ked y chur diu hene dy ve ayns smooinaght ny yeearreeyn erbee neu-ghlen, ny ayns taggloo brogh, ny ayns ymmyrkey as aght erbee rouanagh.",,61,44,
"For the preventing of all Wickedness of this kind, God hath allowed Marriage, which is said to be honourable in all, but Whoremongers and Adulterers God will judge, Heb. xiii. 4.","Son dy haghney dy chooilley vee-chraueeaght jeh’n dooghys shoh, ta Jee er lowal poosey, t’er ny ghra dy ve onneroil ayns dy chooilley annane, agh adsyn ta cur rish maarderys as brishey-poosey nee Jee y vriwnys,  Heb. xiii. 4.",,61,44,
Wherefore let them who are in that State keep strictly true to their Marriage Vow.,"Shen-y-fa, lig dauesyn t’ayns y stayd shen ve feer firrinagh gys nyn mreearrey-poosey.",,62,44,
"And all, both married and single, preserve both Body and Soul, so chaste and pure, that the Holy Spirit of God may now dwell in their Hearts, and they be fit to dwell for ever in the Presence of the most Holy God.","As lig dauesyn ooilley ta poost as gyn phoosey, chammah corp as annym y reaylley, whooish shen gyn loght as cha glen, dy vod Spyrryd Casherick Yee beaghey ayns ny creeaghyn oc, as ad ve dy bragh cooie dy veaghey ayns fenish y Jee smoo casherick.",,62,44,
"And thus I have briefly given you an Account wherein consists that Holiness of Life to which all Christians are obliged by the Precepts of our blessed Saviour, and by their Baptismal Vow, which binds them to keep his Precepts, and to follow his Example, who himself lived in the same holy Manner that He taught and hath commanded those that say they abide in Him, to walk as He walked, 1 John ii. 6.","As myr shoh ayns beggan focklyn ta mish er chur coontey diu cre ayns ta’n Chraueeaght Bea shen lhie huggey ta dy chooilley Chreestee kainlt liorish Saraghyn nyn Saualtagh bannit, as liorish nyn Mreearrey Bashtey, ta kiangley ad dy reayll ny Saraghyn echey, as dy eiyrt er e Hamplere, ren Eh hene beaghey ayns yn aght casherick cheddyn dynsee Eh, as te er harey adsyn ta gra dy vel ad tannaghtyn ayn, dy immeeaght ’naght myr dymmee Eshyn, 1 Ean ii. 6.","As myr shoh ayns beggan focklyn ta mish er chur coontey diu cre ayns ta’n Chreaueeaght Bea shen lhie huggey ta dy chooilley Chreestee kainlt liorish Saraghyn nyn Saualtagh bannit, as liorish nyn Mreearrey Bashtey, ta kiangley ad dy reayll ny Saraghyn echey, as dy eiyrt er e Hamplere, ren Eh hene beaghey ayns yn aght casherick cheddyn dynsee Eh, as te er harey adsyn ta gra dy vel ad tannaghtyn ayn, dy immeeaght ’naght myr dymmee Eshyn, 1 Ean ii. 6.",62,44,
"The Sum of all you have in few Words, which the Gospel teaches, even that we should deny Ungodliness and worldly Lusts, and live soberly, righteously and piously in the World, Tit. ii. 11, 12.","Ta bun y claane eu ayns focklyn giarrey, ta’n Sushtal gynsaghey dooin, dy jarroo dy lhisagh shin gobbal mee-chraueeaght as sayntyn seihlltagh, as beaghey dy sheelt, dy ynrick, as dy crauee ayns y teihll, Tit. ii. 11, 12.",,62,44,
"And now let me again beseech you seriously to consider, whether it has been your Care to live such holy and good Lives, or no.","As nish lig dou reeisht guee erriu dy smooinaghtyn dy dowin, vel eh er ve yn chiarrail eu dy leeideil leid y vea chrauee as mie shoh, mannagh vel.",,62,44,
"And whereinsoever your Conscience doth accuse you, that you have neglected the Duties God hath commanded, or committed those Sins which He hath forbidden, do you humbly acknowledge and confess the same to Almighty God, with true Godly Sorrow for the same, earnestly begging Mercy and Pardon for Christ’s Sake, who died on the Cross for Sinners, and through whom all that confess and forsake their Sins shall find Mercy.","As ayns cre-erbee ta nyn gooinsheance jannoo cassid erriu, dy vel shiu er ve meerioosagh jeh ny currymyn ta Jee er harey, ny er n’yannoo ny peccaghyn shen te er lhiettal, jean-jee dy imlee goaill-roo gys Jee ooilley-niartal, lesh trimshey firrinagh crauee er nyn son, dy creeoil guee son Myghyn as Pardoon er Graih Chreest, hooar baase er y chrosh son peccee, as ny hrooid ooilley adsyn ta goaill-rish as ta treigeil nyn beccaghyn yow myghin.",,62,45,
"Wherefore henceforth resolve by his Grace that you will forsake your Sins, and amend your Lives, and make it your chief Business to keep a Conscience void of Offence towards God and Man, not allowing yourselves in any known Sin, nor in the wilful Neglect of any known Duty.","Shen-y-fa kiare-jee maghey shoh liorish e Ghrayse dy dreig shiu nyn beccaghyn, as dy lhiassee shiu nyn mea, as dy jean shiu eh nyn ard obbyr dy reayll cooinsheance gyn loght gys Jee as Dooinney, fegooish lowal diu hene dy veaghey ayns peccah erbee er fyss diu, ny ayns meerioose jeh nyn yoin er currym erbee dy vel fyss eu er.",,62,45,
"Do not object against this, and say, that it is impossible to lead such an holy Life : For thousands in the World, of all Ranks and Conditions, have done it in all Ages, by the Assistance of God’s Grace, which you shall never want, if you seek it earnestly, and improve it diligently.","Ny loar-jee noi shoh, as ny abbyr-jee, dy vel eh neu-phossible dy leeideil leid y vea chrauee : Son ta thousaneyn ’sy theihll jeh dy chooilley horch as stayd, t’er n’yannoo eh ayns dy chooilley eash, liorish cooney Grayse Yee, nagh bee shiuish dy bragh ny laccal, my hirrys shiu eh dy creeoil, as my nee shiu dy kiarralagh ymmyd vie jeh.",,63,45,
"And though there may at first be some Difficulty in leaving an ill Course, yet by degrees it will grow easy, and you will then find nothing so sweet and pleasant as Religion and Virtue","As ga dy vod eh ec y thoshiaght ve red ennagh doillee dy agail jeh drogh yea, ny-yeih ny veggan as ny veggan hig eh dy ve aashagh, as eisht cha nennee shiu red erbee cha millish as cha eunyssagh as ta Credjue as Bea Chrauee.",,63,45,
"And do not, I beseech you, fancy that it is not for poor People to think of being so religious and godly ; that this is only for the Rich, who have little else to do.","As guee-ym erriu, ny sheill-jee nagh nee paart y sleih boghtey eh dy smooinaghtyn ad hene kainlt gys leid y towse shoh dy Chredjue as dy Chraueeaght ; agh dy vel shoh ynrycan cooie da ny berchee, nagh vel agh feer veg arragh oc dy yannoo.",,63,45,
"Why will not you that are Poor have as much Care of your own Souls as the Rich, and study to be happy as well as they ?","Cre’n-oyr nagh jean shiuish ta boght whooish dy chiarrail y ghoaill jeh ny hanmeenyn eu hene as ny berchee, as streeu dy ve maynrey chammah roosyn ?",,63,45,
"By this Means you will be even with them, yea much happier than they, even in this Life, except they be good as well as great.","Er yn aght shoh bee shiu corrym roo, dy jarroo foddey s’maynrey na ad, ayns y vea shoh hene, mannagh bee ad mie chammah as mooar.",,63,45,
"What is there in all I have said, but even the poorest may perform if they have but a willing Mind ?","Cre t’ayns ooilley ny ta mish er n’ghra, agh shen oddys y sleih s’boghtey y chooilleeney my vees ad agh booiagh ayns nyn aigney ?",,63,45,
"May you not love God and your Neighbour, be sober and chaste, meek and humble, pray to God, and praise his Name ? &c.","nagh vod shiuish Graih y chur da Jee as da nyn Naboo, ve sheelt as glen, meen as imlee, Padjer y ghoaill gys Jee, as yn Ennym echey y voylley ? &c.",,63,45,
"Nay, is not this the much better Way to keep you from Poverty, or to help you out of it ?","Dy jarroo, nagh nee shoh’n aght share foddey dy reayll shiu veih boghtynid, er nonney dy chooney lhieu dy gheddyn ass ?",,63,45,
"Is it not much cheaper to live soberly and honestly, than to live in Drunkenness and Whoredom, and such like wasteful Sins ?","Nagh vel eh foddey sassey dy veaghey dy sheelt as dy onneragh, na dy veaghey ayns meshtyrys as maardyrys, as leid ny peccaghyn elley jummallagh shen ?",,63,45,
"Does it not cost you much more to go to Law for Revenge, than to forgive an Injury ?","nagh  vel shiu geeck ny smoo foddey son goll gys y leih dy gheddyn cooilleen, na eeckagh shiu son aggair y leih da nyn naboo ?",,63,45,
One Vice costs more the maintaining than ten Virtues.,"Ta ny smoo baarit er un pheccah dy chummal seose eh, na ta er jeih aghtyn mie.",,64,45,
"And I am confident, more Families are brought to Poverty by gratifying their Lusts, than by providing for their Children, how many soever they be.","As ta mee shickyr jeh dy vel ny slhee Lught-thie er nyn goyrt fo boghtynid liorish ny sayntyn oc y yannoo magh, na ta liorish tilgey-ro-laue son nyn gloan, lig daue ve whilleen as sailloo.",,64,45,
"Is it not, think you, much better for yourselves and Families, to spend the Lord’s Day in God’s Service, both in public and private, than to waste your Time and Money in the Ale-house ?","Nagh vel eh, ta shiu smooinaghtyn, foddey share diu hene as da nyn Lught-thie, dy varail Laa’n Chiarn ayns Shirveish Yee, chammah ec y Cheell as ec nyn Dhie hene, na dy yummal nyn draa as nyn argid ec y Thie-lhionney ?",,64,46,
"Daily Experience shews, that it is not Religion, but the Want of it, that makes Men poor and miserable.","Ta’n ennaghtyn ain hene gagh laa soilshaghey, nagh nee Credjue, agh y Laccal echey, ta jannoo sleih boght as treih.",,64,46,
"Besides that, such good People have God’s Blessing and Favour, as I have already shewed ; and therefore He will be sure to take Care of them and theirs.","Marish shen, ec leid y sleih mie ta Bannaght as Foayr Yee, myr ta mee hannah er hoilshaghey ; as shen-y-fa bee Eh shickyr dy ghoaill kiarrail jeu hene as nyn gloan.",,64,46,
"And pray do not think that you shall be saved merely because you are poor : for if you be wicked and ungodly, you will certainly be miserable in the next World as well as this.","As guee-ym erriu ny smooinee-jee dy bee shiu er nyn sauail ooilley cooidjagh son dy nee boghtyn shiu ; son my ta shiu olk as mee-chrauee, bee shiu son shickyrys ayns treihys ’sy nah heihll chammah as ’sy theihll shoh.",,64,46,
"Lazarus was not saved because he was poor, but because he was a pious, good Man : And on the other hand, Dives was not damned for being rich, but because he was luxurious and proud, and wholly given up to pamper and adorn his Carcass.","Cha row Lazarus er ny hauail son dy row Eh boght, agh son dy row Eh ny ghooinney boght crauee : As er y laue elley, cha row Dives deyrit gys coal-anmey son y ve berchagh, agh son dy row Eh roa staydoilagh as moyrnagh, as ooilley cooidjagh er ny choyrt dy lhieeney as dy yannoo rour jeh e chorp lhou.",,64,46,
"Let me further warn you against two or three dangerous Mistakes, that harden many Men in their Sins.","Lig dou raaue sodjey chur diu noi gaa ny three dy reddyn dangeragh oddys ve goit marran, ta creoghey ymmodee sleih ayns nyn beccaghyn.",,64,46,
"Beware of thinking that it is enough for a Man to be baptized, and keep his Church, and go to Prayers and Sermons, and sometimes to the Communion ; and say his Prayers in private : And that this is enough to prove him a good Christian, and make sure of Salvation.","Gow-jee kiarrail nagh smooinee shiu dy vel eh dy liooar da dooinney dy ve er ny vashtey, dy reayll e Chredjue hene, as dy gholl gys Shirveish as dy eaishtagh rish Sharrnaneyn, as ny cheayrtyn goll gys y  Chreestiaght ; as dy ghra e Phadjeryn ayns boal er lheh : As dy vel shoh dy liooar dy phrowal Eh ny Chreestee vie, as dy yannoo shickyr jeh Saualtys.",,65,46,
"All this is very good, but this will not serve the turn, except our Hearts be so thoroughly sanctified by the Grace of God, that we do truly love God above all, and set our Hearts on the Joys of Heaven, and love our Neighbours, and be true and just in all our Dealings, temperate and chaste in our Conversation, as is before described.","Ta shoh ooilley feer vie, agh ny-yeih cha jean shoh nyn sauail, mannagh bee ny creeaghyn ain cha bollagh er nyn gasherickey liorish Grayse Yee, dy vel shin cha firrinagh shen graihagh er Jee er-skyn dy chooilley nhee, as soiaghey nyn greeaghyn er Gerjagh Flaunyss, as graihagh er nyn Naboonyn, as ve firrinagh as jeeragh ayns ooilley nyn nghellal, sheelt as glen ayns nyn ymmyrkey-bea, myr ta coontey er ny chur jeh roie.",,65,46,
"And this is the great End of Prayers, Sermons and Sacraments, to make us more and more holy in Heart and Life, without which we shall be rather worse than better for them, Matt. ","As shoh’n ard oyr ta son Padjeryn, Sharmaneyn, as Sacramentyn, dy yannoo shin ny smoo as ny smoo crauee ayns cree as bea, n’egooish bee mad laik ve ny smessey cha nee ny share er nyn son, Mian vii. 21, 22, 23.",,65,46,
"Be not so weak as to think you may be saved by a good Belief alone, by your Faith in Christ, and trusting in God, without Obedience to his Commands.","Ny bee-jee cha annoon as dy smooinaghtyn dy vod shiu ve er nyn sauail liorish Credjue mie ny lomarcan, liorish nyn Gredjue ayns Creest, as treishteil ayns Jee, fegooish Biallys y chur da e Annaghyn.",,65,46,
"It is for Christ’s Sake only you are saved. But he will save none but those who obey him, Heb. v. 9.","She son Graih Chreest ny lomarcan ta shiu dy ve er nyn sauail, agh cha saue Eh feallagh erbee agh adsyn ta cur Biallys da, Heb. v. 9.",,65,46,
"And that is only true saving Faith, which purifies the Heart, and produces Obedience, as you have heard before.","As shen ny lomarcan y Credjue firrinagh gys Saualtys, ta glenney’n chree, as gymmyrkey magh Biallys, myr ta shiu er chlashtyn roie.",,65,46,
"And since God has plainly told us, that we cannot be saved without Holiness, if we take up a foolish Confidence that we may be saved without it, this is not trusting in God, but our own Fancies and the Devil’s Delusion.","As fakin dy vel Jee dy foshlit er ninsh dooin, nagh vod mad ve er nyn sauail fegooish Craueeaght, my ghouys mad orrin hene daanys ommijagh dy vod mad ve er nyn sauail n’egooish, cha nee shoh treishteil ayns Jee, agh ayns nyn smooinaghtyn annoon hene as molteraght y Drogh Spyrryd.",,65,47,
"We may safely trust in God’s Promises ; but then let us see to perform the Conditions, and become such an humble, holy People, as he has promised for Christ’s Sake to own and save.","Foddee mad dy sauchey treishteil ayns Gialdynyn Yee ; agh eisht lig dooin kiarrail y ghoaill dy chooilleeney ny conaantyn, as cheet dy ve leid y pobble imlee as crauee, as Te er n’ghialdyn er Graih Chreest dy ghoaill roo as dy hauail.",,65,47,
"Take heed also of mistaking the Nature of Repentance, as if it were only being a little sorry for our Sins, and crying to God for Mercy, and then all will be well, though we go on still in our own Ways, But this is a most dangerous Mistake."," Gow-jee tastey myrgeddyn nagh jean-jee shiu hene y volley mychione dooghys arrys, myr dy beagh eh ynrycan dy ve red beg trimshagh son nyn beccaghyn, as geamagh gys Jee son myghin, as eisht dy bee ooilley dy mie, ga dy jed mad kinjagh er nyn doshiaght ayns nyn raadjin hene. Agh ta shoh marranys feer dangeragh.",,66,47,
"For a Man never truly repents till he forsakes his Sins, and changes his Course : When the Drunkard becomes sober, and the profane Man a devout Worshipper of God, and so continues ; true Repentance changes the Heart and Life of a Sinner.","Son cha vel dooinney dy bragh goaill arrys firrinagh derrey te treigeil e pheccaghyn, as caghlaa e ymmyrkey-bea : Tra ta’n dooinney meshtal cheet dy ve sheelt, as y dooinney mee-chrauee dy chur ooashley arrymagh da Jee, as tannaghtyn myr shen ; ta arrys firrinagh caghlaa cree as bea peccagh.",,66,47,
"And lastly, Do not think it enough to forsake some Sins, and keep others ; to do some good Duties, and neglect others, and then excuse yourselves by saying it is your Failing ; every Man has his Failing, and this is mine.","As er jerrey ; ny smooinee-jee eh dy liooar dy hreigeil paart dy pheccaghyn as dy hannaghtyn ayns peccaghyn elley ; dy yannoo paart dy churrymyn as dy lhiggey-shaghey currymyn elley, as eisht leshtallyn y yannoo er nyn son hene liorish gra dy nee nyn vailleil eh : Ta e ailleil hene ec dy chooilley ghooinney, as she shoh my ailleil’s.",,66,47,
"So says the Drunkard and the Whoremonger, and so says the angry Man when he swears or curses, or gives bad Language.","Myr shen ta’n fer meshtal as eshyn ta cur rish maardyrys gra, as myr shen ta’n dooinney corree gra tra te loo ny gueeaghyn, ny cur drogh ghlaare.",,66,47,
"But such Sins as are committed against Knowledge and Conscience, and continued from time to time,[27] when we have leisure to think beforehand, and prevent them ; these are to be reckoned as wilful Sins, not as Failings.","Agh leid ny peccaghyn as ta jeant noi tushtey as cooinsheance, as er nyn dannaghtyn ayndoo veih tra gy tra, tra ta caa ain dy smooinaghtyn ro-laue, as dy lhiettal ad, t’ad shoh dy ve coontit myr peccaghyn jeh nyn yoin, cha nee myr failleilyn.",,66,47,"[27] As Thomson remarks, in 17th‑ and 18th-century English from time to time means not ‘intermittently’ but ‘continually’, and likewise veih tra gy tra in Manx."
