English,Manx,Manx Orginal,Page,EnglishPage,Notes
"And now they are forced to live upon Bread and Water, and linger out a miserable hungry Life in a cold stinking Dungeon, till either the Charity of Friends, or Death itself, release them thence.","As nish t’ad eignit dy veaghey er arran as ushtey, as ny veggan as ny veggan dy chaeu bea hrimshagh accryssagh, ayns Dhungeon feoyr breïn, derrey nee edyr giastylys caarjin, n’yn baase hene, ad y eaysley ass.",,25,18,
"And by the Way is this such a pleasant Life, that it is worth being damned for in Hell Torments to all Eternity ?","As nish gow-jee tastey, vel shoh leid y vea eunyssagh shen, dy vel eh feeu dy ve deyrit er y hon ayns torchagh niurin son dy bragh ?","As nish gow-jee tastey, vel shoh leid y vea eunyssagh shen, dy vel eh feeu dy ve deyrit er y hon ayns torchagh niuri? son dy bragh ?",25,18,
Of which afterwards.,Mychione shoh loar-ym ny lurg shoh.,,25,18,
"Thus also might I tell of the sad Effects of Whoredom, which is commonly followed with Poverty and Disgrace, and many times with a filthy loathsome Disease, which makes Men rot above Ground.","Myr shoh neeisht oddin ginsh jeh’n jerrey trimshagh ta cheet er maardyrys, ta boghtynid as scammylt geiyrt da, as ymmodee keayrtyn doghan breïn feohdoil, ta cur er sleih lou er-skyn halloo.",,25,18,
"And thus angry, proud, malicious and revengeful People, are a continual Torment to themselves, and to all about them, and seldom have any Peace or Quiet, either with their Neighbours, or in their own Families.","As myr shoh ta sleih angyragh, moyrnagh, goanlyssagh as olkyssagh, Torchagh kinjagh daue hene, as da ooilley my geart-y-moo, as anvennick ta Shee erbee ny Fea oc, edyr rish nyn Naboonyn, ny ayns ny Lughtyn-thie oc hene.",,25,18,
"The like may be shewn of all other Vices, which are still wont to bring their own Punishment along with them ; to say nothing of what is or ought to be indicted by the Magistrate ; especially upon some wicked People as Thieves and Murderers, Traitors and Rebels, who seldom escape the Hands of public Justice.","Foddee leid cheddyn ve soilshit jeh dy chooilley Pheccah elley, ta kinjagh cliaghtey nyn gerraghey hene y choyrt lhieu maroo ; gyn veg y ghra jeh’n kerraghey ta, ny lhisagh ve er ny choyrt orroo liorish y Fer-oik ; harrish ooilley er paart dy ghrogh leih, leid as Maarlee as Dunveryn, Traytooryn as feallagh ta girree magh noi Pooaraghyn, ta anvennick scapail kerraghey foshlit.",,25,18,
"But who will hurt Men, if they be Followers of that which is Good ?","Agh quoi nee aggair da sleih, my t’ad geiyrt da shen ny ta mie ?",,25,19,
"Or what Hurt does a Man bring upon himself by living soberly and chastely, by fearing God and honouring the King ?","ny cre’n assee ta dooinney dy chur lesh er hene liorish beaghey dy sheelt as dy glen, liorish aggle y ghoaill roish Jee as ooashley y chur da’n Ree ?",,25,19,
"— What Mischief does a Man get by minding his own Business, and living quietly and peaceably among his Neighbours ?","cre’n skeilley ta dooinney dy gheddyn liorish kiarrail y ghoaill jeh e obbyr hene, as beaghey dy feagh as dy sheeoil fud e naboonyn ?",,25,19,
"Nay, how happily may we see even some of the meanest Sort of People live, that are diligent in their Callings, and sober and temperate, and careful to please God, and keep a good Conscience in all their Ways ?","dy jarroo, cre cha bannit as oddys shin fakin paart dy leih boghtey hene beaghey, ta tarroogh ayns nyn aght-beaghee, as sheelt as smaghtaghey ad hene, as kiarralagh dy wooiys Jee, as freayll cooinsheance vie ayns ooilley nyn raadjin ?",,25,19,
"— Very seldom it is that they are pinched with much Want ; or if they should fall into a low Condition, yet all good People that know them are ready to pity and relieve them ; and will often trust them with Money or Goods till they are able to pay.","Feer anvennick te dy vel ad er ny hionney lesh cooid vooar dy ymmyrch : Ny my huittagh ad ayns stayd injil, foast ta dy chooilley pheccagh mie bione ad aarloo dy ghoaill chymmey jeu as dy eaysley orroo ; as dy mennick nee ad argid ny cooid y hreishteil orroo derrey oddys ad geeck.",,26,19,
"And every Body is willing to employ an honest and industrious Man, so that he shall seldom want Work or Trading.","As ta dy chooilley annane booiagh obbyr y chur da dooinney onneragh tarroogh, myr shen dy anvennick lesh ’ve fegooish obbyr ny dellal.",,26,19,
"But idle riotous People, that follow Whoring and Drinking, Gaming and Cheating, and Stealing, that neglect God’s Service, and profane the Lord’s Day, being often in the Alehouse when they should be at Church ; these are the People, if you observe it, that do commonly fall into the basest Beggary and Misery ; and Men do but little pity them, because they brought it all on themselves.","Agh sleih litcheragh rouanagh, ta geiyrt er Streebaghyn as Iu, Gammanyn as Molteraght, as Geid, ta jannoo Meerioose er Shirveish Yee, as brishey Laa’n Chiarn, ta dy mennick ’sy Thie-lhionney tra lhisagh ad ve ec y Cheell ; t’ad shoh yn sleih, my ghouys shiu tastey jeh, s’mennick lhieu tuittym ayns y voghtynid as y treihys smoo ; as cha vooar yn accan ta sleih goaill jeu, kyndagh dy dug ad lhieu shoh ooilley orroo hene.",,26,19,
"O how happy might all sorts of People be, in a very great measure, even at present, if they would but become truly religious and good !","O cre cha bannit as oddagh dy chooilley horch dy leih y ve ayns towse feer vooar, dy jarroo ec y tra t’ayn, dy darragh ad dy ve firrinagh crauee as mie ?",,26,19,
"It is their own Sin and Folly, their Lusts and Passions, that occasion most of those Troubles and Miseries which they meet with ; though I know they used to cry out of their hard Fortune, and to lay the Blame upon others, and sometimes to murmur against God himself.","She nyn Beccah as nyn Ommijys hene, nyn Saynt as nyn Yeearreeyn foalley, s’bun da’n chooid smoo jeh ny Seaghyn as y Treihys t’ad meeteill roo ; ga ta fyss aym dy vel ad cliaghtey playnt er nyn vortun creoi, as cur foill er feallagh elley, as ny cheayrtyn playnt noi Jee hene.",,26,19,
"But they consider not how they provoke God to Anger daily by their heinous Sins, and therefore may justly feel his heavy Judgments for the same ; besides all the Mischiefs which naturally follow upon Wickedness,","Agh cha vel ad cur geill kys t’ad brasnaghey Jee gys corree dy chooilley laa liorish nyn beccaghyn eajee, as shen-y-fa t’ad feer chairagh gennaghtyn e cherraghey trome son y chooid cheddyn, marish ooilley’n olk ta dy dooghyssagh ny eiyrtys er mee-chraueeaght.",,26,19,
"and this makes their Condition to be sad indeed ; that they are always liable to the Wrath of God, and may justly expect his Vengeance to fall upon them, and to strip them of all their Comforts, and throw them into the sorest Calamities.","As ta shoh jannoo’n stayd oc treih dy jarroo ; dy vel ad kinjagh nyn lhie foshlit gys jymmoose Yee, as dy vod ad dy cairagh jercal rish e cherraghey dy huittym orroo, as dy ghoaill ooilley’n gerjagh oc vou, as ad y hilgey fo’n seaghyn s’dowilley oddys y ve.",,26,19,
"But on the contrary, here, above all, lies the good Man’s Security and Comfort, that he enjoys the Blessings and Favours of Almighty God, and therefore is sure to want nothing that’s truly good for him. ","Agh er y laue elley, ayns shoh, harrish ooilley, ta lhie saauchys as gerjagh y dooinney mie, dy vel Eh goaill soylley jeh bannaghtyn as foaryn Yee ooilley-niartal, as shen-y-fa te shickyr nagh bee Eh laccal nhee erbee ta dy firrinagh mie da.",,27,20,
"So it is promised Psalm lxxxiv. 11, 12. Matt. vi. 33. They that first seek the Kingdom of God, and the Righteousness of it, shall have all that is needful added to them.","Myr shen te er ny ghialdyn, Psalm lxxxiv. 11, 12. Mian vi. 33. Bee adsyn ta hoshiaght shirrey Reeriaght Yee as e Chairys, jeant magh lesh dy chooilley nhee ta ymmyrchagh er nyn son.",,27,20,
"So that a poor Man can have no surer Course to provide for himself and Family, than to become truly religious ; for tho’ he may not have great Things in the World, yet he shall have Food convenient.","Myr shen nagh vod dooinney boght aght shickyree ’ghoaill dy yannoo ny chour hene as Lught e Hie, na dy heet dy ve dy firrinagh crauee ; son ga nagh vod Eh reddyn mooarey ’ve echey ’sy teihll, ny-yeih yiow Eh beaghey cooie.",,27,20,
"And then, which is better than all, he shall have God’s Blessing with what he enjoys, and this will afford him more true Content and Comfort in that little he has, than a wicked Man can find in all his great Treasure. Godliness with Contentment, is the greatest Gain, Psal, xxxvii. 16. 1 Tim. vi. 6.","As eisht, shen ny ta share na ooilley, bee Bannaght Yee echey lesh ny te goaill soylley jeh, as ver shoh ny smoo dy Lhieeney-aigney as dy Gherjagh firrinagh da ayns y red fardalagh shen t’echey, na oddys dooinney mee-chrauee y gheddyn ayns ooilley e verchys vooar. Ta craueeaght lesh aigney booiaght yn cosney smoo oddys y ve, Psalm xxxvii. 16. 1 Tim. vi. 6.",,27,20,
"A poor Man that has only Jacob’s Wish, Food to eat, and Raiment to put on, if also he has Jacob’s Piety, and takes the Lord for his God, and lives in his Fear and Service, and enjoys the Sense of his Favour, how blessed is the State of this Man ?","Dooinney boght ta ynrycan Booishal Yacob echey, beaghey dy ee, as coamrey dy chur moish, my ta myrgeddyn Craueeaght Yacob echey, as Eh goaill y Chiarn son e Yee, as beaghey ayns e aggle as e hirveish, as ennaghtyn echey jeh e oar, cre cha bannit as ta stayd y dooinney shoh ?",,27,20,
"How chearfully may he live at all Times, notwithstanding his Poverty ?","cre cha gennal as oddys Eh beaghey ec dy chooilley hra, lesh ooilley e voghtynid ?",,27,20,
"What though his Dwelling be mean, his Fare somewhat hard and coarse, and his Cloathing very plain ; yet whilst he loves God sincerely, and worships him duly and devoutly, he may even turn his Cottage into a Palace, yea, a Temple ; and the blessed God will visit him with his Presence, will accept of his Services, and refresh him with the Light of his Countenance.","Abbyr my ta e ynnyd-vaghee fardalagh, e veaghey red ennagh creoi as boght, as e choamrey feer voal, ny-yeih choud as te dy firrinagh graihagh er Jee, as dy cooie as dy crauee cur ooashley da, foddee Eh e eer waane y hyndaa gys Coort Ree, dy jarroo gys Chiamble ; as nee’n Jee bannit cheet dy yeaghyn Eh lesh e Enish, Soiagh y yannoo jeh e Hirveish, as Eh y ooraghey lesh Soilshey e Eddin.",,27,20,
And upon this Knowledge and Enjoyment of God it is that the true Comfort of a Man’s Life depends. ,As she er y tushtey as y soylley shoh dy Yee ta gerjagh firrinagh dooinney ny hassoo.,,27,20,
"Whatever his outward Condition be, it is this alone which gives inward Peace and Satisfaction to his Mind, and sweetens all his Mercies ; and above all Things, bears up his Heart under those Afflictions he meets with."," Cre-erbee ta e stayd er cheu mooie, she shoh ny lomarcan ta cur Shee as Lhieeney-aigney da er cheu sthie, as jannoo dy chooilley vyghin millish da ; as harrish dy chooilley nhee cummal seose e chree fo ny seaghyn shen ta cheet ny raad.",,28,20,
"For the best of Men must expect their Share of outward Troubles in this World, such as Sickness and Pain, Loss of Friends and Estate, with the like ; these are Calamities common to all.","Son shegin da’n dooinney share jercal rish e ayrn dy hrouble er cheu mooie ’sy theihll shoh, leid as Chingys as Pian, Coal Caarjin as Cooid, marish y leid shen ; ad shoh seaghyn ta cadjin da dy chooilley ghooinney.",,28,20,
"But here the good Man has clearly the Advantage, since he looks upon all that befals him as coming from the Hand of a most wise and gracious God, who knows what is best for him, and to whose Will he freely resigns himself and all his Affairs ; saying with his blessed Master, Not my Will, O God, but thine be done.","Agh ayns shoh ta’n cosney dy cronnal ec y dooinney mie, fakin dy vel Eh jeaghyn er ooilley ny ta taghyrt da myr cheet veih laue Jee smoo creeney as graysoil, echey ta fys cre share er y hon, as gys e Aigney te dy gennal chymney seose Eh hene as ooilley ny ta bentyn da ; gra marish e vainshtyr bannit, Cha nee my Aigney’s, O Yee, agh dt’ Aigney’s dy row jeant.",,28,20,
"Yea, he receives Affliction as sent in Kindness to correct him for his Faults, to exercise and increase his Graces, and so to prepare him for Glory.","Dy jarroo, te goaill seaghyn myr er ny choyrt er ayns kenjallys dy smaghtaghey Eh son e oiljyn, dy phrowal as dy vishaghey ny graysyn echey, as myr shen dy gheddyn Eh aarloo son gloyr.",,28,21,
"And here is the great Benefit of Religion, that it teaches a man whither to go for Relief and Comfort in his Straits and Difficulties, even to this great and good God, who is most able and ready to help his People in all times of Trouble.","As ayns shoh ta vondeish mooar Credjue ny lhie, dy vel eh gynsaghey da dooinney cre’n raad dy gholl son cooney as gerjagh ayns e voghtynid as e ymmyrch, dy jarroo gys y Jee mie as mooar shoh, ta feer fondagh as arryltagh dy chooney lesh e phobble hene ayns dy chooilley hra dy heaghyn.",,28,21,
"This, we still read in Scripture, was the Course of holy Men : And they found it was not in vain.","Shoh ta shin kinjagh dy lhaih ’sy scriptyr, va cliaghtey deiney crauee : As dennee ad nagh row eh ayns fardail.",,28,21,
"And to this Day will God’s faithful Servants find the good Effects of thus devoutly applying themselves to God by Prayer, For his Eyes are ever upon the Righteous, and his Ear open to their Cry.","As gys y laa dy vel eh jiu, ennee sharvaantyn firrinagh Yee yn foays ta ayns myr shoh goll dy crauee gys Jee ayns Padjer, Son ta e hooillyn dy bragh er y chloan ynrick, as ta e chleashyn foshlit gys yn accan oc.",,28,21,
"He takes Pity on them, comforts and supports them.","Te goaill chymmey jeu, dy gherjaghey as dy niartaghey ad.",,28,21,
"He will lay no more upon them than He enables them to bear ; and in his good Time He supplies their Wants, and delivers them from their Afflictions.","Cha der Eh errey smoo orroo na oddys ad y ymmyrkey ; as ayns e hra mie te jannoo magh nyn ymmyrch, as dy livrey ad veih nyn seaghyn.",,28,21,
"Yea, he turns them into Blessings, and makes all work together for their Good, as He has promised to them that love Him, Rom. viii. 28.","Dy jarroo, te chyndaa nyn seaghyn gys bannaghtyn, as cur er ooilley gobbraghey cooidjagh son y vie oc, myr te er n’ghialdyn dauesyn ta graihagh er, Rom. viii. 28.",,28,21,
"O what Happiness is it to be acquainted with God, to have a due Sense of his Providence, so as to rely on it and approve it !","O cre’n vaynrys eh dy ve ainjyssagh er Jee, dy gheddyn ennaghtyn cooie jeh e Ard-chiarrail flaunyssagh, er leid yn aght shen as dy chur barrant er as dy ve booiagh jeh !",,29,21,
"But how sad is the Condition of a wicked Man, who has no such Knowledge of God, no Love to Him, nor any Expectations of Help and Relief from Him ?","Agh cre cha treih as ta stayd dooinney mee-chrauee, nagh vel veg dy leid y tushtey shoh dy Yee echey, veg y ghraih da, ny jercal erbee son cooney as feaysley veih ?",,29,21,
"Even in his greatest Prosperity he is a very miserable Man, whilst he lives without God in the World : But he feels himself to be so indeed, when he falls into any great Calamity, and knows not which Way to turn himself for Help and Comfort.","Dy jarroo ayns e howyrid smoo te ny ghooinney feer treih choud as te beaghey fegooish Jee ’sy theihll shoh : Agh te gennaghtyn Eh hene dy ve myr shen dy jarroo, tra te tuittym ayns seaghyn mooar erbee, as nagh vel fyss echey cre’n raad dy hyndaa Eh hene son cooney as gerjagh.",,29,21,
For as Wickedness still brings men into Misery (as I have before shewn) so there it leaves them in the most wretched forlorn Condition.,Son myr ta mee-chraueeaght kinjagh leeideil deiney gys treihys (myr ta mee roie er hoilshaghey) myrgeddyn ayns shen te fagail ad ayns y stayd smoo hreih neu-gherjoil.,,29,21,
"And the ill Temper of their Mind, adds Weight and Load to their Calamities, and grievously encreases the Smart of them.","As ta’n drogh stayd dy aigney t’ad fo, cur trimmid as laad gys ny seaghyn oc, as dy trome jannoo’n gheyr[6] oc ny smoo.",,29,21,"[6] CL’s note on dy gheyr in Hymn 8: “This word is discussed by Thomson (1998: 101) in his edition of Yn Fer-raauee Creestee, note on 29.17 ‘jannoo’n gheyr oc ny smoo: ‘encreases the Smart of them’, Kelly’s gearr ‘sharpness’. The word is evidently a relative of the adj. geyre, G. geur and such a noun occurs in ScG. with the appropriate sense ‘edge, sharpness’ but m.; for a f. [as indicated by yn gheyr] we require the derivative géire ‘sharpness, bitterness’. Cf. pian as geyr 30.6.’ Thomson does not note Cregeen’s dy gheir, s. of smart or pain. G’ and ‘gyersnagh, s. m. a smart; pl. -yn.’ The spelling geir might suggest a slender r, although representation of this is not consistent in Classical Manx orthography, and still less in Cregeen, as the contrast seems to have been in the process of being lost. Loss of final schwa from géire might require explanation, as this is not usual in original bisyllables in Manx outside certain environments, such as following clusters of sonorants, such as oarn ‘barley’, G. eorna; arn ‘sloe, G. airne; Baarle ‘English’, G. Béarla (and is not consistent even in this environment, as baarney ‘gap’, G. bearna, cf. Sc. beàrn). Elsewhere in bisyllables the schwa is usually retained, so caashey ‘cheese’, G. cáise (again cf. loss in Sc. càis); carrey ‘friend’, G. cara; kiuney ‘calm’, G. ciúine, etc.; genney ‘dearth’, G. gainne (from gann, Manx goa(u)n). The last two would be parallel formations to géire. On the other hand, loss of schwa in this position might be a motivation for the addition of the suffix -id in most of these forms in Manx (as in geyrid ‘sharpness’; the original formation seems to have been retained mainly in specialized senses, so kiuney ‘a calm’ (at sea), kiunid ‘calmness’). We cannot therefore be sure whether Manx geir etc. represent géar (Sc. geur) or géire; if the former, it is quite possible that it became feminine under the influence of the general Manx tendency to make abstract nouns feminine (cf. nouns in -ys) and/or by analogy with semantically similar items pian, guin.”"
"The Sense of their own Guilt sometimes torments their Consciences, and fills them with Fear and Horror : ","Ta ennaghtyn jeh nyn beccaghyn hene ny cheayrtyn torchaghey nyn gooinsheance, as lhieeney ad lesh aggle as atchim.",,29,21,
"Sometimes they rage and fret against those that bring on their Sufferings, and sometimes they even blaspheme God himself, and murmur against his Providence.","Ny cheayrtyn t’ad eulyssagh as laane dy farg noi ocsyn ta cur lhieu nyn seaghyn orroo, as ny cheayrtyn t’ad loart goan mollaghtagh noi Jee hene, as playnt er e Ard-chiarrail.","Ny cheayrtyn t’ad eulyssagh as laane dy farg noi ocsyn ta cur lhieu nyn seaghyn orroo, as ny cheayrtyn t’ad loart goan mollaghtagh noi Jee hene, as playnt er e Ard chiarrail.",29,21,
"Whilst the good Man, with Job, blesses God in all his Afflictions ; these are ready to follow the Counsel of his Wife, even to curse God and die.","Choud as ta’n dooinney mie, marish Job, cur bannaght da Jee fo dy chooilley heaghyn ; t’ad shoh aarloo dy eiyrt er coyrle y Ven echey, dy jarroo dy ghueeaghyn da Jee as dy gheddyn vaaish.",,29,22,
"For being full of Anguish and Despair, they are at their Wit’s End, and weary of their very Lives, as we read of Cain and Judas, and such like, both in Scripture and other History.","Son myr t’ad laane dy angaaish as dy vee-hreishteil, t’ad ec kione nyn geilley, as skee jeh nyn mioys hene, myr ta shin lhaih mychione Cain as Yuase, as nyn leid shen, chammah ayns y Scriptyr as Lioaryn elley skeiley.[7]",,29,22,"[7] Thomson takes skeiley as gen. of skeeal ‘not corresponding to the usual G. scéil or sceòil, but to the ScG. alternative sgéile.’"
"For my Part, I do verily think, that next to the Devils and those in Hell, there are no Creatures in the World more miserable than wicked and ungodly People ; and whilst we see what the common Fruit of Sin is here on Earth we may easily be convinced that it leads to Hell and Damnation hereafter.","Er my hon’s, ta mee dy jarroo smooinaghtyn, cheu-mooie jeh ny Jouill as adsyn t’ayns niurin, nagh vel cretooryn erbee ’sy theihll ny s’treih na sleih olk mee-chrauee ; as choud as ta shin fakin cre ta mess cadjin peccah ayns shoh er y thalloo, foddee mad dy aashagh v’er nyn shickyraghey dy vel eh leeideil gys niurin as coal-anmey ny lurg shoh.",,30,22,
"And all this do Men madly and wilfully run into by their own evil Doings ; even as a Man that thrusts his Hand into the Fire, is like to feel Pain and Smart.","As ooilley shoh ta sleih dy mee-cheeallagh as jeh nyn yoin roih ayn liorish nyn nghrogh yannoo hene ; dy jarroo myr ta dooinney ta puttey e laue ’syn aile, laik gennaghtyn pian as geyr.",,30,22,
"By forsaking God they forsake their own Mercies ; and sinning against him, they wrong their own Souls ; yea, their Bodies too, and all their Concerns.","Liorish treigeil Jee, t’ad treigeil nyn myghinyn hene ; as tra t’ad jannoo peccah noi echyssyn, t’ad cur aggair da ny hanmeenyn oc hene ; dy jarroo da nyn gallinyn neeisht, as da ooilley ny t’oc ’sy theihll.",,30,22,
"Thus you see that an holy Life is most profitable for us, even in this present World, preventing much Evil, and bringing all manner of Good along with it.","Myr shoh ta shiu fakin dy vel bea chrauee feer vondeishagh dooin, dy jarroo ’sy theihll shoh hene, freayll lane olk voin, as cur lesh marish dy chooilley vonney dy vie.",,30,22,
"Or if a Man should fall into such hard Times, as to suffer merely for Religion and a good Conscience, he shall then commonly find such wonderful Comfort and Satisfaction of Mind, that he will triumph and rejoice in the midst of his Sufferings ; as we know the Apostles and primitive Christians did, and that especially in hope of the glorious Reward laid up for good Men in Heaven.","Er nonney dy daghyragh dooinney dy huittym ayns leid ny traghyn dowil shen as dy hurranse ooilley cooidjagh er graih Credjue as Cooinsheance vie, nee Eh ec y tra shen dy mennick geddyn leid y gerjagh yindyssagh as aash ayns e aigney, dy jean Eh boggey as gerjagh y ghoaill ayns mean e heaghyn ; myr ta fyss ain ren ny Ostyllyn as ny chied Chreesteenyn, as shen er-skyn ooilley ayns treishteil jeh’n leagh gloyroil kiarit da deiney mie ayns niau.",,30,22,
But that brings me to the last Consideration I shall mention ;,Agh ta shoh dy my leeideil gys y chied red nee’m y enmys ta tastey dy ve goit jeh.,,30,22,
"Lastly, namely, That an holy Life, through the rich Mercy of God, will render us perfectly and eternally blessed in the World to come ; whereas a wicked Course of Life, leads to eternal Misery and Torment.","Er jerrey, ta shen dy ghra, Dy jean Bea chrauee, trooid myghin verchagh Yee, shinyn y yannoo dy firrinagh as er son dy bragh bannit ayns y theihll ta ry heet ; son whooish as dy vel Bea olk y chaeu leeideil gys treihys as torchagh son dy bragh.",,30,22,
"According as we live in this World, so must we fare in the next ; for this Life is a State of Trial in order to Eternity.","Myr ta shin er n’ymmyrkey nyn mea ayns y theihll shoh, myr shen nee mad farral ayns yn nah heihll ; son ta’n vea shoh stayd dy hrial shin cour y vea veayn.","Myr ta shin er n’ymmyrkey nyn mea ays y theihll shoh, myr shen nee mad farral ayns yn nah heihll ; son ta’n vea shoh stayd dy hrial shin cour y vea veayn.",30,22,
"Even at Death a good Man has Ground of much Comfort, having the Testimony of a good Conscience, and the Sense of God’s Love, so that with St. Stephen, he may commit his Soul into the Hands of the Lord Jesus who is ready to receive him.","Dy jarroo ec oor y vaaish ta oyr dy vooarane gerjagh ec dooinney mie, myr ta cooinsheance vie gymmyrkey feanish lesh, as ennaghtyn echey jeh Graih Yee, myr shen, marish y Noo Steaon, dy vod Eh e annym y hymney gys laueyn y Chiarn Yeesey, ta aarloo dy yannoo soiagh jeh.",,30,22,
"But how sad is it with a wicked Man, when beside all the Pains of the Body, his mind is tormented with the Remembrance of his Sins, and with the Fear of God’s Wrath ?","Agh cre cha trimshagh as ta stayd dooinney olk, marish ooilley pianyn y challin, tra ta e aigney torchit lesh cooinaghtyn jeh e pheccaghyn, as lesh aggle roish jymmoose Yee ?",,31,22,
"But the great Difference will be made at the Day of Judgment, when the Sheep shall be set at Christ’s right Hand, and the Goats on the left ; as you have it described, Matt. xxv. 31, &c.","Agh y caghlaa mooar ta eddyr deiney mie as olk vees er ny yannoo ec laa ny briwnys, tra vees ny Kirree er nyn goyrt er laue yesh Chreest, as ny Goair er y laue chiare ; myr ta coontey eu jeh, Mian xxv. 31, &c.",,31,23,
"To those on the right Hand, that is, the Pious and Good, will be pronounced that joyful Sentence, Come ye blessed of my Father, inherit the Kingdom prepared for you from the Foundation of the World.","Dauesyn er y laue yesh, ta shen, dauesyn ta Crauee as Mie, vees er ny ockley magh yn vriwnys gherjoil shen, Tar-jee, chloan vannit jeh my Ayr, gow-jee myr eiraght yn reeriaght ta kiarit er nyn son er dy hoshiaght y theihll.",,31,23,
