English,Manx,Manx Original,Notes,Page
"When you hear of the death of others, how proper and useful a reflection would this be, “They are gone into eternity!” When you hear the solemn sound of a tolling bell, think “Another soul is gone into eternity!” When you see the funeral of a neighbour, think, “His time is ended; he has arrived at his eternal  home, and is fixed in an unchangeable state: man giveth up the ghost, saith Job, and where is he? What is become of him, whom but a few days ago we saw and conversed with? In what place, with what company is he now? While I am thus reflecting, what does he see, and feel, and think? And how soon will the same thing be said concerning me also? He is dead! Oh! that solemn, awful day that shall finish my course; that infinitely important day when I must enter upon eternity!” Surely these just and natural reflections should make me serious, as they did a very eminent courtier and statesman, in Queen Elizabeth’s time (Secretary Walsingam,) whose memorable words cannot fail to make some impression on every reader. This great man having retired from the busy world into the privacy of the country, some of his gay companions rallied him on his becoming religious, and told him he was melancholy. “No,” said he, “I am not melancholy, but I am serious; and ’tis fit I should be so.” ","Tra ta shiu clashtyn jeh baase sleih elley, cre cha cooie as vondeishagh veagh eh dy smooinaghtyn myr shoh, “T’ad ersooyll gys beaynid!” Tra ta shiu clashtyn bwoalley trome yn chlag verriu, smooinee-jee, “ta annym elley ersooyll gys beaynid!” Tra ta shiu fakin oanluckey naboo, smooinee-jee “ta’n traa echeysyn ec kione; Te’h er roshtyn gys e hie dy bragh farraghtyn, as er ny hickyraghey ayns stayd nagh jin dy bragh caghlaa: ta dooinney paartail as c’raad te’h? ta Job gra. Cre’n erree t’er jeet ersyn nagh vel agh beggan beg dy laghyn neayr as ren shin fakin as pleadeil rish? Ayns cre’n ynnyd, ayns cre’n cheshaght t’eh nish? Choud as ta mish myr shoh resooney rhym pene, cre ta eshyn fakin, as gennaghtyn, as smooinaghtyn? As cre cha leah as vees yn red cheddin er ny ghra myrgeddin jeems! T’eh marroo! O s’arrymagh yn laa shen ver jerrey er yn traa aym’s; yn laa dy hrymmyd erskyn insh shen tra sheign dou goll stiagh ayns beaynid!” Shickyr lhissagh resooney er yn aght cooie shoh cur orrym smooinaghtyn dy dowin, myr ren ad er fer jeh ny deiney syrjey ’sy reeriaght ayns traa yn Ven-reïn Elizabeth, yn goan weityl echey shegin greme y goaill er aigney dagh unnane ta lhaih ad. Hie yn dooinney ooasle shoh dy lhiattee veih cooishyn seihltagh gys thie er y cheer, ayns e henn laghyn dy yeeaghyn stiagh ny s’geyrey ayns stayd e annym: haink e henn cumraagyn dy yeeaghyn eh, as dooyrt ad rish dy row eh er n’aase ro-chrauee, dy row eh trome-chreeagh. “Cha vel mee trome-chreeagh,” as eshyn, “agh ta mee dy dowin smooinaghtagh; as te’h cooie as cair dou myr shen dy ve.”","Tra ta shiu clashtyn jeh baase sleih elley, cre cha cooie as vondeishagh veagh eh dy smooinaghtyn myr shoh, “T’ad ersooyll gys beaynid!” Tra ta shiu clashtyn bwoalley trome yn chlag verriu, smooinee jee, “ta annym elley ersooyll gys beaynid!” Tra ta shiu fakin oanluckey naboo, smooinee jee “ta’n traa echeysyn ec kione; Te’h er roshtyn gys e hie dy bragh farraghtyn, as er ny hickyraghey ayns stayd nagh jin dy bragh caghlaa: ta dooinney paartail as c’raad te’h? ta Job gra. Cren erree t’er jeet ersyn nagh vel agh beggan beg dy laghyn neayr as ren shin fakin as pleadeil rish? Ayns cre’n ynnyd, ayns cre’n cheshaght t’eh nish? Choud as ta mish myr shoh resooney rhym pene, cre ta eshyn fakin, as gennaghtyn, as smooinaghtyn? As cre cha leah as vees yn red cheddin er ny ghra myrgeddin jeems! T’eh marroo! O s’arrymagh yn laa shen ver jerrey er yn traa aym’s; yn laa dy hrymmyd erskyn insh shen tra sheign dou goll stiagh ayns beaynid!” Shickyr lhissagh resooney er yn aght cooie shoh cur orrym smooinaghtyn dy dowin, myr ren ad er fer jeh ny deiney syrjey ’sy reeriaght ayns traa yn Ven-reïn Elizabeth, yn goan weityl echey shegin greme y goaill er aigney dagh unnane ta lhaih ad. Hie yn dooinney ooasle shoh dy lhiattee veih cooishyn seihltagh gys thie er y cheer, ayns e henn laghyn dy yeeaghyn stiagh ny s’geyrey ayns stayd e annym: haink e henn cumraagyn dy yeeaghyn eh, as dooyrt ad rish dy row eh er n’aase ro-chrauee, dy row eh trome chreeagh. “Cha vel me trome-chreeagh,” as eshyn, “agh ta mee dy dowin smooinaghtagh; as te’h cooie as cair dou myr shen dy ve.”",,5
"Ah! my friends! while we laugh, all things are serious round about us. God is serious, who exerciseth patience towards us: Christ is serious, who shed his blood for us; the Holy Spirit is serious, in striving against the obstinacy of our hearts: the holy Scriptures bring to our ears the most serious things on the world; the whole creation is serious in serving God and us: all that are in heaven or hell, are serious:—How then can we be gay?",,,,6
"Let us then maintain a steadfast regard to eternity, wherever we are, and whatever we do. Were we deliberately to compare temporal and eternal things, we could never imagine that providing for the present life was worthy so many hours thought and labour every day, and eternity scarce worthy half a thought in many hours, and perhaps not one fixed serious thought in many days. Proper thoughts of eternity will restrain our immoderate fondness for the things of time; they will show us that riches, honours, and pleasures of this life are all temporary, fading, and deceitful. They will teach us to follow even our lawful worldly business with moderation, by reminding us that we have more important affairs to attend to. They will abate our fondness for the distinctions of the world, which are so generally prized. The honours of this world cannot silence a clamorous conscience, much less can they suspend their possessor’s eternal doom. A great man had an extraordinary mark of distinction sent him by his prince, as he lay on his death-bed. “Alas!” said he, looking coldly upon it, “this is of immense value in this country; but I am just going to a country where it will be of no service to me.”","Lhig dooin eisht freayll seose ayns nyn greeaghyn smooinaghtyn dowin jeh beaynid, cre theihll ta shin, as cre erbee ta shin jannoo, Dy beagh shin dy ciarailagh dy holaghey ny reddyn ta cherraghtyn rish ny reddyn ta farraghtyn son dy bragh, cha noddagh shin dy bragh smooinaghtyn dy vel kiarailyn yn seihll shoh feeu whilleen oor dy smooinaghtyn as dy laboragh dy chooilley laa, as beaynid scoan feeu un smooinaght dowin ayns laane ooryn, ny foddee ayns laane laaghyn. Nee smooinaghtyn cooie mychione beaynid charbaa nyn ghraih veih ny reddyn ta cherraghtyn; nee ad soilshaghey dooin dy vel berchys, as ooashley, as eunyssyn yn vea shoh molteyragh as dy leah lheih ersooyl. Nee ad gynsaghey dooin dy eiyrt da nyn gooishyn seihlltagh fegooish rour imnea, liorish coyrt shin ayns cooinaghtyn dy vel cooishyn jeh scansh smoo ain dy chur tastey daue. Nee ad cooney lhien dy hoiaghey beg jeh reddyn ard yn seihll, ta son y chooid smoo dy mooar er ny hoiaghey jeu. Cha nod ooashley yn seihll shoh cur ny host oghsan cooinsheanse guint, foddey sloo lhiettal yn vooinjer ta goaill soylley jeu veih coayll anmey dy bragh farraghtyn. Va dooinney ooasle dy row as gioot costal er ny choyrt huggey veih’n Ree tra ve’h ny lhie er e lhiabbee vaaish. “Ales!” as eshyn, (ceau shilley feayr er,) “ta shoh jeh trymmid vooar ayns y cheer shoh; agh ta mish chelleeragh goll roym gys cheer raad nagh bee eh jeh ymmyd erbee dou.”",,,6
"In like manner, considerations of eternity will restrain your fondness for the diversions and amusements of life. You will have better things to mind; nobler objects to pursue. A lady who has spent the evening at cards and in gay company, returning at night, found her servant maid reading a religious book; she looked over her shoulder, and said, “Poor melancholy soul! what pleasure canst thou find in poring so long over that book?” That night the lady could not sleep, but lay sighing and weeping: her servant repeatedly asked her what was the matter. At length she burst into a flood of tears, and said: “Oh! it was one word that I saw in your book that troubles me; there I saw that word eternity. —Oh! how happy should I be if I were prepared for eternity!” The consequence of this impression was, that she laid aside her cards, forsook her gay company, and set herself seriously to prepare for another world. That eminent man, Mr. Philip Henry, when he felt the most acute pain in a fit of the stone, said, “I am tormented, but, blessed be God, not in this flame. I am on fire, but, blessed be God, it is not the fire of hell!”","Ayns yn aght cheddin, nee smooinaghtyn er beaynid taarn ersooyl yn ghraih ain voish reaiyd as fardailyssyn yn seihll shoh. Bee reddyn shaare eu dy chur tastey daue. Haink ben-seyr dy row, thie, lurg jee veh er cheau yn fastyr cloie er caartyn, as ayns sheshaght faardailagh, as hooar ee e sharvaant lhaih lioar chrauee; yeeagh ee harrish e gheaylyn as dooyrt ee, “Chretoor boght trome-chreeagh! cre’n taitnys oddys oo geddyn ayns blakey choud er y lioar shen?” Yn oie shen cha noddagh yn ven-seyr cadley, agh lhie ee gosnaghey as dobberan: vrie e sharvaant jee keayrt as keayrt cre va jannoo urree. Ec y jerrey brishey magh ayns thuilley dy yeïr dooyrt ee, “O! she un ockle honnick mee ayns y lioar ayds ta dy my heaghney: ayns shen honnick mee yn fockle shen beaynid. O! cre cha maynrey as veen dy been[3] aarloo son beaynid!” Eiyrtys yn ennaghtyn shoh, va dy hreig ee e caartyn as e sheshaght fardailagh as ghow ee toshiaght dy jeidjagh dy yannoo aarloo son seihll elley. Dooyrt yn dooinney crauee shen, Philip Henry, tra dennee eh pianyn s’geyrey ny claaghyn-geil,[4] “Ta mee er my horchaghey, agh bannit dy row Jee, cha nee ‘ayns y lossey shoh.’ Ta mee er aile, agh bannit dy row Jee, cha nee aile niurin t’ayn.”","Ayns yn aght cheddin, nee smooinaghtyn er beaynid taarn ersooyl yn ghraih ain voish reaiyd as fardailyssyn yn seihll shoh. Bee reddyn shaare eu dy chur tastey daue. Haink ben-seyr dy row, thie, lurg jee veh er cheau yn fastyr cloie er caartyn, as ayns sheshaght faardailagh, as hooar ee e sharvaant lhaih lioar chrauee; yeeagh ee harrish e gheaylyn as dooyrt ee, “Chretoor boght trome-chreeagh! cre’n taitnys oddys oo geddyn ayns blakey choud er y lioar shen?” Yn oie shen cha noddagh yn ven-seyr cadley, agh lhie ee gosnaghey as dobberan: vrie e sharvaant jee keayrt as keayrt cre va jannoo urree. Ec y jerrey brishey magh ayns thuilley dy yeïr dooyrt ee, “O! she un ockle honnick mee ayns y lioar ayds ta dy my heaghney: ayns shen honnick mee yn fockle shen beaynid. O! cre cha maynrey as veen dy been[3] aarloo son beaynid!” Eiyrtys yn ennaghtyn shoh, va dy hreig ee e caartyn as e sheshaght fardailagh as ghow ee toshiaght dy jeidjagh dy yannoo aarloo son seihll elley. Dooyrt yn dooinney crauee shen, Philip Henry, tra dennee eh pianyn s’geyrey ny claaghyn-geil[4] “Ta mee er my horchaghey, agh bannit dy row Jee, cha nee ‘ayns y lossey shoh.’ Ta mee er aile, agh bannit dy row Jee, cha nee aile niurin t’ayn.”","[3] veen dy been] i.e. veign dy beign
[4] claaghyn geil] Cregeen: ‘claghyn-geayl, s. the stone, or what is termed gravel in the bladder;’ Kelly: ‘CLAGH-UAILL, s. pl. CLAGHYN-UAILL, the stone or gravel in the bladder and kidneys, which is derived from claghyn-dy-uaill, urine stones, or eayl, lime.’ ‘FEAYL, s. urine; as clagh-eayl, the stone.’ ScG. clach-fhuail ‘kidney stone, renal calculus’; Ir. clocha fuail (eDIL s.v. 1 fúal dil.ie/24640 ‘urine’).",6
A regard to eternity would make us serious and lively in all the duties of religion. ,Yinnagh tastey choyrt da beaynid shin y yannoo arrymagh as jeean ayns ooilley ny curmyn dy chraueeaght.,,,7
"A celebrated painter among the ancients, being asked why he took so much pains about his pictures, answered, “I am painting for eternity.” ",,,,7
"This thought, “I am reading, I am hearing for eternity,” would put life and vigour into our religious exercises.","Yinnagh yn smooinaght shoh, dy vel shin lhaih as cliashtyn son beaynid cur bioys as jeeanid da ooilley nyn shirveish crauee.",,,7
"Serious thoughts of eternity will render the gospel of Jesus Christ unspeakably precious. They will lead us to receive those humbling truths which are so opposite to the pride of worldly men. Why is it that the approach of death and eternity fills the mind with fear and apprehension? It is because we are sinners: and therefore “judgment is come upon all men to condemnation;” and indeed it is “a fearful thing to fall into the hands of the living God.” When these terrors of the Lord have taken hold of the conscience, how refreshing is it to hear that the word of God reveals a free, full, and everlasting salvation! It publishes pardon and eternal life as the gift of God, through the obedience and death of his Son Jesus Christ; without which there could have been no forgiveness of sin, no admission into eternal happiness.","Yinnagh smooinaghtyn dowin er beaynid jannoo sushtal Yeesey Creest erskyn towse deyr dooin. Yinnagh ad leeideil shin dy ghoaill greme er ny firrineyssyn mooarey shen ta shassoo noi as ginjillaghey moyrn deiney seihltagh. Cre’n fa ta shilley jeh baase as beaynid lhieeney yn aigney lesh aggle as atchym? T’eh er yn oyr dy vel shin peccee, as shen y fa ta “vriwnys[5] er jeet er dy chooilley ghooinney gys deyrey;” as ayns firrinys “t’eh red atchymagh dy huittym ayns laueyn yn Jee bio.” Tra ta atchymyn yn Chiarn er ghoaill greme er y chooinsheanse, cre cha gerjoilagh as t’eh dy chlashtyn dy vel goo Yee fockley magh Saualtys nastee, fondagh as dy bragh farraghtyn! T’eh fockley magh pardoon as yn vea dy bragh farraghtyn myr gioot Yee trooid biallys as baase e Vac Yeesey Creest; n’egooish cha noddagh shin dy bragh v’er chosney leih peccaghyn, ny eiraght ayns reeriaght niau.","Yinnagh smooinaghtyn dowin er beaynid jannoo sushtal Yeesey Creest erskyn towse deyr dooin. Yinnagh ad leeideil shin dy ghoaill greme er ny firrineyssyn mooarey shen ta shassoo noi as ginjillaghey moyrn deiney seihltagh. Cre’n fa ta shilley jeh baase as beaynid lhieeney yn aigney lesh aggle as atchym? Teh er yn oyr dy vel shin peccee, as shen y fa ta “vriwnys[5] er jeet er dy chooilley ghooinney gys deyrey;” as ayns firrinys “teh red atchymagh dy h?ttym ayns laueyn yn Jee bio.” Tra ta atchymyn yn Chiarn er ghoaill greme er y chooinsheanse cre cha gerjoilagh as teh dy chlashtyn dy vel goo Yee fockley magh Saualtys nastee, fondagh as dy bragh farraghtyn! T’eh fockley magh pardoon as yn vea dy bragh farraghtyn myr gioot Yee trooid biallys as baase e Vac Yeesey Creest; n’egooish cha noddagh shin dy bragh v’er chosney leih peccahyn, ny eiraght ayns reeriaght niau.",[5] vriwnys] Unjustified lenition here. Rom. 5.18: ‘haink briwnys er dy chooilley ghooinney gys deyrey.’,7
"It is therefore only through faith in his blood that we can hope for the justification of our persons. It is only through the power of grace that we can attain a meetness for the inheritance above. Thus shall we excite and cherish the most grateful and affectionate emotions of the heart towards our Lord Jesus Christ, and God even our Father, “who has loved us, and given us everlasting consolation, and good hope through grace:” and, in proportion to the solidity and liveliness of that hope, it will fill us with joy unspeakable and full of glory.","She ynrycan er y fa shen trooid credjue ayns yn uill echeysyn oddys shin treishteil dy ve er nyn seyrey, she ynrycan trooid berchys e ghrayse oddys mayd ve jeant cooie son eiraght ny nooghyn ayns soilshey. Myr shoh nee mayd freayll seose ayns nyn greeaghyn yn booise syrjey as yn ghraih[6] s’ jeean er nyn Jiarn Yeesey Creest as er Jee eer nyn Ayr “t’er ny ve graihagh orrin as er choyrt dooin gerjagh dy bragh farraghtyn, as treishteil mie, trooid grayse;” as ayns yn un towse as ta firrinys as jeeanid yn treishteil shen ain, nee eh lhieenney shin lesh “boggey erskyn insh as lane dy ghloyr.”","She ynrycan er y fa shen trooid credjue ayns yn uill echeysyn oddys shin treishteil dy ve er nyn seyrey, she ynrycan trooid berchys e ghrayse oddys mayd ve jeant cooie son eiraght ny nooghyn ayns soilshey. Myr shoh nee mayd freayll seose ayns nyn greeaghyn yn booise syrjey as yn ghraih[6] s’ jeean er nyn Jarn Yeesey Creest as er Jee eer nyn Ayr ter ny ve graihagh orrin as er choyrt dooin gerjagh dy bragh farraghtyn, as treishteil mie, trooid grayse;” as ayns yn un towse as ta firrinys as jeeanid yn treishteil shen ain, nee eh lhieenney shin lesh “boggey erskyn insh as lane dy ghloyr.”",[6] ghraih] text ghraish,8
"And now, candid reader, permit me to request that you would most seriously and carefully review this subject, and ask yourself—“Oh! my soul, art thou prepared for eternity?” Prepared or not, eternity is at hand. Let me entreat this small favour of you, to retire this very day, and spend a little time thinking on eternity. Ponder in your mind, wat it is to live for ever in a state of endless happiness, or endless misery. If you will do this, I shall have a cheerful hope, that one quarter of an hour, so spent, will be the most profitable you ever spent in all your life; and that God will make the meditation useful to your soul, and the beginning of eternal felicity. If I thought an apology necessary for dwelling so long on eternity, and being so earnest in this address, that apology should be no other than the answer which a pious man once made to this question from his friend, “Why do you spend so much time in reading, meditation, and prayer?” The good man lifted up his eyes and hands to heaven, and said, with great solemnity—For ever! for ever! for ever!","As nish, uss ta lhaih ny goan shoh, sur dou dy yeearree ort, dy ghoaill shilley dowin as tastagh jeh’n chooish shoh ta jeh scansh erskyn insh, as brie jeed hene— “O my annym, vel uss aarloo son beaynid?” Aarloo ny neu-aarloo ta beaynid ergerrey. Lhig dou geearree yn foayr shoh jeed, dy jean oo yn eer laa jiu goll dy lhiattee as ceau red beg dy hraa ayns smooinaghtyn er beaynid. Smooinnee dy dowin cre t’eh dy ve bio son dy bragh ayns maynrys dy bragh farraghtyn, er nonney ayns treihys nagh bee dy bragh ny dy bragh ec kione. Shoh my nee oo, bee treishteil gerjoilagh aym dy bee un chiarroo oor er ny cheau myr shoh yn traa s’vondeishee cheau oo rieau ayns ooilley laaghyn dty heihll; as dy jean Jee lheid ny smooinaghtyn y yannoo vondeishagh da dty annym, as toshiaght maynrys dy bragh farraghtyn. Dy been smooinaghtyn dy vel leshtal erbee ymmyrchagh son tannaghtyn choud er y chooish shoh, as son ve cha jeean ayns shen ny ta mee er ghra, cha beeagh yn leshtal shen arragh agh yn ansoor hug dooinney crauee da’n feysht shoh veih fer jeh e chaarjyn, “Cre hon t’ou ceau wheesh dy hraa ayns lhaih ny Scriptyryn, ayns smooinaghtyn casherick rhyt hene, as ayns padjer?” Hrog yn dooinney crauee seose e laueyn as e hooillyn gys niau, as dooyrt eh lesh laane arry as jeeanid— “Son dy bragh! son dy bragh! son dy bragh!”","As nish, uss ta lhaih ny goan shoh, sur dou dy yeearree ort, dy ghoaill shilley dowin as tastagh jeh’n chooish shoh ta jeh scansh erskyn insh, as brie jeed hene— “O my annym vel uss aarloo son beaynid?” Aarloo ny neu-aarloo ta beaynid ergerrey. Lhig dou geearree yn foayr shoh jeed, dy jean oo yn eer laa jiu goll dy lhiattee as ceau red beg dy hraa ayns smooinaghtyn er beaynid. Smooinnee dy dowin cre teh dy ve bio son dy bragh ayns maynrys dy bragh farraghtyn, er nonney ayns treihys nagh bee dy bragh ny dy bragh ec kione. Shoh my nee oo, bee treishteil gerjoilagh aym dy bee un chiarroo oor er ny cheau myr shoh yn traa s’vondeishee cheau oo rieau ayns ooilley laaghyn dty heihll; as dy jean Jee lheid ny smooinaghtyn y yannoo vondeishagh da dty annym, as toshiaght maynrys dy bragh farraghtyn. Dy been smooinaghtyn dy vel leshtal erbee ymmyrchagh son tannaghtyn choud er y chooish shoh, as son ve cha jeean ayns shen ny ta mee er ghra, cha beeagh yn leshtal shen arragh agh yn ansoor hug dooinney crauee da’n feysht shoh veih fer jeh e chaarjyn, “Cre hon t’ou ceau wheesh dy hraa ayns lhaih ny Scriptyryn, ayns smooinaghtyn casherick rhyt hene, as ayns padjer?” Hrog yn dooinney crauee seose e laueyn as e hooillyn gys niau, as dooyrt eh lesh laane arry as jeeanid— “Son dy bragh! son dy bragh! son dy bragh!”",,8
,,,,8
"Liverpool: Printed at the Circus-street Free School; and sold at the Tract Depository, 61, Circus-street; where may be had, the Tracts published by the Religious Tract Society, the Cheap Repository, and the Edinburgh Tract Society.","Liverpool: Printed by R. Telling, for the Manks Society for promoting the Education of the Inhabitants of the Isle of Man through the medium of their own language.",,,8
,,,,
,,,,
,,,,
,,,,
,,,,
,,,,
,,,,
,,,,