English,Manx,Manx Original,Notes,Page
R. T. S. No. 63.,No. 63. M.,,,1
SERIOUS,SMOOINAGHTYN CRAUEE,,,1
THOUGHTS,mychione,,,1
on,BEAYNID.,,,1
ETERNITY.,,,,1
Eternity! What is it? Who can explain it? Who can comprehend it?,Beaynid! Cre t’eh? Quo oddys eh y hoilshaghey? Quoi oddys eh y hoiggal? Ta Beaynid fegooish jerrey as fegooish caghlaa.,,,1
" Eternity is a duration without limits. Properly speaking, that only is eternal which hath neither beginning nor end. In this sense, God alone is eternal. There never was a time when He was not. His existence is not capable of being measured by any period of time, ever so often repeated and multiplied. “He is the same from everlasting to everlasting; He was, and is, and is to come; the high and lofty One who inhabiteth eternity.” There are some creatures which have both a beginning and an end, as the whole brute creation. There are others which have had a beginning, but shall have no end: such are angels and the spirits of men. ",,,,1
"But oh? how deeply does it concern a creature born to live for ever, to make himself acquainted with that future state to which he is hastening: and what subject is more suited to restrain the licentiousness of this thoughtless, luxurious age, than that of eternity? Let a few minutes then be devoted to the serious perusal of the following pages and may they be read with a mind disposed to offer up to God such desires as these.","O cre cha faagys as t’eh bentyn eisht rish cretoor ta ruggyt dy veh bio son dy bragh dy yannoo eh hene ainjyssaghh er y stayd dy bragh farraghtyn shen huggey t’eh dy siyragh tayrn: as cre ta cha cooie dy lhiettal mee-chraueeaght yn cheeloghe lhag-chiarailagh, rouanagh shoh, as smooinaghtyn er Beaynid? Lhig da tammylt dy hraa er-y-fa shen veh er ny vaarail er ny focklyn giarey shoh as dy vod ad greme y ghoaill er y chree lhig dauesyn ta lhaih ad dy jeean chebbal seose gys Jee lheid ny yeearreeyn shoh:—","O cre cha faagys as t’eh bentyn eisht rish cretoor ta ruggyt dy veh bio son dy bragh dy yannoo eh hene ainjyssaghh er y stayd dy bragh farraghtyn shen huggey teh dy siyragh tayrn: as cre ta cha cooie dy lhiettal mee-chraueeaght yn cheeloghe lhag-chiarailagh, rouanagh shoh, as smooinaghtyn er Beaynid Lhig da tammylt dy hraa er-y-fa shen veh er ny vaarail er ny focklyn giarey shoh as dy vod ad greme y ghoaill er y chree lhig dauesyn ta lhaih ad dy jeean chebbal seose gys Jee lheid ny yeearreeyn shoh:—",,2
"“O God, the fountain of wisdom and goodness, assist me to read this little book with a serious, attentive mind; let me not satisfy myself with barely commending the important truths which it contains, but teach me to make a devout application of them. May I read them as addressed to my conscience; and, as far as they agree with thy holy word, may I receive and submit to them as an oracle of God. May they afford me present instruction and benefit; and thus tend, by thy grace, to fit me for the enjoyment of eternal glory.”","“O Yee, farrane dy chooilley chreenaght, as dy chooilley vieys, cooin lhiam dy lhaih yn lioar beg shoh lesh aigney arrymagh as tastagh—Giall nagh jean-ym booiys mee hene lesh ynrycan loayrt dy mie jeh ny firrinyssyn mooarey te’h goaill stiagh, agh ynsee dou lesh aigney imlee as crauee dy ghoaill ad hym pene. Cur grayse dou dy lhaih ad myr Goan loayryt rish my chooinsheanse hene as (choud as t’ad cordail rish dty ghoo’s casherick,) dy chur biallys daue myr da goan yn Ooilley-niartal Jee. Giall dy voddym’s ec y traa shoh ynsagh as vondeish y gheddyn lioroo, as myr shen dy jean ad cooney lhiams liorish dty ghrayse de ve cooie son gloyr dy bragh farraghtyn.”","“O Yee farrane dy chooilley chreenaght, as dy chooilley vieys, cooin lhiam dy lhaih yn lioar beg shoh lesh aigney arrymagh as tastagh—Giall nagh jean-ym booiys mee hene lesh ynrycan loayrt dy mie jeh ny firrinyssyn mooarey te’h goaill stiagh, agh ynsee dou lesh aigney imlee as crauee dy ghoaill ad hym pene. Cur grayse dou dy lhaih ad myr Goan loayryt rish my chooinsheanse hene as (choud as t’ad cordail rish dty ghoo’s casherick,) dy chur biallys daue myr da goan yn Ooilley-niartal Jee. Giall dy voddym’s ec y traa shoh ynsagh as vondeish y gheddyn lioroo as myr shen dy jean ad cooney lhiams liorish dty ghrayse de ve cooie son gloyr dy bragh farraghtyn.”",,2
The soul of man is immortal. This is a principle on which all the divine dispensations are founded.,Ta annym dooinney farraghtyn son dy bragh. Er shoh ta gruntit dellalyn Yee rish chloan Gheiney ayns e Ghoo as ayns e Ard-chairailys.,,,2
" The sacred writers do not set themselves directly to prove it, yet it is abundantly asserted in the book of God. ",,,,2
"Our Saviour maintains the future existence of the soul, from God’s calling himself the God of Abraham, Isaac, and Jacob, many years after their death; “ for God,” saith he, “is not a God of the dead, but of the living; for all live unto him.” The same divine Teacher asserts, that though men may kill the body, they cannot kill the soul: ","Ta nyn Saualtagh hene prowal dy bee yn annym bio ’sy theihll ta ry-heet veih beeayll Jee hene tra t’eh genmys eh hene Jee Abraham, as Jee Isaac, as Jee Yacob, “son cha vel Jee,” te’h gra, “Jee ny merriu agh Jee ny bioee son ta ooilley bio huggeysyn.” Ta’n fer-ynsee flaunyssagh cheddin fockley magh ga dy vod deiney marroo yn corp nagh vod ad yn annym y varroo.","Ta nyn Saualtagh hene prowal dy bee yn annym bio ’sy theihll ta ry-heet veih beeayll Jee hene tra t’eh genmys eh hene Jee Abraham, as Jee Isaac, as Jee Yacob, “son cha vel Jee,” te’h gra, “Jee ny merriu agh Jee ny bioee son ta ooilley bio huggeysyn.” Ta’n fer-ynsee flaunyssagh cheddin fockl?y magh ga dy vod deiney marroo yn corp nagh vod ad yn annym y varroo.",,2
"but if the soul died with the body, or ceased to think and act after death, they might kill the soul as well as the body. The Apostles speak of being unclothed—putting off the body, or the tent in which the soul resides. They speak of giving up the ghost (or spirit); of the spirits of wicked men being in prison; and of the spirits of just men being made perfect.",,,,2
"The scriptures also speak of two future states; a state of happiness in heaven, and a state of misery in hell; and affirm that each of these is eternal. Holy souls, when removed from this world, are admitted into heaven, which is undoubtedly a state of glory and happiness, and the principal stress laid on this is, that it is an eternal state. Thus we frequently read of eternal life—eternal redemption, and eternal glory. The house to which good men shall be removed is eternal in the heavens. The kingdom which they shall possess is an everlasting kingdom. Their happiness is called an eternal weight of glory, and, it is said, they shall be for ever with the Lord.","Ta ny Scriptyryn myrgeddin loayrt jeh daa stayd ta ry-heet; stayd dy vaynrys ayns Niau, as stayd dy horchagh ayns Niurin, as t’ad fockley magh lesh slane shickyrys dy vel ad nyn neesht farraghtyn son dy bragh. Ta anmeenyn casherick tra ta’d er nyn scarrey veih yn seihll shoh, er nyn ghoaill stiagh ayns Niau, ta gyn dooyt ny stayd dy ghloyr as dy vaynrys, agh shen er ta ny Scriptyryn soilshaghey dy vel trimmid y chooish lhie, she dy vel eh stayd dy bragh farraghtyn. Myr shoh ta shin dy mennic lhaih jeh bea dy bragh farraghtyn—Saualtys dy bragh farraghtyn, as gloyr dy bragh farraghtyn. Ta’n thie huggey vees deiney mie er nyn goyrt lhieu dy bragh farraghtyn ayns ny Niaughyn. Ta’n reeriaght nee ad goaill soylley jeh reeriaght dy bragh farraghtyn. Ta’n vaynrys oc enmyssit towse dy bragh farraghtyn dy ghloyr, as te raït, dy bee ad son dy bragh marish y Chiarn.",,,2
"The misery of hell is also eternal. Those who lived in rebellion against God, and disobedience to the gospel, and died impenitent and unrenewed, are removed to a state of misery and torment. Our Lord, speaking of it, calls it the fire that shall never be quenched; and this he repeats no less than four times. St. Paul says, that the wicked shall be punished with everlasting destruction. Jude speaks of the inhabitants of Sodom, as suffering the vengeance of eternal fire. Our Lord also, describing the day of judgment, says, the wicked shall o away into everlasting punishment. ","Ta torchagh niurin myrgeddin farraghtyn son dy bragh. Adsyn ta er veaghey ayns noidjys noi Jee, as ayns mee-viallys da’n sushtal, as ta er gheddyn baase fegooish arrys as fegooish veh er nyn ruggey ass-y-noa, t’ad er nyn scughey gys stayd dy hreihys as dy horchagh. Ta nyn Jiarn, tra t’eh loayrt jeh, genmys eh “Yn aile nagh bee dy bragh er ny[1] vooghey;” as shoh t’eh fockley magh kiare keayrtyn. Ta’n Noo Paul gra dy bee ny mee-chrauee “er nyn gerraghey lesh toyrt-mow dy bragh farraghtyn.” Ta Jude loayrt jeh cummaltee Sodom myr surranse kerraghey dowil yn aile dy bragh farraghtyn.” Ta nyn Jiarn myrgeddin tra t’eh loayrt jeh laa ny Briwnys, gra, dy jed ny mee-chrauee ersooyl gys kerraghey dy bragh farraghtyn.","Ta torchagh niurin myrgeddin farraghtyn son ?y bragh. Adsyn ta er veaghey ayns noidjys noi Jee, as ayns mee-viallys da’n sushtal, as ta er gheddyn baase fegoois? arrys as fegooish veh er ny ruggey ass-y-noa, t’ad er nyn scughey gys stayd dy hreihys as dy horchagh. Ta nyn Jiarn, tra t’eh loayrt jeh, genmys eh “Yn aile nagh bee dy bragh er ny[1] vooghey;” as shoh t’eh fockley magh kiare keayrtyn. Ta’n Noo Paul gra dy bee ny mee-chrauee “er nyn gerraghey lesh toyrt-mow dy bragh farraghtyn.” Ta Jude loayrt jeh cummaltee Sodom myr surranse kerraghey dowil yn aile dy bragh farraghtyn.” Ta nyn Jiarn myrgeddin tra t’eh loayrt jeh laa ny Briwnys, gra, dy jed ny meechrauee ersooyl gys kerraghey dy bragh farraghtyn.",[1] ny] text nyn,3
"How astonishing then is the folly and madness of mankind! One would imagine, from their conduct, that they expect to die either like the brutes, or else that God has no wrath for them to fear, and no mercy for them to desire. Look into the lives of men in general, and you will see that visible and temporal things appear to them the most important, unseen and eternal things the most trifling. They are eager to provide for their frail, dying bodies, and to heap up wealth which they cannot carry with them; but take little or no care of the nobler part of their nature, their never-dying souls. They are every day laying up for years to come, but take no thought for eternity. They are diligent in trading, but negligent in praying[a]. Their shop-books are duly posted, but they seldom consult the book of God. Some who have lived 60 or 70 years, and know that eternity cannot be far off, have perhaps never spent one serious hour in inquiring into the state of their souls, and what preparation is necessary for eternity. There are others less busy about temporal concerns, but equally careless about eternal ones. They waste that precious time in unnecessary sleep or recreation, which was given to them to improve for eternity. They contrive a thousand methods to kill time, (as they ignorantly speak,) and are thankful to any one for an expedient to pass it off. They waste God’s sacred time as well as their own, and will not devote even the short interval of a sabbath to consider the things that make for their eternal happiness. “The life everlasting” is indeed an article of their creed, but is strangely forgotten and lost sight of. The warnings of conscience, the admonitions of friends, the addresses and prayers of ministers, have no abiding effect on their minds. Thus they go on, in a round of folly and impenitence, till their foot slippeth in some dreadful moment, and they are lost for ever!","Cre cha atchimagh eisht as ta ommijys sheelnaue? Hellagh peccagh veih yn ymmyrkey oc, dy vel ad jerkal dy gheddyn baase myr maase y vagheragh, er nonney nagh vel jymmoose erbee ec Jee dy veh agglagh roish, ny myghin erbee daue dy yeearree. Gow-jee tastey jeh ymmyrkey bea yn chooid smoo dy ’leih, as nee shiu fakin dy vel ny reddyn ta ry akin as cherraghtyn jeeaghyn dauesyn jeh ’n trimmid smoo, ny reddyn nagh vel ry akin as ta farraghtyn son dy bragh eddrym, as fardailagh. T’ad streeu dy jeean dy yannoo magh feme nyn girp marvanagh, as dy stoyral seose berchys nagh vod ad cur lesh ersooyl maroo, agh ’sbeg y charail t’ad goaill jeh’n ayrn s’ooasle jeh nyn ghooghys: nyn anmeenyn nagh vow dy bragh baase. T’ad dy chooilley laa stoyral seose son bleeantyn ry-heet agh cha vel imnea erbee oc mychione beaynid. Ta nyn goontaghyn rish deiney er nyn reayll dy kiart, agh s’anvennic t’ad jeeaghyn stiagh ayns lioar Yee. Ta paart ta er cheau three feed blein ny three-feed as jeih ’sy theihll, as shickyrys oc nagh vod beaynid veh[2] foddey jeh, nagh vel rieau er cheau foddee un oor ayns jeeaghyn stiagh ayns stayd nyn anmeenyn hene, as briaght cre ta ymmyrchagh dy yannoo ad aarloo cour beaynid. Ta feallagh elley ayns ny sloo dy phreish mychione nheeghyn seilltagh, agh chiart cha lhag-chiarailagh mychione ny reddyn ta farraghtyn son dy bragh. T’ad ceau ersooyll nyn ooryn deyr ayns saveenys as cadley er nonney ayns geiyrt er eunyssyn fardailagh, va er nyn goyrt daue dy yannoo ymmyd jeu cour beaynid. T’ad geddyn magh thousane aght dy varroo traa (myr t’ad hene dy mee-hushtagh gra,) as t’ad booisal da persoonyn erbee ver saase daue dy gheddyn rea rish paart jeh. T’ad ceau ersooyll traa casherick Yee marish yn traa oc hene, as cha der ad seose eer earish giare yn doonaght gys smooinaghtyn er ny reddyn ta bentyn rish nyn maynrys dy bragh farraghtyn. Ta’n “vea dy bragh farraghtyn” dy jarroo banglane jeh ’n chredjue oc, agh t’eh dy yindyssagh er ny yarrood ayns nyn ymmyrkey bea. Cha vel raueaghyn nyn gooinsheanse, cha vel coyrle nyn gaarjyn, cha vel sharmaneyn as padjeryn nyn shirveishee goaill greme shickyr erbee er nyn aignaghyn. Myr shoh t’ad goll er nyn doshiaght dy ommijagh as dy mee-arryssagh, derrey ta nyn gass skyrraghtyn ayns oor atchimagh ennagh, as t’ad caillit son dy bragh!","Cre cha atchimagh eisht as ta ommijys sheelnaue? Hellagh peccagh veih yn ymmyrkey oc, dy vel ad jerkal dy gheddyn baase myr maase y vagheragh, er nonney nagh vel jymmoose erbee ec Jee dy veh agglagh roish, ny myghin erbee daue dy yeearree. Gow-jee tastey jeh ymmyrkey bea yn chooid smoo dy ’leih, as nee shiu fakin dy vel ny reddyn ta ry akin as cherraghtyn jeeaghyn dauesyn jeh ’n trimmid smoo, ny reddyn nagh vel ry akin as ta farraghtyn son dy bragh eddrym, as fardailagh. T’ad streeu dy jeean dy yannoo magh feme nyn girp marvanagh, as dy stoyral seose berchys nagh vod ad cur lesh ersooyl maroo agh ’sbeg y charail t’ad goaill jeh’n ayrn s’ooasle jeh nyn ghooghys nyn anmeenyn nagh vow dy bragh baase. T’ad dy chooilley laa stoyral seose son bleeantyn ry-heet agh cha vel imnea erbee oc mychione beaynid. Ta nyn goontaghyn rish deiney er nyn reayll dy kiart, agh s’anvennic t’ad jeeaghyn stiagh ayns lioar Yee. Ta paart ta er cheau three feed blein ny three-feed as jeih ’sy theihll, as shickyrys oc nagh vod beaynid veh[2] foddey jeh, nagh vel rieau er cheau foddee un oor ayns jeeaghyn stiagh ayns stayd nyn anmeenyn hene, as briaght cre ta ymmyrchagh dy yannoo ad aarloo cour beaynid. Ta feallagh elley ayns ny sloo dy phreish mychione nheeghyn seilltagh, agh chiart cha lhag-chiarailagh mychione ny reddyn ta farraghtyn son dy bragh. T’ad ceau ersooyll nyn ooryn deyr ayns saveenys as cadley er nonney ayns geiyrt er eunyssyn fardailagh, va er nyn goyrt daue dy yannoo ymmyd jeu cour beaynid. T’ad geddyn magh thousane aght dy varroo traa (myr t’ad hene dy mee-hushtagh gra,) as t’ad booisal da persoonyn erbee ver saase daue dy gheddyn rea rish paart jeh. T’ad ceau ersooyll traa casherick Yee marish yn traa oc hene, as cha der ad seose eer earish giare yn doonaght gys smooinaghtyn er ny reddyn ta bentyn rish nyn maynrys dy bragh farraghtyn. Ta’n “vea dy bragh farraghtyn” dy jarroo banglane jeh ’n chredjue oc, agh t’eh dy yindyssagh er ny yarrood ayns nyn ymmyrkey bea. Cha vel raueaghyn nyn gooinsheanse, cha vel coyrle nyn gaarjyn, cha vel sharmaneyn as padjeryn nyn shirveishee goaill greme shickyr erbee er nyn aignaghyn. Myr shoh t’ad goll er nyn doshiaght dy ommijagh as dy mee-arryssagh, derr?y ta nyn gass skyrraghtyn ayns oor atchimagh ennagh, as t’ad caillit son dy bragh!","[2] veh] text v’eh, sc. Ve
[a] Not present in Manx
""ayns nyn ymmyrkey bea"".- not present in English",3
"One of the Fathers, with great beauty and propriety, calls death “the gate of eternity.” The death of a human creature is his passing out of time into eternity; and what event can be more solemn? Yet, this so common, that we seldom make any serious reflections on it; and we talk of it with as much indifference as of any common article of news. With regard to death itself, there is one event to the righteous and to the wicked: but, oh! what a vast difference immediately succeeds! To each, their time of trial is ended, and their eternal state is begun. The righteous man puts off the body with all its cares, temptations, and sorrows; his soul ascends to God, and enters upon everlasting rest, security, and joy. What a glorious and delightful change! The sinner likewise changes his temporal for eternal things; but it is for torment and misery. When a wicked man dieth, saith Solomon, his expectation shall perish, and the hope of unjust men perisheth. His last breath, and his last hope, expire together. he shall never hear preaching or praying any more; never receive one more invitation of mercy. He is brought to the bar of God, to give an account of the time, the means and advantages he has enjoyed, and to receive his doom. This is the portion of a wicked man! And is it not then an awful thing to die? You will think so when the king of terrors seizes you. A man of humour, in his gay hours, wrote and published a history of those who had died jesting; but he solemnly retracted it in writing, on his death-bed: for he found that death was no jesting matter. Ah! Eternity! Eternity! said a graceless wretch, when dying and looking dismally at those about him, and there he stopped: he said no more; more he could not say; more he needed not to say. Ponder upon this example, and if you dread such a death, do not lead such a life.","Ta fer jeh ny chied Chreesteenyn, ayns aght feer aalin as cooie, er n’enmys baase “giatt beaynid.” Tra ta dooinney geddyn baase t’eh goll veih traa gys beaynid; as cre’n red s’arrymee oddagh taghyrt da? Ny yeih ta shoh cha cadjin, dy nee anvennic ta shin smooinaghtyn dy dowin er; as ta shin taggloo jeh lesh wheesh dy lhag-chiarail as yinnagh shin jeh naight fardailagh erbee. Choud as te’h bentyn rish y baase hene, te taghyrt co-laik da’n dooinney crauee as da’n drogh yantagh: agh, oh! cre’n lhiettrymyss yindyssagh ta chelleeragh geiyrt er! Daue nyn neesht, ta’n stayd dy phrowal harrish, as ta’n stayd dy bragh farraghtyn goaill toshiaght. Ta’n dooinney crauee cur dy lhiattee yn challin marish ooilley ny kiarailyn, miolaghyn, as ny treihyssyn va bentyn da; ta e annym getlagh seose gys Jee, as goll stiagh ayns shee, as sauchys, as gerjagh dy bragh farraghtyn. Cre’n caghlaa gloyroil! Cre’n caghlaa gerjoilagh! Ta’n drogh-yantagh myrgeddin caghlaa ny reddyn ta cherraghtyn son ny reddyn ta farraghtyn son dy bragh; agh she son torchagh as treihys te’h caghlaa. Tra ta dooinney mee-chrauee geddyn baase, (ta Solomon gra) ta e yerkal cherraghtyn, as ta treishteil ny mee-ynrick goll naardey. Ta e ennal s’jerree, as e hreishteil s’jerree, cherraghtyn cooidjagh. Cha jean eh dy bragh cliashtyn preacheil ny padjer arragh; cha jean eh dy bragh geddyn un cheb elley dy vyghin. T’eh currit lesh kiongoyrt rish stoyl-briwnys Yee, dy chur coontey jeh’n traa, jeh ny saaseyn as ny vondeishyn ghow eh soylley jeu ayns shoh, as dy gheddyn e chronney. Shoh cronney yn dooinney ta geddyn baase ayns e pheccaghyn! As nagh vel eh eisht red atchimagh dy gheddyn baase? Shen myr nee shiu smooinaghtyn tra nee Ree ny atchimyn gremmey shiu. Ren dooinney ennagh, ayns e ooryn dy reayid, scrieeu coontey jeh nyn lheid as hooar baase jannoo craid; agh ghow eh arrys as ren eh dobberan dy sharroo er y hon, er e lhiabbee vaaish; son dennee eh nagh row craid dy veh jeant mysh baase. Ales! beaynid! beaynid! dooyrt dooinney dyn grayse, tra v’eh geddyn baase, as jeeaghyn dy trimshagh er ooilley mygeayrt y mysh: cha dooyrt eh arragh; arragh cha noddagh eh gra; arragh cha b’liass da gra. Smooinnee-jee shiuish dy dowin er y sampleyr atchimagh shoh, my chaarjyn deyr, as my ta shiu goaill aggle roish lheid y vaase ny jean-jee leedeil lheid y vea.","Ta fer jeh ny chied Chreesteenyn, ayns aght feer aalin as cooie, er n’enmys baase “giatt beaynid.” Tra ta dooinney geddyn baase t’eh goll veih traa gys beaynid; as cre’n red s’arrymee oddagh taghyrt da? Ny yeih ta shoh cha cadjin, dy nee anvennic ta shin smooinaghtyn dy dowin er; as ta shin taggloo jeh lesh wheesh dy lhag-chiarail as yinnagh shin jeh naight fardailagh erbee. Choud as te’h bentyn rish y baase hene, te taghyrt co-laik da’n dooinney crauee as da’n drogh yantagh: agh, oh! cre’n lhiettrymyss yindyssagh ta chelleeragh geiyrt er! Daue nyn neesht, ta’n stayd dy phrowal harrish, as ta’n stayd dy bragh farraghtyn goaill toshiaght. Ta’n dooinney crauee cur dy lhiattee yn challin marish ooilley ny kiarailyn, miolaghyn, as ny treihyssyn va bentyn da; ta e annym getlagh seose gys Jee, as goll stiagh ayns shee, as sauchys, as gerjagh dy bragh farraghtyn. Cre’n caghlaa gloyroil! Cre’n caghlaa gerjoilagh! Ta’n drogh-yantagh myrgeddin caghlaa ny reddyn ta cherraghtyn son ny reddyn ta farraghtyn son dy bragh; agh she son torchagh as treihys te’h caghla. Tra ta dooinney mee-chrauee geddyn baase, (ta Solomon gra) ta e yerkal cherraghtyn, as ta treishteil ny mee-ynrick goll naardey. Ta e ennal s’jerree, as e hreishteil s’jerree, cherraghtyn cooidjagh. Cha jean eh dy bragh cliashtyn preacheil ny padjer arragh; cha jean eh dy bragh geddyn un cheb elley dy vyghin. T’eh currit lesh kiongoyrt rish stoyl-briwnys Yee, dy chur coontey jeh’n traa, jeh ny saaseyn as ny vondeishyn ghow eh soylley jeu ayns shoh, as dy gheddyn e chronney. Shoh cronney yn dooinney ta geddyn baase ayns e pheccaghyn! As nagh vel eh eisht red atchimagh dy gheddyn baase? Shen myr nee shiu smooinaghtyn tra nee Ree ny atchimyn gremmey shiu. Ren dooinney ennagh, ayns e ooryn dy reayid, scrieeu coontey jeh nyn lheid as hooar baase jannoo craid; agh ghow eh arrys as ren eh dobberan dy sharroo er y hon, er e lhiabbee vaaish; son dennee eh nagh row craid dy veh jeant mysh baase. Ales! beaynid! beaynid! dooyrt dooinney dyn grayse, tra veh geddyn baase, as jeeaghyn dy trimshagh er ooilley mygeayrt y mysh: cha dooyrt eh arragh; arragh cha noddagh eh gra; arragh cha bliass da gra. Smooinnee-jee shiuish dy dowin er y sampleyr atchimagh shoh, my chaarjyn deyr, as my ta shiu goaill aggle roish lheid y vaase ny jean-jee leedeil lheid y vea.",,4
