English,Manx,Notes
Some thoughts from our Chair,Smooinaghtyn veih’n Chaairliagh ain,
"The role of our charity is to promote the cultural heritage of the Island, and to provide facilities for members of the public to enjoy and acquire knowledge of that heritage.","Ta currym yn cheshaght-yiastyllagh ain dy chummal seose eiraght yn Ellan, dy chiarail couryn oddys y theay goaill soylley jeu, as dy chooney lesh y theay dy ynsaghey mychione yn eiraght shen.",
"So much of what we do relies on establishing good relationship and partnerships, in being responsive to the changing needs of both the cultural communities and the general public who want to find out more about what connects us all to the Island, and to each other.","Ta’n obbyr ain lhie er ny parteeassyn fondagh ta shin er yannoo, chammah as er gansoor femeyn ny co-phobbleyn cultooroil as y theay ta geearree dy gheddyn magh mychione ny reddyn ta kiangley shin dys yn Ellan shoh as dys y cheilley.",
"Our online presence has a particularly impressive reach, our social media and short films giving people here and around the world a window on the richness of Manx cultural life.","Ta roshtyn feer vooar ain er-linney; ta’n media sheshoil as ny filmyn giarey ain cur shilley jeh berchys y vea chultooragh Vanninagh da sleih er feai ny cruinney.",
The work of our development officers is delivered to an extremely high standard.,Ta obbyr ny hoffishearyn bisaghey ain jeant dy feer fondagh.,
"We now embrace a hybrid approach to teaching – both in person and online – which enables not only students based in the Isle of Man to take part, but also students around the world, including Singapore, Georgia, New Zealand and North America.","Ta shin cummal lessoonyn chammah ayns persoon as er-linney nish; ta shoh lhiggey da ynseydee chammah ayns Mannin as er feai ny cruinney goaill ayrn, goaill stiagh studeyryn ayns Singapore, Georgia, New Zealand, as America Twoaie.",
"We have created resources and school workshops, and generated interest in Manx culture from the international media and researchers, with programmes on Austrian national television, BBC TV, as well as for Manx Radio and other Manx media.","Ta shin er yannoo couryn as lessoonyn son schoillyn, as er hayrn tastey dys cultoor Manninagh veih sheshaghtyn-naight eddyr-ashoonagh as aa-ronseyderyn, lesh programmeyn er television ashoonagh Austrianagh, BBC TV, Radio Vannin, as media Manninagh elley.",
"Work to bring Manx culture into different events such as Christmas Live and POC Culture Fest has been very successful, and Members of Tynwald, including the Lieutenant Governor, have actively embraced the language.","Ta shin er hoilshaghey cultoor Manninagh ayns taghyrtyssyn lheid as Christmas Live as POC Culture Fest, as ta offishearyn y reiltys, goaill stiagh y Chiannoort, er ghoaill orroo dy chummal seose y ghlare.",
The year marked some important anniversaries including the 70th anniversary of the Manx Folk Dance Society and over 45 years of Share na Veg folk group in Ramsey schools,"T’eh three feed blein as jeih neayr’s va’n Manx Folk Dance Society currit er undin, as queig bleeaney as daeed neayr’s va Share na Veg, ta gobbragh ayns schoillyn er y twoaie.",
these were captured on film for future generations to enjoy.,V’ad shoh recortit er film myr shen dy vod ny sheelogheyn ta ry-heet goaill soylley jeu.,
"It’s worthy of note that our films have received over 3.4 million views on YouTube to date, and that we have almost 1,000 short films for people to enjoy.","Ta ny filmyn er-linney ain er chosney ny smoo na 3.4 millioon shillaghyn er YouTube choud’s shoh, as ta bunnys 1,000 film giarey ain son sleih dy ghoaill taitnys ayn.",
"Foundation Members are always delighted to welcome applications from individuals, groups and societies which meet the remit of the Manx Heritage Foundation Act 1982.","Ta olteynyn yn Undinys booiagh dy gheddyn shirraghyn veih persoonyn, possanyn, as sheshaghtyn ta gansoor ard-oyryn Undinys Eiraght Vannin 1982.",
"Grant-giving is a mechanism by which we can partner with the community for projects such as new books, festivals and events, academic research, creative and cultural concepts, and heritage transport restoration.","Trooid cur magh toyrtyssyn fodmayd gobbragh marish y cho-phobble er shalleeyn lheid as lioaryn noa, feaillaghyn as taghyrtyssyn, aa-ronsaghey academagh, ard-smooinaghtyn cultooiroil as crooagh, as jannoo ass y noa cooid troailt eiraghtoil.",
"We continue to support festivals and events which are established within the Manx cultural calendar, and which now have the reassurance of ring-fenced funding while we have funds available.","Ta shin tannaghtyn dy chummal seose feaillaghyn as taghyrtyssyn reiltagh syn eaillere cultooroil, as ta argid er ve freilt ry-lhiattee cour oc shoh choud’s t’eh ry-gheddyn.",
"Together with IOM Arts Council, we made a presentation to Tynwald Members about the next stage of the National Development Strategy for Culture and the Arts.","Marish Coonceil ny Hellynyn, ren shin cummal loayrtys son olteynyn y Chiare as Feed mychione nah ayrn y Strateysh Toshiaghey Ashoonagh son Cultoor as ny Hellynyn.",
"With the launch of the Draft Economic Strategy 2022 and its emphases on attractive amenities and leisure facilities, quality of life and communities, to support the growth of the economically active population, it is important that the role played by culture, heritage and the arts is recognised.","Kyndagh rish cur magh y Strateysh Kiarit Tarmaynagh 2022, as yn scansh t’eh cur da ynnydyn soccar theayagh, maynrys, as co-phobbleyn ayns mooadaghey yn earroo dy obbreeyn ayns Mannin, t’eh scanshoil dy vel tastey er ny chur da foays cultoor, eiraght, as ny hellynyn.",
"Our presentation to Tynwald noted Manx artists, actors, musicians and researchers who have made an international impact.","Ren y loayrtys ain gimraa ellynee, cloiederyn, kiaulleyderyn, as aa-ronseyderyn ta’n obbyr oc er ve moyllit ayns cheeraghyn elley.",
"We also looked at the role of arts and culture as essential for wellbeing, strengthening community bonds, and offering a sense of belonging.","Dimraa shin kys ta ellyn as cultoor ymmyrchagh son maynrys, son niartaghey co-phobbleyn, as son jannoo ennaghtyn dy heshaghtys.",
"They are essential for accessibility and inclusivity, and give people voices who may otherwise feel unheard.","T’ad scanshoil son roshtynys as cummalaghys, as son cur coraa da sleih ta gennaghtyn nagh vel ad er nyn glashtyn.",
"Finally, the festivals and events we both support provide entertainment and enjoyment for all ages, bringing the community together in celebration, whether as performers or audiences.","Er-jerrey, ta ny feaillaghyn as taghyrtyssyn ta shin cummal seose cur taitnys as soccarys da sleih jeh dy-chooilley eash, as cur lhieu y co-phobble cooidjagh ayns sheshaghtys, edyr myr jeantee ny clashtynee.",
A high quality of life demands a strong arts and cultural scene.,Ta seihll ellynagh as cultooroil breeoil ymmyrchagh son mayrnys bea y theay.,
"As we consider this, as we see greater demand for Manx culture and language within schools and the community, we would be wrong if we did not consider the difference additional funding would make.","Myr ta shin clashtyn yn eam son tooilley Gaelg as cultoor Manninagh ayns scoillyn as sy cho-phobble, sheeu dooin smooinaghtyn cre’n caghlaa oddagh tooilley argid jannoo.",
"We have been fortunate that our founding legislation enables us to accept donations and bequests, but these are often linked to specific purposes.","Ta shin fortanagh ayns wheesh as ta’n slattys liorish va’n cheshaght ain currit er undin lhiggey dooin soiaghey jeh giootyn as leggadyn, agh t’ad shoh dy mennick kiarit son ymmydyn er-lheh.",
"During this year, a generous legacy recognising the best student examined for the TCG (GCSE equivalent) in Manx, the TCM and CN Frost Bequest, will benefit young students for many years to come in the form of the Sophia Morrison Award.","Y vlein shoh, va leggad giastyllagh er ny chur da’n studeyr share ta jannoo yn TCG. Nee yn leggad shoh veih TCM as CN Frost, enmyssit Aundyr Sophia Morrison, cooney lesh studeyryn aegey.",
"The legacy reflects renewed confidence in the language, and the support it engenders in the community.","Ta’n leggad shoh cowraghey y bree noa t’ec y Ghlare Vanninagh as yn graih t’ec y cho-phobble urree.",
"Our work to communicate what the Isle of Man is about with as many people as possible here and around the world would benefit from even a modest increase in core funding, as we have tried and tested mechanisms for working with the community to maximise the effectiveness of distribution of funds through grants and development work.","Yinnagh yn obbyr ain dy chur bun er Ellan Vannin da whilleen peiagh as oddysmayd, chammah ayns Mannin as er feai ny cruinney, geddyn vondeish mooar veih eer mooadaghey beg syn argid bunneydagh ain, son ta saaseyn feer fondagh ain dy obbragh marish y cho-phobble as geddyn y vondeish smoo jeh yn argid ta shin baarail er toyrtyssyn as obbyr hoshiaghey.",
"Manx culture for everyone who chooses to live and work in our special island, and for those who appreciate and practise it around the world. Nyn ellan, nyn gultoor – our Island, our culture – to share with everyone, everywhere.","Cultoor Manninagh son dy-chooilley pheiagh t’er reih dy vaghey er yn Ellan yindyssagh ain, as son oc ooilley ta cliaghtey ee er feai ny cruinney. Nyn ellan, nyn gultoor, dy ghoaill ayrn ayn marish dy-chooilley pheiagh dy-chooilley voayl.",
"Hon Chris Thomas MHK, Caairliagh","Onn Chris Thomas MHK, Caairliagh, Culture Vannin",
The full Chair’s Statement can be found in the Annual Financial Statements.,Ta slane fockley-magh y Chaarliagh ry-gheddyn ayns ny Coontaghyn Argidoil Bleinoil.,
Celebrating 40 years,Feaillaghey 40 blein,
"2022 marks the 40th anniversary of the Manx Heritage Foundation Act, which created the Manx Heritage Foundation charity that is known as Culture Vannin today.","Va Slattys Undinys Eiraght Vannin er ny chur ayns bree 40 blein er dy henney. She liorish yn clattys shoh va’n cheshaght yiastallagh Undinys Eiraght Vannin, ta nish enmyssit Culture Vannin, currit er undin.",
"We've always been proud to support, promote and celebrate contemporary Manx culture, drawing on our cultural heritage to help shape an exciting future.","Ta shin moyrnagh dy chummal seose, cur er y hoshiaght, as jannoo mooar jeh cultoor Manninagh y laa t’ayn jiu, as ta shin goaill niart veih’n eiraght cultooroil ain dy yannoo traa ry-heet breeoil.",
"We are celebrating the anniversary through a series of special releases, projects and events, including the 40 Manx things challenge, a 40th anniversary grants scheme, release of 40 archive films, commemorative stamps, and a Manx Celebration concert of music and dance.","Ta shin freayl yn feailley-bleeaney shoh liorish cur magh cooid er-lheh, shalleeyn, as taghyrtyssyn, goaill stiagh 40 Manx Things, toyrtyssyn feailley-bleeaney, cur magh daeed filmyn voish yn tashtey, stampyn cooinaghtoil, as cuirrey dy chiaull as daunsey.",
Development work highlights,Obbyr Hoshiaghey,
"Manx culture gives the Isle of Man a sense of identity, nationally and internationally.","Ta cultoor Manninagh cur enneydys da Mannin, chammah ayns shoh as ayns cheeraghyn elley.",
"Over 1,000 children took part in the Manx Folk Awards",,Not translated in the original
"Over 1,000 readers of Kiaull Manninagh Jiu newsletter",,Not translated in the original
"Highlights of this year’s work include partnering with community and cultural organisations, teaching, new resources and films, support for special anniversaries, and ambitious strategies.","Ta ny reddyn cronnal va jeant y vlein shoh goaill stiagh gobbragh marish y cho-phobble as sheshaghtyn cultooroil, gynsagh, cur magh couryn as filmyn noa, cummal seose feaillaghyn bleeaney er-lheh, as jannoo saaseyn dunnal son cooilleeney cooishyn.",
Reaching the heart of communities,Roshtyn cree y cho-phobble,
"Partnering with organisations is something that we find incredibly valuable: our ‘Hidden Histories’ at the inaugural festival organised by People of Colour Isle of Man, celebrated culture and diversity.","Ta shin fakin foays mooar ayns gobbragh marish sheshaghtyn elley. Ren y ‘Hidden Histories’ ain ec y chied feailley er ny chummal liorish People of Colour Isle of Man soiaghey mooar jeh cultoor as caghlaays.",
We worked with Christmas Live to bring Manx songs to new audiences.,Dobbree shin marish Christmas Live dy chur lesh arraneyn Manninagh dys clashtynee noa.,
Gaelg21 was a month-long celebration of the Manx language which involved over 500 people.,Ren erskyn 500 persoon goaill ayrn ayns Gaelg21 – slane vee son soiaghey mooar jeh’n Ghaelg.,
"The Manx Folk Dance Society celebrated their 70th anniversary and we helped capture this in oral history interviews, filming of the anniversary talk, and digital releases.","Ren y Manx Folk Dance Society feaillaghey three feed blein as jeih jeh’n cheshaght oc, as ren shinyn cooney ayns recortey eh lesh quaaltysyn, filmal y loayrtys feailley bleeaney oc, as cur magh cooid vun-earrooagh.",
Our online resources and school workshops supported an increased interest in Hop tu Naa.,Ren ny couryn er-linney as lessoonyn schoill ain skeaylley tushtey jeh Oie Houney as Hop tu Naa.,
"Our public service broadcasters and the Manx press help us to amplify the message of Manx culture through special programmes and columns, interviews and features.","Ta scaa-lheanee shirveish-theayagh as naighteyryn Manninagh cooney lhien dy skeaylley yn chaghteraght ain mychione cultoor Manninagh lesh programmeyn, articleyn, as quaaltysyn er-lheh.",
Reaching audiences globally,Roshtyn sleih er feai ny cruinney,
Our short films involve the talent of so many film-makers and participants and have over 3.4 million views on YouTube.,Ta ymmodee jantee film as feallee schleioil elley goaill ayrn ayns jannoo ny filmyn giarey ain. Ta erskyn 3.4 millioon dy leih er yeeaghyn er ny filmyn shoh er YouTube.,
"Our most popular post on Facebook reached almost 55,000 people.","Ren y post s’cronnal ain er Facebook roshtyn bunnys 55,000 dy leih.",
"We linked up with inter-Gaelic organisation Colmcille to celebrate the 1500th anniversary of St Columba, through the commission of a new choral work and film ‘Y Folliaght’.","Dobbree shin marish yn cheshaght eddyr-Gaelagh Colmcille dy yannoo cooinaghtyn jeh 1500 blein neayr as ruggyr Noo Colum Killey liorish goardrail obbyr choral as film noa ‘Y Folliaght’.",
"We featured on Austrian national TV and the BBC, and we presented webinars and talks online.","Va shin er nyn vakin er TV ashoonagh Austrianagh as er y BBC, as hug shin webinars as loayrtyssyn er-linney.",
We also helped a lecturer in India teach a song in Manx for International Mother Languages Day.,Choon shin lesh ynseyder ayns India dy ynsaghey arrane Manninagh son Laa Eddyr-Ashoonagh Chengey ny Mayrey.,
30 short films exploring some of the hidden places and stories of the Calf of Man are now online.,Ta jeih filmyn giarey as feed mychione buill follit as skeealyn y Cholloo nish er-linney.,
Reaching to the future,Roshtyn dys y traa ry-heet,
Our youth are our future and the 15th Big Bree Workshop Weekend proved Manx culture is in safe hands.,"Ta’n aegid y traa ry-heet ain, as ren y queig-jeigoo Big Bree Workshop Weekend prowal dy vel cultoor Manninagh ayns laueyn sauchey.",
"The Manx Folk Awards returned to full strength, with over 1,000 school students involved.","Ren Aundyryn Kiaull Theay Vannin cheet er-ash dys lane niart, as ren erskyn 1,000 schoillar goaill ayrn ayn.",
"The Manx Fiddle Orchestra was born, an inter-generational project led by Katie Lawrence.",Va’n Manx Fiddle Orchestra currit er undin – shallee eddyr-sheeloghe er ny leeideil liorish Katie Lawrence.,
"Commissioning new plays that explore Manx culture and identity: ‘The In-between’ Times by Annie Kissack, and Our Loch-y-Charm by Cori Phillips.","Goardrail cloieyn noa ta ronsaghey cultoor as enneydys Manninagh: ‘The In-between Times’ liorish Annie Kissack, as ‘Our Loch-y-Charm’ liorish Cori Phillips.",
We worked on the Manx Language Strategy and reached the mid-point of the National Development Strategy for Culture and the Arts.,Dobbree shin er y Strateysh son y Ghaelg as ren roshtyn ynnyd meanagh y Strateysh Hoshiaghey Ashoonagh son Cultoor as ny Hellynyn.,
"Reaching into hearts, souls and minds","Roshtyn creeaghyn, anmeenyn as aignaghyn",
"We teach 8 weekly adult classes for Manx, as well as occasional short courses.","Ta shin gynsagh 8 lessoonyn Gaelgagh son sleih aasit dagh shiaghtin, chammah’s coorseyn giarey earishagh.",
"We take Manx music, dance and folklore into schools through workshops and lessons, and through extra-curricular activities like Bree and Scran.","Ta shin cur lesh kiaull, daunsey, as skeealyn Manninagh dys schoillyn trooid lessoonyn as taghyrtyssyn cheu-mooie jeh schoillyn lheid as Bree as Scran.",
"This year, we re-designed learnmanx.com to be even more user-friendly.",Y vlein shoh ren shin aa-chummey learnmanx.com dy yannoo eh ny sassey dy usal.,
Two of our harp students were featured at the virtual New Generation concert at Edinburgh International Harp Festival in April 2021.,Va jees jeh ny studeyryn claasagh ain er nyn vakin ec y chuirrey-kiaull New Generation as Feailley Eddyr-Ashoonagh Claasagh Doon-Eadjyn ayns Averil 2021.,
"We sent a virtual ‘Love Letter to Lorient’ to Europe’s largest Celtic festival – the film reached 10,000 of their followers.","Hug shin ‘Love Letter to Lorient’ mychione y feailley Celtiagh smoo ayns Europe ren roshtyn 10,000 jeh ny heiyrtyssee oc.",
We helped Tynwald Members embrace the Manx language so that it can be used in different settings.,"Ren shin cooney lesh Olteynyn y Chiare as Feed dy ghoaill greim er y Ghlare Vanninagh myr shen dy vod ymmyd y ve jeant j’ee ayns caghlaa dy chooishyn as buill.",
Highlights from grants awarded,Toyrtyssyn cronnal t’er ve currit magh,
"36 grants totalling over £84,000 were awarded during the financial year","Va shey toyrtyssyn as feed jeh erskyn £84,000 ooilley cooidjagh currit magh sy vlein argidoil.",
"Supporting local festivals and events make for a rich and varied cultural life on our island, and they continue to be a key area of our grant giving.","Ta cummal seose feaillaghyn as taghyrtyssyn jannoo ny s’breeoil as s’caghlaaee jeh bea cultooroil nyn ellan, as t’ad shoh tannaghtyn dy ve ayrn scanshoil jeh’n ny toyrtyssyn ta shin cur magh.",
2021 saw a mixture of events and festivals taking place physically and also virtually due to ongoing Covid 19 restrictions.,Kyndagh rish lhiettalyssyn bentyn da Covid 19 va feaillaghyn as taghyrtyssyn foast goll er cummal er-linney as ayns persoon.,
These events were only made possible during incredibly difficult times by the dedication and hard work of the volunteer committees.,Va ny taghrtyssyn shoh jeant possible ayns ny traaghyn shoh dy hennid kyndagh rish obbyr cho-phobbleyn dy arryltee.,
"Throughout the financial year Culture Vannin was delighted to provide financial support to the following:",Sy vlein argidoil shoh va Culture Vannin booiagh dy chur chooney argidoil da ny cooishyn shoh:,
"Films, book, online and CD projects created by our amazing cultural community include the work of writers, performers and creatives at all levels:","Ta filmyn, lioaryn, as shalleeyn CD as er-linney jeant liorish y cho-phobble cultooroil yindyssagh ain goaill stiagh obbyr scrudeyryn, cloiederyn, as sleih crooagh ec dy-chooilley laare:",
Grant giving allows for the development of skills and community outreach enabling new ways to reach new audiences:,"Ta toyrtyssyn cooney lhien dy ghreinnaghey schleiyn noa as roshtyn magh dys y cho-phobble, as lhiggey dooin roshtyn sleih noa:",
Research is important to the development of an understanding of the Isle of Man and Manx Studies internationally:,Ta aa-ronsaghey scanshoil ayns mooadaghey tushtey jeh Mannin as studeyrys er cooishyn Manninagh dy eddyr-ashoonagh:,
40th anniversary special grants scheme,Toyrtyssyn er-lheh son y daeedoo feailley bleeaney,
"A one-off scheme providing an additional £40,000 of grants was awarded in March 2021, to celebrate the 40th anniversary of the Manx Heritage Foundation Act, the legislation that founded the charity we know as Culture Vannin today.","Va £40,000 dy hoyrtyssyn elley currit magh ayns Mayrnt 2021 son y daeedoo feailley bleeaney jeh Slattys Undinys Eiraght Vannin liorish va’n cheshaght yiastallagh ta nish enmyssit Culture Vannin currit er undin.",
"The nine projects selected embrace innovation and change, and aim to either cover the development of a special body of work, or provide a new way of sharing and promoting existing materials.","Ta ny nuy shalleeyn va reiht jannoo soiaghey jeh caghlaa as smooinaghtyn noa, as t’ad kiarail edyr dy chur er y hoshiaght cooid dy obbyr noa er-lheh, ny dy yannoo aght noa dy skeaylley as cur fys jeh stooghyn t’ayn hannah.",
"They all have an element of online delivery to ensure accessibility, and demonstrate an ability to bring the past, present or future into dialogue.","T’ad ooilley er-linney ayns aght ennagh dy yannoo shickyr dy vel ad roshtynagh, as t’ad ooilley cur lesh y traa t’er n’gholl shaghey, y traa t’ayn, as y traa ry-heet cooidjagh ayns co-loayrtys.",
"Applicants were awarded a grant of either £2,500 or £5,000 for a project relating to one of the following categories:","Va edyr £2,500 ny £5,000 currit da shirreyderyn son shalleeyn mychione nane jeh ny cooishyn heese:",
Archaeology,Shenndaaleeaght,
Industrial development,Toshiaghey jeidjys,
Architecture,Ard-obbreeys,
Arts and crafts,Ellyn as keirdyn,
History and law,Shennaghys as leigh,
Language and literature,Glaraghyn as lettyraght,
"Music, folklore and folk dance","Kiaull, skeealyn, as daunsey",
Natural history and ecology,Shennaghys y dooghys as ecology,
Successful projects were:,Shalleeyn v’er nyn gooilleeney:,
Gaelic Broadcasting Committee Annual Report,Skeeal Bleinoil y Ving Ymskeaylley Gaelgagh,
"The Gaelic Broadcasting Committee continues to be directly funded by Culture Vannin, however responsibility for the full functions of the Committee will not be transferred to Culture Vannin until the Appointed Day Order for the new communications legislation is brought in to effect later in 2022.","Ta’n Ving Ymskeaylley Gaelgagh foast cosney yn tasht argid echey voish Culture Vannin, agh cha beagh freggyrtys son currymyn ooilley y Ving currit da Culture Vannin derrey vees yn Oardagh Laa Pointit cur pooar da’n Slattys Eddyr-Insh noa ec jerrey 2022.",
"In anticipation of the new legislation, the membership of the Committee has remained largely unchanged, with Bob Carswell, Phil Gawne and James Harrison, having had their terms of office extended until the legislative change is made.","Ta’n Ving er ve fuirraghtyn er’n slattys noa roish my vees olteynys y Ving caghlaait as myr shen ta Bob Carswell, Phil Gawne as James Harrison foast nyn olteynyn derrey vees yn caghlaa slattyssagh jeant.",
Adrian Cain (Chair) has been Chair of the Committee but he resigned from the Committee in February 2022.,"Va Adrian Cain Caairliagh ny Bing agh ren eh irree ass yn oik shen as olteynys y Ving ayns Toshiaght Arree, 2022.",
The main focus for the Committee has been to support Manx language programming and to think strategically about the future as part of the Manx Language Strategy.,Ta bun-chooish y Ving er ve cooney lesh claareyn as smooinaghtyn er’n traa ry-heet ayns aght ro-inchynagh as goaill tastey da’n Strateish Gaelgagh.,
When the new legislation is in place the Committee will undertake a fundamental review of Manx Gaelic broadcasting needs for the future and may well expand its membership depending on what the review concludes.,"Tra vees niart currit da’n slattys noa nee’n Ving goaill ayns laue bun-scrutaght er femeyn ymskeaylley Gaelgagh son y traa ry-heet, as foddee dy jean olteynys y Ving mooadaghey my vees shen briwnys y vun-scrutaght.",
News items in Manx are recorded and posted with a full transcript on Manx Radio’s website.,Ta’n naight ayns Gaelg er ny recortysey as currit magh er ynnyd-eggey Radio Vannin lesh lane mac-screeu.,
Payment for these items is made on an occasional basis by Culture Vannin.,Ta argid er n’eeck son y lheid shoh liorish Culture Vannin.,
"Apart from those items appearing on the website at any one time, there is access to an extensive archive of past items.","Chammah’s adshen cheet rish er’n ynnyd-eggey ta tashtey-recortys feer vooar ayn jeh reddyn jeant roish.",
"Goll as Gaccan, the weekly eclectic cultural show co-hosted by Phil Gawne and Simon Clarke, continues to provide an entertaining mix of Manx language, culture and heritage content.","Ta’n claare shiaghtinagh, Goll as Gaccan, goaill stiagh ny ayrnyn ooilley jeh cultoor as eiraght Vannin as er ny leeideil liorish Phil Gawne as Simon Clarke ayns aght cadjin as ennoil.",
The programme is aimed at a mainstream audience giving people an introduction to Manx Gaelic and hopefully encouraging them to learn more.,Ta dean yn chlaare dy chleaynaghey theay Vannin stiagh er cooishyn Gaelgagh as cur daue cree dy ynsaghey tooilley.,
The show is now funded by Manx Radio.,Ta argid cheet son yn chlaare veih Radio Vannin nish.,
Manx Radio continues to support the Manx language with use of greetings and short phrases throughout the day and with its Manx Word for the Day feature broadcast on weekdays and available on the Manx Radio website.,"Ta Radio Vannin hene foast bishaghey yn Ghaelg liorish ymmydey focklyn as raaghyn Gaelgagh feie’n laa, as ymskeaylley er y chiaghtin ‘fockle Gaelgagh yn laa’ as reddyn myr shen ta ry gheddyn er ynnyd-eggey Radio Vannin.",
