English,Manx,Notes
"Bob Carswell continues to host Claare ny Gael on a weekly basis and Shiaght Laa in series, totalling about 26 programmes per year.","Ta Bob Carswell foast ny chuirreyder er Claare ny Gael dagh shiaghtin as Shiaght Laa tra t’eh ymskeayllit, jannoo mysh 26 claareyn dagh blein.",
"Manx Radio also provides the platform on its AM1368 frequency for the BBC/Manx Radio co-productions, Traa dy Liooar and Jamys Jeheiney.","Ta Radio Vannin cur yn laare-ymskeaylley er MH1368 son ny co-obbraghyn eddyr Radio Vannin as y BBC, Traa dy Liooar as Jamys Jeheiney.",
These programmes are available from Manx Radio’s website on demand for a week after first broadcast.,Ta ny claareyn shoh ry-gheddyn veih ynnyd-eggey Radio Vannin er-aggyrtys son shiaghtin lurg v’ad er nyn ymskeaylley ‘sy toshiaght.,
Jamys Jeheiney remains the only radio show delivered entirely in Manx supporting both beginners and more fluent speakers by providing an opportunity to hear the language spoken in an informal and unrehearsed form outside of the classroom.,Ta Jamys Jeheiney foast yn un chlaare er y radio ta goll er ymskeaylley dy bollagh trooid Gaelgagh as t’eh currit da cooney toshiaghteyryn as adsyn smoo flaaoil liorish ymskeaylley yn chengey goll er loayrt ass y chamyr vrastyl ayns aght cadjin as gyn cliaghtey.,
The format of the show has changed a number of times over the years to maintain a variety of content and language use.,Ta cummey yn chlaare er caghlaa ny keayrtyn car ny bleeantyn son freayll caghlaa mooar dy eieyn as ymmyd chengagh.,
"Recently it has taken on the form of a general knowledge quiz, allowing a broad range of topics to be explored through the language.","Er y gherrid ta’n claare er chur mysh cummey noa myr keishtaghan tushtey cadjin ta shoh fosley yn claare da fodjeeaght foddey as lhean dy chooishyn dy ve ronsit trooid yn chengey.",
"Claare ny Gael and Shiaght Laa are also made available as podcasts, with an extensive online archive of past editions of each programme.","Ta Claare ny Gael as Shiaght Laa ry gheddyn myr pod-creeley lesh tashtey-recortys feayn as lhean jeh shenn lhiegganyn jeh dagh claare.",
"Manx content of most of these programmes is also compiled in a weekly podcast, Abbyr Shen Reesht, available on Manx Radio’s website and also through tunein, Apple, Google and Spotify.","Ta’n ayrn Gaelgagh jeh’n chooid smoo dy chlaareyn shoh ry-gheddyn ayns pod-creeley shiaghtinagh, Abbyr Shen Reesht, ta ry-gheddyn er’n ynnyd-eggey Radio Vannin chammah’s trooid tunein, Apple, Google as Spotify.",
Listeners can subscribe to download podcasts to their mobile.,Foddee eaishtee cur nyn laue dys jeelaadey podyn-creeley er nyn chooylagh neesht.,
"While programmes such as Claare ny Gael, Goll as Gaccan, Jamys Jeheiney, Shiaght Laa and Traa dy Liooar do not receive direct support from the Committee, the Committee is very supportive of these programmes and indeed supportive of any broadcaster which chooses to produce Manx Gaelic content and programming.","Eer nagh vel claareyn gollrish Claare ny Gael, Goll as Gaccan, Jamys Jeheiney, Shiaght Laa as Traa dy Liooar geddyn argid veih’n Ving, ta’n Ving greinnaghey ny claareyn shoh as ayns firrinys greinnaghey peiagh ny sheshaght erbee ta ymskeaylley, ny geearree ymskeaylley trooid Gaelg, ny ymmydey Gaelg ayns nyn glaareyn.",
"During the year some items were purchased for use by the Bunscoill Ghaelgagh in producing films and audio either for broadcast through the school’s website and social media, or for occasional use on Claare ny Gael and Goll as Gaccan.","‘Sy vlein shoh va cullee filmal as recoyrtyssey kionnit dy ve ymmydit ec paitchyn ny Bunscoill son jannoo fillymyn as coadanyn-sheean vees goll er ymskeaylley er ynnyd eggey ny meanyn sheshoil ny Bunscoill, ny dy ve ymmydit nish as reesht ayns Claare ny Gael as Goll as Gaccan.",
RBV awarded to Nigel Crowe,RBV er ny chur da Nigel Crowe,
"Nigel Crowe’s generosity in sharing his scholarship in relation to genealogy, land records and historical landscape was recognised in the award of the Reih Bleeaney Vanannan 2022.","Va Nigel Crowe er ny voylley son y feoiltys echey ayns skeaylley yn schoillaraght echey mychione genealogy, recortyssyn thallooin, as shennaghys y thalloo ayns Reih Bleeaney Vanannan 2022.",
"The panel of assessors singled out his long involvement with the Isle of Man Family History Society, the Isle of Man Natural History and Antiquarian Society, and the Manx Music Festival, noting that, without his work and enthusiasm, our understanding of the Isle of Man would be all the poorer.","Ren y ving cur tastey da’n obbyr echey harrish traa foddey son yn Isle of Man Family History Society, yn Isle of Man Natural History and Antiquarian Society, as y Manx Music Festival, as gra dy beagh yn tushtey ain jeh Mannin foddey s’boghtey fegooish yn obbyr vooar echey.",
"Nominations described Nigel as the ‘quintessential Manx scholar with a prodigious insight and memory’ who always showed great willingness to share information, reasoning and an understanding of his sources with enquirers around the world.","Ren sleih hug stiagh ennym Nigel son yn aundyr gra dy vel eh ny ‘ard-hampleyr jeh schoillar Manninagh as tushtey as toiggal mooar echey’ as dy vel eh dy kinjagh feer wooiagh dy rheynn yn tushtey as fysserree echey mychione e gheillyn er brialtee er feai-ny-cruinney.",
"They talked of his ‘deep love of the land itself, from walking over it for as long as he has been able, his head packed with information on the names and histories of people and places to share with his companions.’","Dimraa ad y ‘graih mooar ta echey er y thalloo hene, lesh shooyl choud’s t’eh er ve abyl, as y kione echey lhome lane ysseree mychione enmyn as skeealyn mychione sleih as buill, as eh hene dy kinjagh arryltagh dy rheynn eh er e heshaghyn.’",
Nigel is a former President and long-standing committee member of the IOM Natural History & Antiquarian Society.,Va Nigel keayrt fer-toshee as ta foast ny oltey jeh’n IOM Natural History & Antiquarian Society.,
"A founder member of the IOM Family History Society, he served as the society’s Chair for seven years, hosting the UK Federation AGM and conference on the Island in 1994, and is currently leading a project to transcribe the Sheading Rolls.","T’eh fer jeh ny chied olteynyn jeh’n IOM Family History Society, as v’eh Caairliagh y cheshaght shen son shiaght bleeaney, as ren eh stiurey chaglym bleinoil cadjin as co-haglym y UK Federation er yn Ellan ayns 1994. Ec y traa t’ayn t’eh leeideil shallee son mac-screeu ny Rollanyn Sheadin.",
"Brought up in the East Baldwin Valley, Nigel developed an interest in Manx history and family history in his teens, earning his living as a researcher for some time after his A levels.","Va Nigel troggit ayns Baldwin Shiar as ghow eh toshiaght dy chur tastey da shennaghys Manninagh as shennaghys cleinyn Manninagh tra v’eh ny ghooinney aeg. Ren eh gobbragh myr aa-ronseyder son paart dy hraa lurg ny A levels echey.",
He created the manxroots.com website in 2004 to share research into Manx records.,Chroo eh manxroots.com ayns 2004 dy rheynn yn aa-ronsaghey echey mychione recortyssyn Manninagh.,
"His professional life concentrated on the built environment, estate management, and work as a chartered surveyor, and he is a Fellow of the Royal Institution of Chartered Surveyors.","Ayns y vea phrofeshoonagh echey ren eh gobbragh er buildalyn, farrys-thie son stateyn-thallooin, as obbyr myr ard-vasoonagh charterit, as t’eh Fellow jeh’n Royal Institution of Chartered Surveyors.",
"He is a graduate of the University of Reading with a BSc (Hons) in Land Management, and was a professional valuer and then Director with a leading and long-established firm of Chartered Surveyors and Estate Agents for almost 25 years.","Hooar eh Bsc (Hons) ayns Farrys-thie Thallooinagh, as v’eh feeagheyder profeshoonagh as eisht Stiureyder jeh sheshaght vooar as ard-ghooagh dy ard-vasoonee charterit as creckeyderyn thalloo son ny smoo na 25 bleeaney.",
"As his research interests moved beyond Manx genealogy, Nigel made a detailed study of the development of most of the Island’s towns, the evolution of roads, field-boundaries, and landscape history in general.","Myr ghow Nigel toshiaght dy yeeaghyn er cooishyn cheu-mooie jeh genealogy Manninagh, ren eh jannoo studeyrys geyre er shennaghys paart jeh ny baljyn mooarey ayns Mannin, raaidjyn, caglieeyn magheryn, as shennaghys y thalloo.",
"Nigel understands how intimately people and the landscape - urban or rural - are connected, how that landscape has shaped us, and how we have shaped the landscape over centuries.","Ta Nigel toiggal kys ta’n theay as yn thalloo – ayns baljyn as er y cheer – sniemmit cooidjagh, kys ta’n thalloo er chummey shin, as kys ta shinyn er chummey y thalloo trooid ny sheelogheyn.",
"He unstintingly shares that knowledge through excursions and lectures, particularly with the Isle of Man Natural History & Antiquarian Society.","T’eh rheynn yn tushtey echey er sleih elley trooid turryssyn as loayrtyssyn, er-lheh marish y Isle of Man Natural History & Antiquarian Society.",
"His research papers, conferences, talks and book chapters number over thirty.","T’eh er yannoo ny smoo na jeih as feed dy phabyryn, co-haglymyn, loayrytyssyn as cabdilyn lioar.",
"Nigel is also known for having a very fine voice, someone who has performed as a singer and public speaker at countless Young Farmers contests, eisteddfods, and as a ‘Special Bass’ in the Guild – Manx Music Festival – itself.","T’eh ayns ard-ghoo son y choraa vraew echey, as t’eh er ghoaill arrane as er loayrt ec ymmodee co-hirraghyn Young Farmers, eisteddfodyn, as myr ‘Special Bass’ ec yn Guild hene.",
Until recently he enjoyed singing with various local choirs.,Cha nee foddey er dy henney as v’eh foast goaill arrane ayns paart dy heshaghtyn kiaullee ynnydagh.,
"He worked to restore and catalogue the late Ian Cannell’s recordings of the Guild, and was a driving force behind the Festival’s 125th anniversary exhibition in 2017.","Ren eh gobbragh er lhiassaghey as jannoo recortys jeh recortyssyn Ian Cannell jeh’n Guild, as va ayrn mooar echey jannoo taishbynys son shey feed blein as queig jeh’n Guild ayns 2017.",
"The Reih Bleeaney Vanannan or Manannan’s Choice of the Year is the Isle of Man’s highest cultural honour, awarded by Culture Vannin, and decided by a selection panel which is made up of representatives from Yn Cheshaght Ghailckagh, Yn Chruinnaght, Manx National Heritage, IOM Arts Council and Culture Vannin itself.","Ta Reih Bleeaney Vannin yn onnor cultooroil syrjey oddys ve er ny stowal er peiagh. T’eh currit magh liorish Culture Vannin, as ta reiht liorish bing ta jeant seose jeh sleih shassoo ass lieh Yn Cheshaght Ghailckagh, Yn Chruinnaght, Coonceil ny Hellynyn, Eiraght Ashoonagh Vannin, as Culture Vannin hene.",
"The presentation was made at a meeting of the Family History Society, and Nigel nominated the Manx Y-DNA Study as the recipient for a donation of £500 linked to the award.","Va’n aundyr er ny chur ec meeiteil y Family History Society, raad ren Nigel genmys y Manx Y-DNA Study dy gheddyn gioot dy £500 ta kianglt rish yn aundyr.",
"Words from one of the many nominations summed his remarkable contribution up best: ‘Everything Nigel does is with passion for matters Manx, and a passion to gather and spread knowledge…the Island is culturally richer for Nigel’s diverse contributions.’","Ren fer jeh’n sleih ren genmys Nigel son yn aundyr soilshaghey dy mie cre’n fa ta’n obbyr echey cha scanshoil: ‘Ta dy-chooilley red ta Nigel jannoo jeant lesh graih son cooishyn Manninagh, as jeeanid dy hymsagh as skeaylley tushtey…ta Mannin ny s’berchee son y chaghlaa mooar dy obbyr t’eh er yannoo.’",
