Manx,English,Diplomatic,Notes
Crookhaven,Crookhaven,Crookhaven,
"Deiney beggey voish Skylley Chreest; doo, mollagh as carraneyn croie crispit orroo. Ta’n earrish er ve feer feayr ain çheet er gys shoh, er lhiam dy row eh goll ayns my chraueyn. T’eh ny s’fastee sthie ayns Crook na ve mooie ec yn cheayn. ","Little men from Rushen; black and hairy, wearing hard, dried up  carranes (rawhide shoes without a sole). We have had very cold weather coming here, I think it was getting in my bones. It is more sheltered in at Crook than being out at sea.","Dheiney beggey voish skilley chree Dhoo mollyagh as caaraneyn croi cripsyt orroo, Ta yn earysh er ve feer feayr ain cheet er gys shoh, erlhiam dy row eh gholl ayns my craueyn, Te ny s’fastee stie ayns crook ny ve moie eck yn cheayn, ",
"     Va ny shenn Vanninee cliaghtey cur far-ennym er lane jeh yn sleih, as baatyn myrgeddin. Ta mee cur diu paart jeh far-enmyn ny baatyn ta aym foast ayns cooinnaghtyn: ","The old Manx people were putting a nickname on many of the people, and boats too. I’m giving you some of the nicknames of the boats that I still remember:","va ny shen vanninee cliaghtey chur ferennym er lane jeh yn sleih, as baathyn morgheddyn, Ta mee chur diu paart jeh fer-enmyn ny baathyn ta aym foast ayns cooinniaghtyn. ",
     Yn Bucker Dewil; Baatey Çheu y Clieau; Bag Puddyn; Thunnag-ghoo; Colly Womler; Sharragh Lieh Chollagh; Hurdy Gurdy; Donkey; Poyll wooar ; Poyll veg; Vrasnag; Breeçhyn; Guy; Minjeig; Carroo Beg; Pan; Muc Laair; Goull; Bustyn Mooar; Single Sporran; Glashtin Beg; Glashtin Mooar; Boid-y-Chonnee; Mohlt; Yn Vuc Veg; Boteil; Buggane; Baatey Çhirrym; Yn Migler Wooar; Kitty Balda.,The Cruel Bucker; The Mountainside Boat; Pudding bag; Black Duck; Colly Wobbler; The Half-Male Foal; Hurdy Gurdy; Donkey; Big Pool ; Puddle; Firebrand; Britches; Guy; Yearling Goat; Little Carp; Pan; Mare-Pig; Sunbeam; Big Busts; Single Purse; Little Goblin; Big Goblin; Stonechat; Mutton; The Little Pig; Bottle; Buggane; Dry Boat; The Big ‘Miggler’; Kitty Balda.,Yn bucker dile. baathey cheau cleau. bag puddyn. chunnag-ghoo. Colly womler. sharragh Lheih. Collagh. Hurdy gurdy. Donky. Phoul wooar. Phoul veg Vrasnag. Breechyn. Guy mingagh Carroo beg. Pan muck Laayre. ghoall bustyn mooar. Single sporran. Glastin beg. Glastin mooar. Bod y chonney. Molt. Yn vuck veg. Booteil. Bogane. Baathey cherrym. Yn migler wooar. Kitty balda.,"Phoul, Another possible meaning; pohll, ‘a pole stone’, used for weighting nets (Cregeen)."
,,,
