English,Manx,Notes
Introduction,Goan-Foslee,
"The second joint Manx Language Strategy (2022 – 2032) is a ten-year vision for effective, coordinated support for the promotion and delivery of the Manx language. This interim report relates to the second year of the strategy.",Ta’n nah Strateysh copharteeagh son y Ghaelg (2022 - 2032) ny ashlish jeih bleeaney son dy chur cooney ta fondagh as ta er ny cho-oardaghey cour cur er e toshiaght as cur ayns bree yn ghlare Vanninagh. Ta’n tuarastyl shallidagh shoh bentyn rish y nah vlein jeh’n strateysh.,
"The second year of the Manx Language Strategy (2022–2032) marks a continued commitment to promoting and delivering the Manx language effectively. Building on the foundations laid in the first year, Jeebin, the Manx Language Network, remains focused on creating a comprehensive, coordinated approach to support the language’s growth and visibility both on the Island and within the wider diaspora, working alongside the many voluntary groups that support the Manx language in diverse ways to achieve this.","She cowrey barrantys kinjagh son cur er e toshiaght as cur magh yn Ghaelg er aght fondagh ta’n nah vlein jeh’n Strateysh son y Ghaelg (2022-2032). As ad troggal er undinyn v’er nyn soiaghey ayns y chied vlein, ta Jeebin, The Manx Language Network, tannaghtyn dy chur tastey er-lheh da croo saase ooilley-ghoaillagh, er ny cho-oardaghey, ta cooney lesh yn ghlare dy aase as yn aght t’ee ry-akin chammah er yn Ellan as fud yn diaspora smoo. Ta Jeebin gobbragh marish ymmodee possanyn dy arryltee ta cummal seose yn Ghaelg ayns caghlaaghyn aght dy chooilleeney shoh.",
"Over the past year, progress has been made towards our strategic focus on raising awareness and enhancing education, with a continued emphasis on making the language accessible to all. This has involved increased efforts to provide wider access to training and the development of new resources, something that has been enhanced by the increasing use of technology for both resource development and access to training. Considerable attention has been devoted to fostering collaboration and aligning projects to develop new both visual and written resources based on identified needs, preventing duplication, and ensuring continuity. This approach has proved particularly effective in resource development across organisations. In addition, the ongoing development of the corpus enables us to explore and gain a deeper understanding of our language.","Car ny bleeaney chaie, va shin goll er nyn doshiaght dy mie lesh yn dean strateyshagh ain ta shen dy ghra dy hroggal toiggal as fys as dy vishaghey ynsagh, as tastey er-lheh er ny choyrt dy kinjagh da jannoo yn ghlare foshlit da dy chooilley pheiagh. Ghow shin ayns laue dy osley traenal da ny smoo dy ‘leih as dy chroo ny smoo couyryn, va shoh er ny vishaghey liorish ymmyd smoo dy haghnoaylleeaght son yn jees oc. Ta tastey vie er ve currit da bishaghey co-obbraghey as çheughey shaleeyn dy chroo chammah couyryn scruit noa as couyryn sooilley noa va soit er femeyn cronnit, shaghney dooblaghey nyn eabyn as shickyraghey sheerid. Ta’n saase shoh er phrowal feer vie dy chroo couyryn tessyn sheshaghtyn. Chammah’s shoh, ta lhiasaghey yn chorpus, ta goll er dy kinjagh, cur caa dooin nyn nglare y ronsaghey as toiggalys s’duiney y gheddyn jee.",
"The Isle of Man hosted a monitoring visit from the European Charter for Regional and Minority Languages Committee of Experts to assess how the Charter is applied within the Isle of Man. This visit was followed by the publication of a monitoring report in June 2024, which outlined a series of recommendations for further consideration which will actioned where possible.","Haink sleih veih Bing Oaylleeyn Conaant Coonceil yn Oarpey son Glaraghyn Ardjynagh as Myn-ghlaraghyn dys Mannin er turrys sessal v’er ny chummal ayns yn ellan dy hessal kys ta’n Conaant goll er cur ayns bree ayns Mannin. Erreish da’n sleih shoh shilley y choyrt er Mannin, va tuarystal sessal er ny choyrt magh ayns mee veanagh y touree 2024, hoilshee rolley dy haaseyn moyllit lhisagh ve er nyn resooney ny sodjey as er nyn goyrt ayns bree raad vees shen possibyl.",
"The progress detailed in this report during the second year of the Manx Language Strategy, along with the strong dedication to future progress, highlight the ongoing commitment to the development of the Manx language. This progress is further highlighted by the collective efforts spearheaded by Jeebin, in close collaboration with the broader language community. Together, these initiatives serve as a testament to the shared responsibility and determination to ensure the sustained growth and vitality of the language in the years to come","Ta’n coontey ta jeant ayns y tuarystal shoh jeh’n aght ta reddyn goll er nyn doshiaght ayns y nah vlein jeh’n Strateysh son y Ghaelg, as marish shen yn jeeanid t’er ny hoishaghey da gleashagh reddyn er nyn doshiaght ny smoo ‘sy traa ry-heet, soilshaghey magh dy vel barrantys kinjagh ayn dy lhiasaghey yn Ghaelg. Ny sodjey, ta’n speeideilys shoh jeant baghtal liorish yn aght ta sheshaghtyn er cho-obbraghey fo stiurey Jeebin, ta gobbraghey marish yn phobble glare cadjin. Cooidjagh, ta ny ventyryn shoh gymmyrkey feanish jeh’n churrym as yn slane-jeeanid ec dy chooilley pharteeas dy hickyraghey aase beayn as speeideilys y ghlare ayns y traa ry-heet.",
Theme 1: Appropriate & accessible resources,Cooish 1: Couyryn cooie ta ry-gheddyn dy haashagh,
Strategic Commitment,Dean Strateyshagh,
"We will encourage the development, publication and promotion of new resources.","Nee mayd greinnaghey croo, cur-magh as cur er nyn doshiaght jeh couyryn noa.",
"We will ensure any developed resources are coordinated, appropriate and of good quality, across all ages and stages.","Nee mayd shickyraghey dy bee couyryn erbee vees crooit er nyn go-oardaghey, cooie as jeh foaynoo mie, bentyn da dy chooilley eash as keim.",
We will work to ensure greater digitisation of Manx Language resources at all levels.,Nee mayd gobbragh dy hickyraghey dy bee tooilley couyryn Gaelgagh currit ayns cummey bun-earrooagh ec dy chooilley cheim.,
Progression,Goll er e hoshiaght,
Mooinjer Veggey’s Resources Officer created an online Leader’s Portal on their website. This is currently only accessible by the Possan Cloie (parent and tots’ group) leaders while it is populated with new resource packs.,Ren Fer-Oik Couyryn Vooinjer Veggey croo Portal Leeideilee er-linney er yn ynnyd-eggey oc. Ta shoh foshlit ynrican da leeideilee y Phossan Cloie (possan son paarantyn as lhiennoo) choud’s ta paggaghyn couyryn goll er chur er.,
The Resources Officer is also currently working with Possan Cloie leaders to create learning materials specifically for the parents of Possan Cloie children with vocabulary targeted at the parents of 0–4-year-olds.,"Ta’n Fer-Oik Couyryn gobbragh neesht marish leeideilee Possanyn Cloie dy chroo stoo-ynsee er-lheh cour paarantyn ta nyn gloan ayns Possan Cloie, as bee yn tasht-fockle jeant cooie da paarantyn cloan ta eddyr 0 as 4 bleeaney dy eash.",
"Mooinjer Veggey has produced several new resources for primary school, preschool and parents.  They have published two series of ‘Early Reader’ chapter books, Orree and Otto, for Bunscoill Ghaelgagh.","Ta Mooinjer Veggey er chroo shiartanse dy chouyryn noa cour bunscoillyn, roïe-scoillyn as paarantyn. T’ad er chur magh daa strane dy lioaryn ‘Lhaihder Aeg’ Orree as Otto, rheynnit ayns cabdilyn, cour yn Vunscoill Ghaelgagh.",
"Bunscoill Ghaelgagh teacher Aalin Clague has written two new series of early readers about Celts and Vikings written in easily decodable text, to follow on from the Orree and Otto books commissioned and produced by Mooinjer Veggey for the school. These are yet to be published","Ta ben-ynsee y Vunscoill Ghaelgagh, Aalin Clague er screeu daa strane noa dy lioaryn lhaihder aeg mychione ny Celtiee as ny Shenn Loghlinee er nyn screeu ayns glare so-hoiggal, ta geiyrt er lioaryn Orree as Otto va er nyn oardaghey as er nyn yannoo liorish Mooinjer Veggey son y scoill. Cha nel ad shoh er ve currit magh foast.",
"Bunscoill Ghaelgagh teacher, Adrian Cain, created a new Manx course for families of Bunscoill Ghaelgagh, entitled Cre ren oo jiu? There is a textbook, accompanying digital content and weekly, in-person lessons supported by a WhatsApp group.","Ren fer-ynsee y Vunscoill Ghaelgagh, Adrian Cain, coorse Gaelgagh noa y chroo cour lughtyn-thie y Vunscoill Ghaelgagh, enmyssit Cre ren oo jiu? Ta lioar-teks ayn, cooid vun-earrooagh ta goll maree, as lessoonyn shiaghtinoil ta ayns-persoon, as possan WhatsApp dy chooney lesh studeyryn.",
Bunscoill Ghaelgagh pupils created new films in Manx and were shortlisted for BBC Alba’s Film G competition for Yn Doour.,Chroo paitçhyn y Vunscoill Ghaelgagh filmyn noa ayns Gaelg as va Yn Doour er ny choyrt er y rolley giare son co-hirrey Film G er BBC Alba.,
"Yn Skimmee Gaelgagh (Manx Language Unit) have further developed their website with Key Stage 2 interactive resources https://manxlanguage.sch.im/. Members of the team have contributed additional digitised searchable materials to the Manx Corpus website, development of an interactive gamified course commencing with using vocabulary from Key Stage 2 to develop speaking, listening, reading, and writing skills.","Ta’n Skimmee Gaelgagh er lhiasaghey nyn ynnyd-eggey ny sodjey trooid cur couyryn eddyr-obbragh cour Ard-Cheim 2 er, https://manxlanguage.sch.im/. Ta oltyn y skimmee er chur ny smoo stoo ayns cummey bun-earrooagh oddys sleih ronsaghey er ynnyd-eggey yn Chorpus Gaelgagh.  T’ad er choo coorse eddyr-obbragh jeant ny ghamman, ta goaill toshiaght lesh tasht-fockle veih Ard-Cheim 2 dy yannoo ny share schleiyn loayrt, eaishtagh, lhaih as screeu.",
"Over the past year, the Manx Language Research Group (MLRG) continued to consolidate its activities with regard to the Manx Corpus website https://corpus.gaelg.im as well as research dissemination and outreach activities. Highlights have included organizing the Ned Maddrell Lecture at the Cooish, and being awarded a £3000 grant from Culture Vannin adding time-stamped transcriptions and translations of Manx language archive recordings to the corpus.","Car ny bleeaney chaie, ta’n Possan Ronsee Gaelgagh er hannaghtyn dy yeeraghey yn obbyr oc er ynnyd-eggey yn Chorpus Gaelgagh https://corpus.gaelg.im chammah’s skeaylley magh obbyr ronsee as cooishyn ta roshtyn magh dys y theay. Mastey ny reddyn cooilleenit dy mie va reaghey Leaght Ned Maddrell ec y Chooish, geddyn toyrtys argidoil jeh £3000 veih Culture Vannin son mac-screeunyn as çhyndaaysyn y yannoo jeh shenn recortyssyn Gaelgagh, cowraghyn-traa y choyrt orroo, as ad y chur ayns y Chorpus.",
"The Manx Corpus website has grown significantly and now contains 2,039,805 words across 750 documents, up from 1,826,332 words and 719 documents last year.","Ta ynnyd-eggey yn Chorpus Gaelgagh er n’aase dy jarroo as nish t’eh cummal 2,039,805 fockle harrish 750 docamadyn, shoh mooadaghey cosoyllit rish 1,826,332 fockle as 719 docamadyn veih nurree.",
"New developments include the addition of new archive audio material with timestamped transcriptions and translations, drawing on the materials recently catalogued and remastered via Manx National Heritage’s participation in the British Library’s ‘Unlocking Our Sound Heritage’ initiative. Priority is being given to native speaker recordings, but many of the tracks also contain material from prominent pioneering revivalists from the mid-twentieth century, including Douglas Fargher, William Radcliffe, and a teenage Brian Stowell. This work is being undertaken by Manx language expert Paul Rogers, supported by a grant of £3,000 from Culture Vannin. The first track to be completed was launched to significant interest at the Ned Maddrell Lecture at the 2023 Cooish festival.","Mastey reddyn noa ta shenn recortyssyn elley, lesh cowraghyn-traa orroo as çhyndaaysyn as mac-screeunyn jeant jeu er ve currit ayns y chorpus. T’ad shoh goit veih recortyssyn va catalogit as aavainshterit er y gherrid tra ghow Eiraght Ashoonagh Vannin ayrn ayns shalee y Lioarlan Goaldagh ‘Unlocking Our Sound Heritage’. Ta tastey er-lheh goll er cur da recortyssyn ny loayrtee dooghyssagh, agh ta mooarane jeh ny trackyn cummal stoo veih leeideilee scanshoil yn aavioghey neesht, veih mean yn ‘eedoo cheead, goaill stiagh Doolish y Karagher, Illiam y Radlagh, as Brian Stowell tra v’eh ny yeigeyr. Ta Paul Rogers, fer mie-ynsit ayns cooishyn Gaelgagh goaill ayns laue yn obbyr shoh, as cooney echey veih toyrtys argidoil jeh £3,000 voish Culture Vannin. Va’n chied track va jeant aarloo er ny lunney ec Leaght Ned Maddrell ayns feailley yn Chooish 2023 as va sleih soiaghey mooar jeh.",
"Other additions include the important 1763 edition of the New Testament Gospels and Acts, further instalments of Bishop Wilson’s sermons, as well as numerous items from twentieth-century newspapers which document the development of the language revival movement as well as the Island’s social and cultural history.","Mastey reddyn noa elley er ny choyrt da’n chorpus ta’n cur magh scanshoil voish 1763 jeh Sushtalyn as Jannooyn y Chonaant Noa, meeryn elley jeh sharmaneyn y niaspick Wilson, chammah’s ymmodee peeshyn elley veih pabyryn-naight yn ‘eedoo cheead ta myr docamad jeh aavioghey ny Gaelgey as shennaghys sheshoil as cultooroil yn Ellan myrgeddin.",
"Beyond the corpus, Dr Christopher Lewin has completed the draft of his new edition of Edmund Goodwin's First Lessons in Manx for Yn Cheshaght Ghailckagh (Manx Language Society), and it is hoped it will be published. Dr Lewin has also created a pronunciation and spelling guide with financial support from Culture Vannin, which will be released soon. Additionally, Professor Max W. Wheeler's new edition of Pargeiys Caillit (Paradise Lost) is nearing publication, also to be released by Yn Cheshaght Ghailckagh. This landmark of Manx literature was the topic of Professor Wheeler’s Ned Maddrell Lecture.","Chammah’s yn corpus, ta Dr Custal Lewin er chooilleeney dreaght yn chur magh noa echey jeh First Lessons in Manx liorish Edmund Goodwin ass lieh Yn Çheshaght Ghailckagh, as t’eh jerkit dy bee eh currit magh. Ta Dr Lewin er chroo lioar-stiuree cour fockley magh as lettraghey neesht lesh cooney argidoil veih Culture Vannin, vees currit magh dy leah. Ny sodjey, ta cur magh noa yn Olloo Max W. Wheeler jeh Pargeiys Caillit faggys da ve aarloo dy ve currit magh, liorish Yn Çheshaght Ghailckagh myrgeddin. She yn ard-teks shoh ayns lettyraght Vannin va cooish Leaght Ned Maddrell v’er ny choyrt liorish yn Olloo Wheeler.",
"Culture Vannin has created and published over 1,000 sound files on the Learn Manx website, in the ‘spoken dictionary’ area.  This incorporates digitising and editing recordings created by the late Brian Stowell to help families access and use Manx, creating 800 individual sound files which are accessible here.","Ta Culture Vannin er chroo as er chur magh ny shlee na 1,000 coadan sheean er ynnyd-eggey Ynsee Gaelg, raad ta’n ‘Fockleyr Loayrt’ ry-gheddyn. Ta shoh goaill stiagh cur ayns cummey bun-earrooagh as femblal recortyssyn chroo Brian Stowell (nagh vel er mayrn) dy chooney lesh lughtyn-thie roshtyn as jannoo ymmyd jeh Gaelg, ta shen dy ghra 800 coadan sheean er nyn groo ta ry-gheddyn ayns shoh.",
"A set of 25 ‘chatbots’ was developed and published in April 2024 to support learners on the first part of Culture Vannin’s four-part course, Loayr Gaelg. These give learners the capacity to consolidate their Manx through some simple reading and writing exercises. The chatbot can offer support and reacts in real-time to responses.","Ta set dy 25 ‘çhatbotyn’ er ny chroo as er ny chur magh ayns mee s’jerree y niarree 2024 dy chooney lesh ynseydee er y chied ayrn jeh coorse Culture Vannin ta kiare ayrn echey, Loayr Gaelg. T’ad shoh cur da ynseydee yn caa dy niartaghey yn Ghaelg oc trooid cliaghtaghyn lhaih as screeu aashagh. Foddee yn çhatbot çhebbal cooney as t’eh freggyrt feyshtyn çhelleeragh.",
"The first Culture Vannin Manx Gaelic Summer School for adults was introduced in July 2023. It took place across the course of five days and was intentionally scheduled to coincide with Yn Chruinnaght Celtic Gathering festival. Two courses took place, and 20 students attended, including eight students who had travelled to the Island to take part. The summer school is planned to be an annual event.","Va’n chied Scoill Souree Ghaelgagh ayn son sleih aasit ayns mee s’jerree yn touree 2023. V’ee queig laa er liurid as er ny cummal as ee kiarit dy ve ec yn un traa as va feailley Yn Chruinnaght goll er. Va daa choorse ayn, as va 20 studeyr ayn, goaill stiagh hoght studeyryn v’er hroailt dys yn Ellan dy ghoaill ayrn. T’eh kiarit dy bee yn Scoill Souree taghyrt dagh blein maghey shoh.",
"Jeebin now has a resources sub-committee, which has met three times. This aids Jeebin members working within education to focus on need, work collaboratively, and avoid duplication.","Ta fo-ving couyryn ec Jeebin nish, t’er veeiteil three keayrtyn. Ta shoh cooney lesh oltyn Jeebin ta gobbragh ayns cooishyn ynsee dy chur tastey er-lheh da feme, co-obbraghey, as shaghney doobley nyn eabyn.",
Future Work,Obbyr yn Traa Ry-heet,
"Mooinjer Veggey have significant ambition to produce a lot more video, audio and written material for use in preschool, primary school and by families using Manx to raise their children. It is also intended that the recently developed online Leader’s Portal will soon be made available to the public.","Ta Mooinjer Veggey feer jeean dy chroo foddey smoo stoo ayns cummey feeshan, sheean, as scruit dy ve jeant ymmyd jeh ayns roïe-scoillyn, bunscoillyn as liorish lughtyn-thie ta jannoo ymmyd jeh’n Ghaelg as ad troggal nyn gloan. T’eh kiarit neesht dy bee yn Portal Leeideilee, va er ny chroo er y gherrid jeant foshlit da’n theay dy leah.",
"The Bunscoill Ghaelgagh intends to develop further decodable readers, including a set of animal stories written by teacher Aalin Clague inspired by Manx Fairy Tales.","Ta’n Vunscoill Ghaelgagh kiarail dy yientyn ny smoo dy lioaryn so-lhaih, nyn mast’oc strane dy skeealyn baagh er nyn screeu liorish ben-ynsee Aalin Clague hooar breeaghys veih Skeealyn Mooinjer Veggey Vannin.",
"Yn Skimmee Gaelgagh is still engaged in the development of support resources and a video-based grammar course with the involvement of young Manx speakers. Also, to be added on their website digital guided readers with animations, further development of the course vocabulary. In addition, the team are further enhancing the Manx Corpus by adding a wider variety of texts including those appropriate for younger learners and readers of Manx.","Ta’n Skimmee Gaelgagh foast lhiasaghey couyryn coonee as coorse grammar feeshanagh ta goaill stiagh loayrtee Gaelgagh aegey. Bee lioaryn lhaih stiurit lesh annymaghtyn, as tasht-fockle smoo son y choorse er nyn goyrt er yn ynnyd-eggey oc neesht. Ny sodjey, ta’n skimmee jannoo ny share jeh’n Chorpus Gaelgagh trooid cur caghlaa mooar dy heksyn huggey nyn mast’oc teksyn ta cooie da ynseydee as lhaihderyn Gaelgagh saa.",
The Culture Vannin grant for the MLRG will fund continued work on audio archive material for the next year and a half. Individual tracks will be made available as and when they are finished.,Ver toyrtys argidoil Culture Vannin da’n Phossan Ronsee Gaelgagh argid cour tooilley obbyr bentyn rish shenn recortyssyn rish y vlein dy lieh shoh çheet. Bee trackyn ry-gheddyn tra vees ad jeant as aarloo.,
"Other materials will continue to be added from all periods of the language. Upcoming additions include the remaining text of Phillips’ Prayer Book, the earliest extended text in the language (c. 1610), and a range of more recent texts such as selected extracts from Brian Stowell’s autobiography.","Bee stooghyn elley currit hug yn Chorpus veih dy chooilley eash jeh’n ghlare. Mastey reddyn vees currit huggey dy gerrid ta cooid elley yn teks Lioar Phadjeragh Phillips, yn teks mooar s’moghey ayns y çhengey (c.1610), as caghlaa dy heksyn s’jeianee lheid as meeryn reiht ass hene-hennaghys Vrian Stowell.",
"Beyond the immediate goals, MLRG aims to explore innovative ways in which the Corpus can serve as the foundation for future resources, potentially leading to the development of new dictionaries and language tools.","Çheu-mooie jeh ny deanyn t’ad goaill ayns laue ec y traa t’ayn, ta’n PRG kiarail dy gheddyn magh aghtyn noa-chliaghtagh ayndoo oddys yn Corpus ve myr undin son couyryn ‘sy traa ry-heet, oddagh leeideil dys croo fockleyryn as greinyn-çhengey noa.",
Theme 2: Manx as an important part of national & cultural identity.,Cooish 2: Gaelg myr ayrn scanshoil jeh enney ashoonagh as cultooroil,
Strategic Commitment,Dean Strateyshagh,
"We will work together to ensure that Manx language continues to be visible, inclusive and accessible.","Nee mayd gobbragh cooidjagh dy yannoo shickyr dy jean yn Ghaelg tannaghtyn dy ve ry-akin mastey’n theay, foshlit da dy chooilley pheiagh as aashagh dy gheddyn.",
"We will promote Manx as a valued part of our distinctive contemporary, cultural and national identity",Nee mayd cur y Ghaelg er e toshiaght myr ayrn scanshoil jeh’n enney ashoonagh as cultooroil er-lheh as noa-emshyragh ain.,
We will ensure that the advantages of bilingualism are recognised.,Nee mayd jannoo shickyr dy bee vondeishyn daa-hengaghys er nyn doiggal.,
Progression,Goll er e hoshiaght,
"Mooinjer Veggey continues to frequently promote the Manx language through its Possan Cloie groups, through its nursery and through its social media.","Ta Mooinjer Veggey tannaghtyn dy chur er e toshiaght yn Ghaelg trooid nyn Bossanyn Cloie, nyn roïe-scoill as nyn meanyn sheshoil oc.",
There has been difficulty this year recruiting a development officer to replace a previous officer. A successful recruitment process has recently taken place for an officer who will promote the use of Manx and expand the number of active supporters and use of Manx.,V’eh doillee myleeaney fer-oik-lhiasee y phointeil dy ghoaill ynnyd fer-oik v’ayn roïe. Va speeideilys ayn er y gherrid tra va fer-oik er ny phointeil vees cur er e hoshiaght ymmyd ny Gaelgey as vees mooadaghey yn earroo dy ‘leih ta pohlldal as jannoo ymmyd jeh’n Ghaelg.,
"Bunscoill Ghaelgagh pupils and teachers raised the profile of Manx by representing the language at national and international events. This included winning the Crucial Crew cup for the second year in a row with a film in Manx Gaelic (the competition is for all Year 6 classes on the Island), presenting stories written in Manx on Tynwald Day and participation and success sharing our language at Aundyryn Kiaull Theay Vannin, the Manx Folk Awards and the Manx Music Festival. Two of our pupils were proud to represent the Island in Glasgow for the FILM G awards in February.","Hrog paitçhyn as fir as mraane-ynsee y Vunscoill Ghaelgagh enney er y Ghaelg liorish shassoo ass lieh yn ghlare ec taghyrtyn ashoonagh as eddyr-ashoonagh. Ghow shoh stiagh cosney cappan yn Crucial Crew son daa vlein ass y cheilley lesh fillym ayns Gaelg (ta’n co-hirrey foshlit da dy chooilley vrastyl Blein 6 er yn Ellan), taishbyney skeealyn scruit ayns Gaelg ec Feaill’Eoin as goaill ayrn ayns Aundyryn Kiaull Theay Vannin as yn Guild as cur magh dy speeideilagh nyn jengey ain.  Va jees jeh nyn baitçhyn scoill moyrnagh dy hassoo ass lieh Vannin ayns Glaschu ec aundyryn Film G ayns y chied vee jeh’n niarragh.",
We were able to promote the language during our filming of the UNESCO Biosphere award winners’ film https://youtu.be/M-yN2Iu7mLY?si=3-PeEuR3hFYorBbe,Va shin abyl dy chur er e toshiaght yn çhengey tra va shin jannoo yn fillym chossyn aundyr Biosphere UNESCO https://youtu.be/M-yN2Iu7mLY?si=3-PeEuR3hFYorBbe,
"Bunscoill Ghaelgagh teacher, Adrian Cain, coordinates Bunscoill Ghaelgagh Manx content for social media, with the 100 Laa series on Instagram having had nearly 160,000 plays so far.","Ta fer-ynsee y Vunscoill Ghaelgagh, Adrian Cain, co-oardaghey stoo ny meanyn sheshoil jeant ec y Vunscoill Ghaelgagh, as ta’n strane 100 Laa er Instagram er ve er ny chloie bunnys 160,000 keayrt choud’s shoh.",
Yn Skimmee Gaelgagh has provided Manx lessons in schools upon request and actively promoted and supported the use of Manx within the Island’s educational institutions. Yn Skimmee Gaelgagh teachers have taken part in specialist language teacher training organised by Culture Vannin to further enhance their lesson delivery skills. Members of Yn Skimmee Gaelgagh contributed submissions to experts on Island regarding the promotion of the Manx language.,Ta’n Skimmee Gaelgagh er chiarail lessoonyn Gaelgagh ayns scoillyn tra ta’d shirit as t’ad dy breeoil cur er e hoshiaght ymmyd ny Gaelgey ayns sheshaghtyn ynsee yn Ellan. Ta fir as mraane-ynsee yn Skimmee Gaelgagh er ghoaill ayrn ayns traenal ynsee er-lheh va reaghit ec Culture Vannin dy yannoo eer ny share nyn schleiyn son gynsagh lessoonyn. Ta oltyn yn Skimmee Gaelgagh er choyrt treealtyssyn dys oaylleeyn er yn Ellan bentyn rish cur yn ghlare Vanninagh er e toshiaght.,
"The Manx Language Officer attended the Celtic Knot conference in Waterford, Ireland, and Scottish language forum in Belfast, Ireland.",,Not translated in the original
